seq	RecordID	RecordTitle	PathID	Title	AlphaPubDate	PubYear	bookauthor	booktitle	bookdate	matchquality	isfiction	howpositive	genresnamed	comments
1300	9006885	Evenings at Haddon Hall.	20160127191335_00001	The Athenaeum	Oct 25, 1845	1845	baroness, Calabrella, E. C. de	Evenings at Haddon Hall	1846	3.2217385436022594				
1301	8800710	The Fall of Prince Florestan of Monaco.	20160127191542_00003	The Athenaeum	Mar 21, 1874	1874	Dilke, Charles Wentworth, Sir	The fall of Prince Florestan of Monaco	1874	3.721204481792717				
1302	3185039	DAYS SPENT ON A DOGE'S FARM.	20160127183527_00008	The Bookman	Dec 1908	1908	Symonds, Margaret	Days spent on a doge's farm	1893	3.2999118905607725				
1303	4382380	BLONDEL PARVA.	20160127193122_00012	The London review of politics, society, literature, art, and science	Nov 28, 1868	1868	Blondel Parva	Blondel Parva. [A novel]	1868	2.2533452239397547				
1304	8846150	Dulcie Everton.	20160127193122_00012	The Athenaeum	Oct 3, 1896	1896	Linton, E. Lynn (Elizabeth Lynn)	Dulcie Everton	1896	2.662857142857143				
1305	8927191	CHRISTMAS BOOKS.	20160127192303_00008	The Athenaeum	Dec 21, 1895	1895	Thackeray, William Makepeace	Christmas books	1896	2.345238095238096				
1306	8777903	The Child Wife.	20160127191542_00003	The Athenaeum	Sep 12, 1868	1868	Reid, Mayne	The child wife	1868	2.2975658807212205				
1307	8751712	John Herring.	20160127192159_00016	The Athenaeum	Nov 10, 1883	1883	Baring-Gold, S	John Herring	1884	2.444950495049505				
1308	8540965	The Recreations of a Country Parson.	20160128003428_00007	Examiner	May 11, 1861	1861	Boyd, Andrew Kennedy Hutchison	The recreations of a country parson	1863	3.2660150375939847				
1309	3182850	THE VALLEY OF SHADOWS.	20160127190825_00015	The Bookman	Jul 1909	1909	Grierson, Francis	The valley of shadows;	1909	2.1351326191270728				
1310	9453025	The Clever Woman of the Family.	20160127192053_00005	The Athenaeum	Apr 8, 1865	1865	Yonge, Charlotte M. (Charlotte Mary)	The clever woman of the family	1865	3.006698889345948				
1311	2469209	Charles Dickens as a Reader.	20160127190105_00008	Fortnightly review, May 1865-June 1934	Sep 1872	1872	Kent, Charles	Charles Dickens as a reader	1872	2.8890299775368016				
1312	3173384	A PROTEGEE OF JACK HAMLIN'S.	20160127185047_00002	The Bookman	Apr 1894	1894	Harte, Bret	A protégée of Jack Hamlin's and other stories	1889	2.292240978593272				
1313	5235273	"Narrative of a Voyage round the World; comprehending an Account of the Wreck of the Ship ""Governor Ready,"" in Torres Straits; a Description of the British Settlements on the Coasts of New Holland, more particularly Raffles Bay, Melville Island, Swan River, and King George's Sound; also, the Manners and Customs of the Aboriginal Tribes: with an Appendix, containing Remarks on Transportation, the Treatment of Convicts during the Voyage, and Advice to Persons intending to Emigrate to the Australian Colonies."	20160127231211_00014	The Literary gazette : A weekly journal of literature, science, and the fine arts	Nov 14, 1835	1835	Macdouall, John	Narrative of a voyage to Patagonia and Terra del Fuégo : through the Straits of Magellan, in H.M.S. Adventure and Beagle, in 1826 and 1827	1833	2.324826704014939				
1314	3241642	MAID IN WAITING.	20160127183222_00004	The Bookman	Feb 1932	1932	Galsworthy, John	Maid in waiting	1931	2.3863157894736844				
1315	3211718	THE ADVENTURES OF A TROPICAL TRAMP.	20160127190207_00009	The Bookman	Dec 1922	1922	Foster, Harry L. (Harry La Tourette)	The adventures of a tropical tramp	1922	3.105642658177477				
1316	9432523	The Beggar's Benison; or, a Hero without a Name, but wtth an Aim: a Clydesdale Story.	20160127193122_00012	The Athenaeum	Aug 18, 1866	1866	Mills, George	The beggar's benison, or, A hero, without a name, but, with an aim	1866	2.8989872180451126				
1317	9118779	The Comic Annual for 1842.	20160127192157_00006	The Athenaeum	Nov 20, 1841	1841	Hood, Thomas	The comic annual for 1846	1846	2.4482666666666666				
1318	2487718	THE WAVERLEY PAGEANT,	20160127183730_00010	Fortnightly review, May 1865-June 1934	Oct 1932	1932	Scott, Walter, Sir	The Waverley pageant: the best passages from the novels of Sir Walter Scott, selected	1932	2.109567901234568				
1319	6175636	The Life and Works of Goethe: with Sketches of his Age and Contemporaries, from Published and Unpublished Sources.	20160127231618_00005	The New quarterly review and digest of current literature, British, American, French, and German	Jan 1856	1856	Legge, James	The life and works of Mencius	1867	2.103486059817828				
1320	8618983	The Water Witch; or, the Skimmer of the Seas. A Tale.	20160127192611_00010	The Athenaeum	Oct 23, 1830	1830	Cooper, James Fenimore	The water witch; or, The skimmer of the seas.  A tale	1830	3.2822222222222215				
1321	6630899	The Woman who Did.	20160127191440_00012	The Academy, 1869-1902, 0269-333X	Mar 2, 1895	1895	Allen, Grant	The woman who did	1895	2.5914659367396595				
1322	2447147	THE DARK SWAN.	20160127180954_00001	The English review,  1908-1937	Oct 1924	1924	Pascal, Ernest	The dark swan	1924	2.2802873563218387				
1323	9350678	Gilbert Gurney.	20160127191542_00003	The Athenaeum	Dec 5, 1835	1835	Hook, Theodore Edward	Gilbert Gurney	1836	2.485909090909091				
1324	6424382	PINE AND PALM.	20160127233039_00003	Time	Mar 1888	1888	Conway, Moncure Daniel	Pine and palm	1887	2.4888235294117647				
1325	3214382	ADAM AND EVE AND PINCH ME.	20160127185249_00003	The Bookman	Jun 1921	1921	Coppard, A. E. (Alfred Edgar)	Adam and Eve and pinch me	1946	2.90443833003155				
1326	8835034	Kate Carnegie, and those Ministers.	20160127183222_00004	The Athenaeum	Jan 2, 1897	1897	Maclaren, Ian	Kate Carnegie and those ministers	1896	3.2242785714285715				
1327	9225261	The Untold Half.	20160127191542_00003	The Athenaeum	Jul 22, 1899	1899	Baker, Louie Alien, Mrs	The untold half	1899	2.5123809523809526				
1328	2455770	MR. BLETTSWORTHY ON RAMPOLE ISLAND.	20160127183832_00011	The English review,  1908-1937	Oct 1928	1928	Wells, H. G. (Herbert George)	Mr. Blettsworthy on Rampole Island	1928	3.659490992500193				
1329	3212099	THE SHRIEKING PIT.	20160127190721_00014	The Bookman	Jan 1920	1920	Rees, Arthur J. (Arthur John)	The shrieking pit	1919	2.8142424242424244				
1330	9091109	Matthew Ferguson.	20160127192508_00001	The Athenaeum	Aug 8, 1914	1914	Blake, Margaret	Matthew Ferguson	1914	2.5123376623376625				
1331	5244886	The Quiet Husband.	20160127230453_00005	The Literary gazette : A weekly journal of literature, science, and the fine arts	Jun 6, 1840	1840	Pickering, Ellen	The quiet husband	1840	2.532857142857143				
1332	8879114	GRAHAM OF CLAVERHOUSE.	20160127192201_00017	The Athenaeum	Feb 15, 1908	1908	Maclaren, Ian	Graham of Claverhouse	1907	2.8256410256410254				
1333	6729693	Chaucer's Canterbury Tales.	20160127190414_00004	The Academy, 1869-1902, 0269-333X	Oct 19, 1889	1889	Chaucer, Geoffrey	Chaucer's Canterbury pilgrimage	1892	2.5044				
1334	9445680	Chateau Frissac; or, Home Scenes in France.	20160127193122_00012	The Athenaeum	Apr 26, 1862	1862	Logan, Olive	Chateau Frissac, or, Home scenes in France	1862	2.9249818245809567				
1335	2447424	THE DAY'S JOURNEY.	20160127183121_00003	The English review,  1908-1937	Jan 1925	1925	Maxwell, W. B. (William Babington)	The day's journey	1923	2.4585425685425686				
1336	8736677	The Paragreens on a Visit to the Paris Universal Exhibition.	20160127192407_00009	The Athenaeum	Dec 20, 1856	1856	Ruffini, Giovanni	The Paragreens on a visit to the Paris Universal Exhibition	1856	3.2817948717948724				
1337	8589047	Passages from the English Note-Books of Nathaniel Hauthorne.	20160128003123_00004	Examiner	Sep 3, 1870	1870	Hawthorne, Nathaniel	Passages from the French and Italian note-books of Nathaniel Hawthorne	1871	2.4007974448315914				
1338	3207673	THE MAN FROM THE WILDS.	20160127185900_00007	The Bookman	Nov 1921	1921	Clouston, J. Storer (Joseph Storer)	The man from the clouds	1919	2.1088548342997413				
1339	3219672	WINTER COMEDY.	20160127183526_00007	The Bookman	Jun 1931	1931	Thompson, Sylvia	Winter comedy	1931	2.261515151515152				
1340	8896799	The Arabian Nights' Entertainments: with Copious Notes by E. W. Lane.	20160127192407_00009	The Athenaeum	Oct 13, 1838	1838		The Arabian nights' entertainments:	1853	2.9777234530175702				
1341	8853390	The Amateur Cracksman.	20160127192053_00005	The Athenaeum	Apr 15, 1899	1899	Hornung, E. W. (Ernest William)	The amateur cracksman	1899	2.8625				
1342	4120367	FLORENCE NIGHTINGALE IN FICTION.	20160127190105_00008	The Review of reviews	Aug 1912	1912	Richards, Laura Elizabeth Howe	Florence Nightingale, the angel of the Crimea;	1920	2.1472233766233764				
1343	6671522	Basque Legends.	20160127191545_00013	The Academy, 1869-1902, 0269-333X	Feb 17, 1877	1877	Webster, Wentworth	Basque legends	1877	2.4819047619047616				
1344	8497510	The History and Antiquities of the Parish of Wimbledon, Surrey.	20160128010124_00007	Examiner	Aug 5, 1865	1865	Smith, William	The history and antiquities of Morley, in the west riding of the county of York	1876	2.7829166666666665				
1345	3228551	THEY COULD DO NO OTHER.	20160127183018_00002	The Bookman	Mar 1933	1933	Phillpotts, Eden	They could do no other; a volume of stories by Eden Phillpotts	1933	2.4047436045916863				
1346	8614061	Ambrose, the Sculptor: an Autobiography of Artist Life.	20160127191440_00012	The Athenaeum	Jul 22, 1854	1854	Cartwright, Robert, Mrs	Ambrose, the sculptor: an autobiography of artist life	1854	3.626106847310053				
1347	3210732	KING, OF THE KHYBER RIFLES.	20160127184845_00001	The Bookman	Dec 1917	1917	Mundy, Talbot	King--of the Khyber rifles; a romance of adventure	1916	2.2414				
1348	5100364	THE AUTOBIOGRAPHY OF AN INDIAN CHIEF.	20160127231108_00013	Leader and Saturday analyst, Jan. 7-June 30, 1860	Aug 30, 1856	1856		Autobiography of an Indian Army surgeon ;	1854	2.134005797101449				
1349	3199034	THE OPINIONS OF JOHN ABTHORNE ON THE ARTS OF LIVING.	20160127183323_00005	The Bookman	Dec 1920	1920	Hough, Lynn Harold	The opinions of John Clearfield	1921	2.292611382113821				
1350	3221400	THE STRENGTH OF THE HILLS.	20160127190413_00011	The Bookman	Jan 1923	1923	Evans, Florence (Wilkinson), Mrs	The strength of the hills;	1901	2.186923076923077				
1351	4972513	The Works of G. P. R. James, Esq., Revised and Corrected by the Author.	20160127230904_00011	Critic of books, society, pictures, music and decorative art, 1848-1849	Apr 16, 1849	1849	James, G. P. R. (George Payne Rainsford)	The works of G.P.R. James, esq	1844	2.372221158979809				
1352	8534084	Helen's Babies.	20160128002201_00008	Examiner	Feb 24, 1877	1877	Habberton, John	Helen's babies	1881	2.67				
1353	9450609	The Maroon.	20160127191542_00003	The Athenaeum	Oct 18, 1862	1862	Reid, Mayne	The maroon	1862	2.11				
1354	8680446	Otterbourne: a Story of the English Marches.	20160127191848_00004	The Athenaeum	Dec 8, 1832	1832	Duros, Edward	Otterbourne; a story of the English marches	1832	2.8262886446886446				
1355	9139850	Visits and Sketches at Home and Abroad; with Tales and Miscellanies, now first collected; and a new edition of the Diary of an Ennuyee.	20160127192611_00010	The Athenaeum	Jul 12, 1834	1834	Jameson, (Anna), Mrs	"Visits and sketches at home and abroad; with tales and miscellanies now first collected, and a new edition of the ""Diary of an ennuyee."""	1834	3.4498180058982024				
1356	8934546	Young Life.	20160127192303_00008	The Athenaeum	Feb 4, 1911	1911	Herbertson, Jessie Leckie	Young life	1911	2.1139824010412247				
1357	5004520	ROUND THE SOFA.	20160127230149_00002	The Critic	Apr 2, 1859	1859	Gaskell, Elizabeth Cleghorn	Round the sofa	1859	2.525555555555556				
1358	6757944	CAMEOS FROM ENGLISH HISTORY.	20160127191337_00011	The Academy, 1869-1902, 0269-333X	Mar 25, 1899	1899		Stories from English history	1897	2.202322302676171				
1359	4843553	THE WIFE'S EVIDENCE.	20160127230759_00009	The Reader,  1863-1867	Jan 16, 1864	1864	Wills, W. G. (William Gorman)	The wife's evidence : a novel	1864	2.1514738292011018				
1360	3209324	THE STRAITS IMPREGNABLE.	20160127185352_00004	The Bookman	Oct 1917	1917	De Loghe, Sydney	The straits impregnable	1916	3.213333333333333				
1361	8932628	The Sunny Side of the Hill.	20160127192303_00008	The Athenaeum	Oct 17, 1908	1908	Carey, Rosa Nouchette	The sunny side of the hill	1908	2.9299140737265024				
1362	4445905	Wise Saws and Modern Instances.	20160127224123_00002	Tait's Edinburgh magazine	Jan 1846	1846	Cooper, Thomas	Wise saws and modern instances	1845	3.503650793650793				
1363	9430568	The Potiphar Papers.	20160127193122_00012	The Athenaeum	Mar 3, 1866	1866	Curtis, George William	The Potiphar papers	1853	2.536666666666666				
1364	6791989	Paul Kelver.	20160127191545_00013	The Academy and literature, 1902-1905	Sep 27, 1902	1902	Jerome, Jerome K. (Jerome Klapka)	Paul Kelver	1902	2.4915977961432505				
1365	6653720	Salted with Fire.	20160127191233_00010	The Academy, 1869-1902, 0269-333X	Jun 26, 1897	1897	MacDonald, George	Salted with fire	1900	2.4635135135135138				
1366	3225583	TWO FORSYTE INTERLUDES.	20160127185454_00005	The Bookman	Feb 1928	1928	Galsworthy, John	Two Forsyte interludes: A silent wooing	1928	2.355075372378697				
1367	6142250	The Amulet.	20160128002159_00007	The Metropolitan magazine,  1833-1840	Nov 1834	1834		The Amulet	1846	2.1266666666666665				
1368	6867157	The Position of Peggy Harper.	20160127190927_00008	The Academy and literature, 1910-1914	Jan 13, 1912	1912	Merrick, Leonard	The position of Peggy	1911	2.4057331200620427				
1369	3537695	The Life and Letters of Lewis Carroll. S. Dodgson Collingwood.	20160127185454_00005	The Idler, Feb. 1899-July 1901	Jul 1899	1899	Elisabeth	The life and letters of Madame ??lisabeth de France	1901	2.3375326539153254				
1370	4715362	Harry Mowbray.	20160127230759_00009	The Monthly Magazine	Apr 1843	1843	Captain Knox, (Charles Henry)	Harry Mowbray	1843	2.392037037037037				
1371	9149739	Lord Roldan; a Romance.	20160127192157_00006	The Athenaeum	Jun 11, 1836	1836	Cunningham, Allan	Lord Roldan; a romance	1836	2.9663902763902765				
1372	3179669	THE PLAIN MAN AND HIS WIFE.	20160127183934_00012	The Bookman	Dec 1913	1913	Bennett, Arnold	The plain man and his wife	1913	3.0140715049953455				
1373	8989316	William Langshawe, the Cotton Lord.	20160127192407_00009	The Athenaeum	Oct 1, 1842	1842	Stone	William Langshawe, the Cotton Lord	1842	3.4422547822547815				
1374	4981265	VOYAGES AND TRAVELS.	20160127230904_00011	Critic, 1844-1847	Apr 24, 1847	1847		Voyages and travels	1838	2.580516934046346				
1375	8710844	Dead Men's Shoes.	20160127190516_00005	The Athenaeum	Feb 26, 1876	1876	Braddon, M. E. (Mary Elizabeth)	Dead men's shoes	1876	2.7479296066252594				
1376	3183724	THE SIEGE OF THE SEVEN SUITORS.	20160127180954_00001	The Bookman	Jan 1911	1911	Nicholson, Meredith	The siege of the seven suitors	1910	3.1300757575757574				
1377	8884208	The Life and Letters of Mary Wollstonecraft Shelley.	20160127192053_00005	The Athenaeum	Nov 23, 1889	1889	Elisabeth	The life and letters of Madame ??lisabeth de France	1901	2.3666847826086954				
1378	6835514	The Glory of Clementina Wing.	20160127190927_00008	The Academy and literature, 1910-1914	Jul 22, 1911	1911	Locke, William John	The glory of Clementina	1911	2.6733252583979334				
1379	5124848	The Life and Death of Lord Edward Fitzgerald.	20160127230351_00004	The Literary gazette : A weekly journal of literature, science, and the fine arts	Jul 30, 1831	1831		The life and death of the Merry deuill of Edmonton	1819	2.189778323108384				
1380	3214039	MY ALASKAN IDYLL.	20160127183628_00009	The Bookman	May 1923	1923	Rutzebeck, Hjalmar	My Alaskan idyll	1922	2.6988916256157642				
1381	3153534	THE ONE I KNEW THE BEST OF ALL.	20160127183323_00005	The Bookman	Jan 1894	1894	Burnett, Frances (Hodgson)	The one I knew the best of all; a memory of the mind of a child	1893	2.852880962103093				
1382	4368309	STUDIES FOR STORIES.	20160127230555_00007	The London review of politics, society, literature, art, and science	Jan 14, 1865	1865	Ingelow, Jean	Studies for stories	1865	2.5491160593792173				
1383	9229860	Loving and Loth.	20160127191439_00002	The Athenaeum	Jul 17, 1875	1875	De Jongh, Bertha	Loving and loth	1875	2.56				
1384	8968828	SEBASTIAN STROME.	20160128003734_00010	Examiner	Dec 27, 1879	1879	Hawthorne, Julian	Sebastian Strome. A novel	1880	2.5548327566320648				
1385	3247210	JOSEPHUS.	20160127190825_00015	The Bookman	Jan 1933	1933	Feuchtwanger, Lion	Josephus	1932	2.1633333333333336				
1386	4986375	Whaling and Fishing: the Sequel to a Boy's Voyages on Board a Man-of-War and in the Merchant Service.	20160128000429_00007	The Critic	Jan 15, 1857	1857	Nordhoff, Charles	Whaling and fishing; the sequel to A boy's voyages on board a man-of-war and in the merchant service. With four tinted illustrations	1860	2.7494571428571426				
1387	9231753	Traditions and Hearthside Stories of West Cornwall.	20160127191439_00002	The Athenaeum	Aug 16, 1873	1873	Bottrell, William	Traditions and hearthside stories of West Cornwall	1873	3.686733461195242				
1388	8740634	Lady Lowater's Companion.	20160127190927_00008	The Athenaeum	Jul 26, 1884	1884	Tabor, Eliza	Lady Lowater's companion	1884	3.1070786516853928				
1389	3205327	FAITH TRESILION.	20160127183934_00012	The Bookman	Apr 1916	1916	Phillpotts, Eden	Faith Tresilion	1914	2.685				
1390	5212339	The Infant Annual; or, a Mother's Offering: principally intended for children from five to ten years of age.	20160128000225_00004	The Literary gazette : A weekly journal of literature, science, and the fine arts	Nov 24, 1832	1832		The Infants' annual; or, a mothers' offering: with coloured engravings and numberous wood cuts	1834	2.9664				
1391	8524933	GENTLEMAN VERSCHOYLE.	20160128010225_00012	Examiner	Apr 24, 1875	1875	Lane, Laura M	Gentleman Verschoyle, a novel	1875	2.3883093978332077				
1392	8538348	The Duke's Children.	20160128001752_00003	Examiner	Jun 5, 1880	1880	Trollope, Anthony	The duke's children	1881	2.5598692810457515				
1393	6845584	The Sea and the Jungle.	20160127190516_00005	The Academy and literature, 1910-1914	Jan 4, 1913	1913	Tomlinson, H. M. (Henry Major)	The sea and the jungle	1913	2.6166820011500858				
1394	4983065	VOYAGES AND TRAVELS.	20160127230351_00004	Critic, 1844-1847	Nov 21, 1846	1846		Voyages and travels	1838	2.580516934046346				
1395	8674004	Mrs. Jerningham's Journal.	20160127192405_00018	The Athenaeum	Jan 8, 1870	1870	Hart, Fanny Wheeler	Mrs. Jerningham's journal	1870	3.233465413597494				
1396	3246873	STRANGER'S RETURN.	20160127185454_00005	The Bookman	Oct 1933	1933	Stong, Phil	Stranger's return	1933	2.651904761904762				
1397	3173216	TALES OF THE FIVE TOWNS.	20160127185352_00004	The Bookman	Apr 1912	1912	Bennett, Arnold	Tales of the five towns	1905	2.794324543521624				
1398	6638706	Pessimism: A History and a Criticism.	20160127192201_00017	The Academy, 1869-1902, 0269-333X	Jul 28, 1877	1877	Sully, James	Pessimism : a history and a criticism	1891	2.4707136801541423				
1399	4979661	VOYAGES AND TRAVELS.	20160127230351_00004	The Critic	Sep 15, 1853	1853		Voyages and travels	1838	2.481742424242424				
