author	bookid	bpoids	genres	htrcids	subjects	title	pubdate
Galsworthy John	B3100	{2441891}		{'nyp.33433074855432'}		In chancery	1920
Loti Pierre	B4975	{8843788}		{'uc2.ark+=13960=t6j09xx9f'}		Ramuntcho	1897
Southworth Emma Dorothy Eliza Nevitte	B7521	{8511843}		{'nyp.33433076022163'}		Cruel as the grave	1871
Weyman Stanley John	B8782	{9022673}		{'uc2.ark+=13960=t3kw5cx69'}		The Abbess of Vlaye	1904
Lee Holme	B4896	{8662539}		{'uiuo.ark+=13960=t1jh44z6t', 'uiuo.ark+=13960=t8df7bc8s', 'uc1.b3136622'}		Warp and woof or The reminiscences of Doris Fletcher	1861
Strickland Agnes	B7812	{4866288}		{'uiuo.ark+=13960=t89g6990n', 'uiuo.ark+=13960=t7qn6s33c', 'uiuo.ark+=13960=t8w95tg3q'}		How will it end	1865
Major Charles	B6012	{3164897}		{'uc1.b3550216'}		When knighthood was in flower 	1898
Crockett S R Samuel Rutherford	B1953	{9019296}		{'uc2.ark+=13960=t6154gm0v'}		The white plume	1906
Tressell Robert	B8165	{8950035, 6851211}		{'uc1.b4089322'}	{'Capitalism', 'Socialists', 'Social conflict', 'Working class', 'Labor movement', 'Working class families', 'Social classes'}	The ragged trousered philanthr	1911
Gaskell Elizabeth Cleghorn	B3331	{4416811}	{'Bibliographies', 'ContainsBiogMaterial'}	{'uiuo.ark+=13960=t9z03hc07'}		Mary Barton	1848
Neale J M John Mason	B6216	{4965008, 4415885}		{'mdp.39015063941002'}		Stories of the crusades n I II	1848
Chatterton Georgiana Lady	B1854	{8741481}		{'uiuo.ark+=13960=t8hd84770', 'uiuo.ark+=13960=t75t3xd3p', 'uiuo.ark+=13960=t7vm4j87s'}		Country coteries	1868
Rees Claude A	B6991	{8803684, 6658503}		{'nyp.33433075872808'}		Chun Tikung  his life and adve	1896
Heney Thomas William	B3766	{9206096}		{'pst.000006676582'}		The girl at Birrells  a pastoral of the Paroo	1896
Newman May Wentworth	B6095	{8659390}	{'Juvenile audience'}	{'njp.32101063604621'}	{'Fairy tales'}	Fairy tales from gold lands	1867
Coulton Miss	B1454	{6253125, 4347997, 9158063}		{'njp.32101066458397'}		From haytime to hopping	1860
Jkai Mr	B4320	{3185101, 6768870}		{'uc1.$b289585'}		Pretty Michal	1896
Japp Alexander H Alexander Hay	B4333	{2464013}	{'ContainsBiogMaterial'}	{'uc1.b4104160'}	{'(OCoLC)fst00030387', 'Hawthorne, Nathaniel', '1804-1864'}	Memoir of Nathaniel Hawthorne  with stories now first published in this country	1872
Jókai Mór	B4242	{6800915, 3168567}		{'mdp.39015058600365'}	{'Hungarian fiction'}	A Hungarian nabob	1899
Buchan John	B323	{6755615}		{'inu.30000003133299'}		The halfhearted	1920
MacManus Seumas	B6042	{3268766}	{'Juvenile audience'}	{'inu.39000005921841'}		In chimney corners Merry tales	1899
Pemberton Max Sir	B6534	{3175050}		{'nyp.33433075765705'}	{'Jewelry'}	Jewel mysteries I have known  from a dealer note book	1894
Scott Caroline Lucy Lady	B7609	{5210605}		{'uc1.b3327362', 'uc1.b3327361'}		A marriage in high life	1828
Conyers Dorothea	B1878	{6794717}		{'wu.89004871653'}		The thorn bit	1900
Braddon M E Mary Elizabeth	B1157	{8525567}		{'coo.31924013523067'}		Lost for love a novel	1874
Gore Catherine Grace Frances Mrs	B3081	{4974570}		{'njp.32101073378315', 'nyp.33433075905798'}		Sketches of English character	1848
Radcliffe Ann Ward	B6907	{9024559}		{'mdp.39015024482492'}		Memoir of the life and writings of Mrs Radcliffe Gaston de Blondeville	1823
Victor Metta Victoria Fuller	B8427	{8959529}		{'nyp.33433082138706'}		Mormon wives a narrative of fa	1856
Cameron H Lovett Mrs	B1524	{6771198}		{'nyp.33433074935291'}		A loyal lover	1892
Robinson F W Frederick William	B7147	{8979955}		{'uiuo.ark+=13960=t6d22kg1d', 'uiuo.ark+=13960=t0ft97228', 'uiuo.ark+=13960=t5w67423z'}		As long as she lived	1876
Warner Sylvia Townsend	B8730	{3223777, 2450687}		{'uc1.b4082127'}		Mr Fortunes maggot	1927
SaintJuirs	B7673	{3174291}		{'uc2.ark+=13960=t3417801n'}		The Tavern of the Three Virtues	1896
Mason A E W Alfred Edward Woodley	B5435	{9414514, 6745650, 6797647}		{'nyp.33433074892781'}	{'English fiction'}	Clementina	1900
Francis M E	B2936	{6808352, 6811513, 8866919}		{'uva.x030804037'}		Fianders widow a novel	1901
Dickinson Evelyn	B2324	{6795041, 9411710}		{'uc2.ark+=13960=t2d79694b'}		Hearts importunate	1899
Wilson Harry Leon	B8972	{9033368, 3173550}		{'uc2.ark+=13960=t5j961h8h'}		The spenders	1902
Phillpotts Eden	B6768	{8865681, 6786938, 6678068, 3170006}		{'nyp.33433075766646'}		The good red earth a novel	1902
Charles Elizabeth Rundle	B1616	{9591367}		{'nyp.33433074970637'}	{'English fiction'}	The two vocations or The sisters of mercy at home	1865
Steele Jack	B7830	{3195945}		{'uva.x030801496'}		A husband by proxy	1911
Andreyev Leonid	B175	{3287050}		{'uc2.ark+=13960=t6qz27q91'}		Judas Iscariot	1910
Meredith George	B5667	{3175624}		{'uc2.ark+=13960=t0gt5pv0s'}		The tale of Chloe	1891
Cooper E H Edward Herbert	B1477	{3161266}		{'nyp.33433074785308'}		Richard Escott	1893
Davis John Francis Sir	B2302	{5077249}		{'uc1.b4110102'}	{'Translations into English', 'Chinese literature', 'English literature', 'Translations, Chinese'}	Chinese novels translated from the originals to which are added proverbs and moral maxims collected from their classical books and other sources The whole prefaced by observations on the language and literature of China	1822
Edmond Amanda M Corey	B2563	{6146378, 4448540, 4700727}	{'Juvenile audience'}	{'njp.32101063603946'}		Forget me not a gift for Sabbath school children	1852
Fraser James Baillie	B2750	{4966616}		{'nyp.33433074854948', 'nyp.33433074854930'}		The dark falcon a tale of the 	1844
White Stewart Edward	B8925	{9286231}		{'nyp.33433076046311'}		The claim jumpers  a romance	1901
Potter Margaret Horton	B6677	{9255725}		{'uc2.ark+=13960=t5z60ck60'}		Istar of Babylon	1902
Jewett Sarah Orne	B4222	{8885426, 3171852}		{'mdp.39015010317702'}	{'Revolution, 1775-1783', 'History'}	The Tory lover	1901
Whitney A D T Adeline Dutton Train	B8522	{9442342}	{'Juvenile audience', 'Novel'}	{'mdp.39015061865856'}		A summer in Leslie Goldthwaite	1866
Gingold Hlne	B3185	{8816345}		{'uc1.$b248388'}		Seven stories	1893
Deeping Warwick	B2168	{8924918}		{'njp.32101064788522'}		The red saint	1909
Cheney H V Harriet Vaughan	B1489	{5208770, 5148563}		{'nyp.33433074810601', 'nyp.33433074810593'}	{'New Plymouth, 1620-1691', 'History', 'Colonial period, ca. 1600-1775'}	A peep at the Pilgrims in sixteen hundred thirtysix A tale of olden times	1826
Head Francis Bond Sir	B3754	{4696468, 5155663}		{'nyp.33433081694543'}	{'Pampas', 'Andes', 'Description and travel', 'Argentina', 'Mines and mineral resources', 'Gauchos', 'Pampas (Argentina)', 'South America'}	Rough notes taken during some rapid journeys across the Pampas and among the Andes	1826
Bolitho Mrs Sybil	B777	{3233966}		{'uc1.$b86031'}		My shadow as I pass	1934
Garland Hamlin	B3166	{8957810}		{'nyp.33433081919981'}	{'(OCoLC)fst00921052', 'Farm life', 'Iowa', 'Prairies', '(OCoLC)fst01205835', '(OCoLC)fst00935370', 'Frontier and pioneer life', 'Social conditions'}	Boy life on the prairie	1899
Lindsey William	B4864	{8936242}	"{""Publishers' cloth bindings (Binding)"", 'New York', 'New York (State)'}"	{'nyp.33433076074313'}	{'Troubadors'}	The severed mantle	1909
Brown Vincent	B638	{6778880, 6787603, 3159732, 9222286}		{'nyp.33433074930789'}	{'English fiction'}	Two in captivity	1899
Lee R Mrs	B5140	{4439921, 6116658, 8318518}		{'nyp.33433074878475'}		Stories of strange lands and f	1835
Shiel M P Matthew Phipps	B7761	{9308173}		{'uiug.30112042037710'}		The last miracle	1906
Loughead Flora Haines	B4971	{3146536, 6786788}		{'uc2.ark+=13960=t5z60ch44'}		The black curtain	1898
Street Alfred Billings	B7566	{8734446}		{'uc1.$b282021'}	{'Description and travel', 'Adirondack Mountains (N.Y.)'}	Woods and waters or The Saranacs and Racquet	1860
Pittenger Lemuel Arthur	B6595	{8987816}		{'nyp.33433082520499'}	{'Short stories'}	A collection of short stories	1913
Boaden James	B319	{8613599}		{'hvd.32044086797214'}		Man of two lives a narrative written by himself	1829
Crane Stephen	B1468	{6797377, 6782627}		{'njp.32101068597242'}	{'Social life and customs', '19th century'}	The open boat and other storie	1898
Merrick Leonard	B5472	{6758487, 8974983}		{'nyp.33433074897053'}	{'English fiction'}	One mans view	1897
Major John Richardson	B5382	{4690000}		{'nyp.33433067303903', 'nyp.33433067303895'}		Écarté or the salons of Paris  In two volumes	1829
Blackmore R D Richard Dooddridge	B937	{8533490}		{'uc2.ark+=13960=t6057s07q'}		Cripps the carrier	1892
Agate James	B27	{3226737}		{'mdp.39015033519029'}		Fantasies and impromptus	1923
Carey Rosa Nouchette	B1548	{9413152, 6815986}		{'nyp.33433074942503'}		Lifes trivial round	1899
Patmore P G	B6679	{4414881}		{'uiuo.ark+=13960=t9t15m374', 'uiuo.ark+=13960=t3417jz5f', 'uc2.ark+=13960=t6348nj0t'}		Chatsworth or The romance of a	1844
Gardiner Gordon	B3245	{8972656}		{'uc2.ark+=13960=t2h709r1g'}		The reconnaissance	1914
Fisher Dorothy Canfield	B2816	{2456315}		{'uc1.$b244184'}		The homemaker	1924
Dickens Charles	B2250	{4372131, 9428028, 8485575}	{'Bibliographies', 'Satire', 'ContainsBiogMaterial', 'Love stories'}	{'uiug.30112049064725', 'nyp.33433075769178', 'uiuo.ark+=13960=t0jt0c18w', 'uiuo.ark+=13960=t8hd8j45n', 'nyp.33433074969258', 'uiuo.ark+=13960=t6nz8vw9c', 'uc1.b4102860'}	{'London (England)', 'Poor families', 'Dickens, Charles', '1812-1870', 'Deception', 'English fiction', 'Inheritance and succession', 'Social classes'}	Our mutual friend	1864
Marryat Frederick	B6064	{3207307}		{'nyp.33433074880323'}		The old commodore	1837
Brooks Shirley	B1199	{8707249, 8646837, 8857654, 4455143}		{'uc1.b3321956'}		The Gordian knot  a story of g	1860
Paulding James Kirke	B6430	{2851516}		{'dul1.ark+=13960=t5p850s0b'}		The merry tales of the three wise men of Gotham	1826
Landor Walter Savage	B4849	{8770988}		{'nyp.33433074889860'}	{'In literature', '1564-1616', '1552?-1599', '1566-1601', 'Earl of', 'Essex, Robert Devereux', 'Spenser, Edmund', 'Shakespeare, William'}	Citation and examination of William Shakespeare Euseby Treen Joseph Carnaby and Silas Gough clerk  before the worshipful Sir Thomas Lucy knight touching deerstealing on the 19th day of September in the year of Grace 1582 now first published from original papers To which is added a conference of Master Edmund Spenser a gentleman of note with the Earl of Essex touching the state of Ireland AD 1595	1834
Herrick Robert	B3987	{9414322}		{'uva.x001180057'}		The web of life	1900
Jaques E T Edward Tyrrell	B4292	{6840133, 3172319}		{'nyp.33433074867288'}	{'English fiction'}	Holborn Hill	1909
Countess of Blessington Marguerite	B1966	{5155260}		{'hvd.hwjvzr'}		Lady Blessingtons confessions 	1838
Linklater Eric	B5180	{2486378}		{'mdp.39015048881158'}		Magnus Merriman a novel	1934
Talk	B8239	{8667091}		{'uiuo.ark+=13960=t3zs3cp59', 'uiuo.ark+=13960=t2w38d36p', 'uiuo.ark+=13960=t8v98sd37'}		The talk of the town a novel	1868
Sterndale Robert Armitage	B7384	{8725978}		{'mdp.39015059433204'}	{'India', 'Hunting'}	Seonee or Camp life on the Satpura Range a tale of Indian adventure	1877
Gregory	B3416	{6865273}		{'uc2.ark+=13960=t5v69cf18'}		The Kiltartan history book	1909
Page Thomas Nelson	B6477	{6813953, 6820597, 8899837}		{'mdp.39015063946241'}		Gordon Keith	1903
Merritt Henry	B5934	{2464938, 9428950}		{'nyp.33433074901749'}		Robert Dalby and his world of 	1866
Dalton James	B2215	{4699284}		{'nyp.33433074951371'}	{'English fiction'}	The gentleman in black	1831
Bowdler H M Henrietta Maria	B1135	{8556622}		{'njp.32101066455500'}		Pen Tamar or The history of an	1830
Stephens Robert Neilson	B7824	{6691387}		{'uva.x004391142'}		Clementinas highwayman  a romance	1906
Garland Hamlin	B3388	{3219056}	{'Bibliographies'}	{'inu.30000025993191'}		Tales of the middle border	1940
Chaucer Geoffrey	B2012	{8667224}		{'mdp.39015014648359'}		The Canterbury tales of Geoffr	1948
Travers Graham	B8136	{3151938}		{'nyp.33433084128275'}	{'English fiction'}	Mona Maclean medical student a	1898
Myers P Hamilton Peter Hamilton	B5748	{5000014}		{'uc2.ark+=13960=t54f1w921'}		The King of the Hurons	1850
Briscoe	B1243	{6176712}		{'uiuo.ark+=13960=t6h13973w', 'uiuo.ark+=13960=t0js9xt6x', 'uiuo.ark+=13960=t9765rp3x'}		The young bride A novel	1857
Stacpoole H De Vere Henry De Vere	B7743	{8929296, 6856297}		{'uc2.ark+=13960=t9280804w'}		The pools of silence	1910
Lawrence George Alfred	B5124	{8629856}		{'uc2.ark+=13960=t2794253n'}		Guy Livingstone	1867
Verne Jules	B8354	{3164714}	{'Bibliographies'}	{'mdp.39015046862747'}	{'Science fiction'}	An Antarctic mystery	1899
Rinehart Mary Roberts	B7092	{3206769}		{'uc2.ark+=13960=t55d8nw4b'}		Long live the king	1917
Chekhov Anton Pavlovich	B1796	{9110331}		{'uc2.ark+=13960=t8mc92j37'}		Russian silhouettes	1904
Frankau Julia	B2843	{6839920, 9460203}		{'uc2.ark+=13960=t13n2231z'}		Let the roof fall in	1910
France Anatole	B2941	{9137816, 3198884}		{'uc1.$b703820'}		The seven wives of Bluebeard b	1920
London Jack	B4761	{9074492}		{'mdp.39015065985627'}	{'Gold discoveries', 'Women pioneers', 'American literature', 'American fiction'}	Burning Daylight	1910
Dudeney Henry Mrs	B2247	{8889049}		{'nyp.33433074968524'}		Rachel Lorian	1909
Maxwell W B William Babington	B5775	{8923746}		{'uc2.ark+=13960=t6f18vc7h'}		Hill rise	1907
Cooke John Esten	B1453	{8716788}		{'njp.32101066457936'}	{'Social life and customs', 'Manners and customs', 'Martinsburg', '(OCoLC)fst01224867', '(OCoLC)fst01007815'}	Leather stocking and silk or Hunter John Myers and his times	1854
Sladen Douglas Brooke Wheelton	B7678	{3199192}		{'uc2.ark+=13960=t42r3tt8s'}		The tragedy of the pyramids	1909
Verne Jules	B8418	{8850982}		{'uc1.$b117773'}		The fur country or Seventy deg	1874
Tynan Katharine	B8079	{3196997, 8980679}		{'njp.32101067645661'}		Countrymen all	1915
Irving Washington	B4195	{8664794, 4969372}		{'uva.x000534292'}		Tales of a travellerAbbotsford	1859
Mills John	B6050	{9466941, 2876581}	{'Electronic books'}	{'wu.89086150091'}		Stable secrets  or Puffy Doddl	1863
Hardy Thomas	B3969	{8613500}		{'uiuo.ark+=13960=t6d22mx43', 'uiuo.ark+=13960=t6931j77s', 'uiuo.ark+=13960=t03x8zk9m'}	{'Separation (Psychology)', 'Elopement', 'vFiction', 'Triangles (Interpersonal relations)', 'Fiction in English', 'Wessex (England)'}	A pair of blue eyes	1873
Whitby Beatrice	B8615	{8884124, 6797844}		{'nyp.33433075767016'}		Flower and thorn	1902
Besant Walter Sir	B747	{3156771}		{'uc1.$b249610'}	{'Science fiction', 'Wealth', 'Moral and ethical aspects', 'Inheritance and succession', 'Scientists'}	Beyond the dreams of avarice	1895
Glyn Elinor	B3016	{6831583}		{'mdp.39015011425389', 'nyp.33433074864822'}		Three weeks	1907
Spofford Harriet Elizabeth Prescott Mrs	B7640	{8746749, 4454286}		{'uc2.ark+=13960=t09w09m86'}		Sir Rohans ghost	1860
Coppard A E Alfred Edgar	B2034	{2445429}		{'mdp.39015030734266'}		Adam  Eve  Pinch me tales	1922
Cozzens Frederic S Frederic Swartwout	B1718	{8703934, 9428215}		{'uc2.ark+=13960=t29882x58'}	{'American wit and humor'}	The Sparrowgrass papers	1856
Blackwood Algernon	B494	{9070272, 6739335}		{'njp.32101066164854'}		The human chord	1916
Yates Edmund Hodgson	B9059	{9433186}		{'nyp.33433075873616'}		Going to the bad A novel	1876
Owen Rye	B6314	{9009643, 6806747}		{'nyp.33433076054059'}		Redheaded gill	1903
Howells William Dean	B3755	{6796786}		{'uc2.ark+=13960=t4nk37884', 'nyp.33433082295324'}	{'African Americans', 'Short stories, American', 'American literature', 'American fiction', 'Southern States'}	Southern lights and shadows	1907
Cable George Washington	B1353	{6733304}		{'mdp.39015005354504'}	{'History', 'Civil War, 1861-1865'}	Strange true stories of Louisiana	1889
Ward Mary Augusta	B8769	{3177030}		{'uc2.ark+=13960=t22b90q1q'}		The story of Bessie Costrell	1895
Housman Laurence	B3539	{2483149}		{'mdp.39015031236725'}		Ironical tales	1927
Francis M E	B2895	{3170565}		{'uva.x030804040'}		In a North country village	1893
Tytler M Fraser	B8067	{4967627}	{'Juvenile audience'}	{'njp.32101063578338'}	{'Conduct of life'}	The wonderseeker or The history of Charles Douglas	1847
Bamford Samuel	B734	{8910572}		{'pst.000023974616'}		Passages in the life of a radical and Early days	1872
Weill Alexandre	B8502	{9008092}		{'mdp.39015029915421'}		Village tales from Alsatia	1848
Wharton Edith	B8887	{8877129, 8904561, 3169942, 6687279}		{'uc1.32106014402991'}		The fruit of the tree With ill	1907
Redding Cyrus	B6953	{8773503}		{'njp.32101065704346', 'njp.32101065704353', 'njp.32101065704262'}		Keeping up appearances a novel of English life	1861
Roscoe Thomas	B7286	{5175032}		{'mdp.39015066645402'}		Tales of humour gallantry  rom	1824
Reid Mayne	B7221	{4923644}	{'Juvenile audience'}	{'nyp.33433082293733'}		The ocean waifs  a story of ad	1874
France Anatole	B2871	{3216065}		{'uc2.ark+=13960=t79s1wf9r'}		The amethyst ring	1919
Holland Clive	B3950	{8820096, 9025545}		{'uc2.ark+=13960=t8mc9154c'}	{'Japan'}	A Japanese romance	1904
Kúnos Ignácz	B4651	{3182215}		{'nyp.33433068198104'}		Turkish fairy tales and folk t	1896
Somerville E Œ Edith Œnone	B7348	{8950289}		{'mdp.39015020924489'}		Dan Russel the Fox an episode in the life of Miss Rowan	1912
Bury Charlotte Campbell Lady	B790	{4411266, 5842813, 9352590}		{'uc1.b3321271', 'uc1.b3321272'}		The divorced	1837
Oxenham John	B6296	{3182638}		{'nyp.33433075744783'}		Queen of the guarded mounts	1912
Norris W E William Edward	B6193	{8816484}		{'wu.89099764771'}		Mademoiselle de Mersac A novel	1880
Braddon M E Mary Elizabeth	B1061	{3169118}		{'uva.x000386952'}		The green curtain	1911
Arthur T S Timothy Shay	B41	{9414992}		{'njp.32101032678128'}	{'Mesmerism in literature', 'Mesmerism'}	Agnes or The possessed  a revelation of mesmerism	1848
Morris Gouverneur	B5745	{3171450}		{'uc2.ark+=13960=t52f7k62m'}		Yellow men and gold	1921
Bickley Francis Lawrence	B481	{3216731}		{'njp.32101064787912'}		The adventures of Harlequin	1923
Gaunt Mary	B3229	{3187434}		{'uc1.l0072661432'}		The surrender  and other happenings	1920
Parrish Randall	B6784	{9282476}		{'nyp.33433076060452'}		My lady of doubt	1911
AikinKortright Fanny	B256	{8766425}		{'uiuo.ark+=13960=t3qv41k47', 'uiuo.ark+=13960=t80k2w78c', 'uiuo.ark+=13960=t8bg36594'}		Anne Sherwood or The social in	1857
De Forest John William	B2164	{8500512, 4382121, 8773746}		{'nc01.ark+=13960=t3mw2v80v'}	{'United States', 'History', 'Civil War, 1861-1865'}	Miss Ravenels conversion from secession to loyalty	1867
Whitehead Charles	B8464	{8593216, 4692871}		{'hvd.hnnesn'}		The autobiography of Jack Ketch	1835
QuillerCouch Arthur Thomas Sir	B6852	{6837451}		{'uc2.ark+=13960=t6057g755'}		Shakespeares Christmas and other stories	1905
Barrowcliffe A J	B1042	{8769439}		{'uiuo.ark+=13960=t45q5jz8m', 'uiuo.ark+=13960=t8gf1fh3r', 'uiuo.ark+=13960=t9q24jn9g'}		Trust for trust	1859
Liljencrantz Ottilie A Ottilia Adelina	B4857	{9247669}	{'Science fiction', 'Historical fiction'}	{'nyp.33433075785745'}	{'Discoveries in geography', 'Discovery and exploration', 'Vikings', 'Norse', 'Northmen'}	The thrall of Leif the Lucky a story of Viking days	1902
Grey Elizabeth Caroline Mrs	B2972	{8567314, 4688798}		{'hvd.hnnq41'}		De Lisle  or the distrustful man	1828
Moore George	B5860	{3163024, 6766105, 6797323, 3451157, 8842702}		{'uva.x001770566', 'uva.x001770565'}	{'English fiction'}	Evelyn Innes	1811
Adam Juliette	B172	{3172009, 6805141}		{'uc2.ark+=13960=t6445n076'}	{'Second Empire, 1852-1870', 'France', 'History', 'IsBiographical'}	My literary life	1904
Bulfinch Thomas	B1161	{3217311}		{'uva.x000467597'}		King Arthur and his knights Th	1867
Williams F	B8842	{4994617}		{'uiuo.ark+=13960=t17m0z22w', 'uiuo.ark+=13960=t5db8q110', 'uiuo.ark+=13960=t3tt58x6j'}		The secret marriage or Contrasts in life	1855
Boyce Neith	B911	{6820368, 9004905, 8877673}		{'uc2.ark+=13960=t45q4t746'}		The forerunner	1903
Hall Alice Marples	B4027	{3181381}		{'wu.89094592698'}		The one strand river and other	1903
Lavenu L S	B5037	{8972781}		{'uiuo.ark+=13960=t5bc4k63r', 'uiuo.ark+=13960=t4wh35k8t'}		Gaston Bligh	1858
Grattan Thomas Colley	B3304	{5838309, 4701678}		{'uiuo.ark+=13960=t87h2044t', 'uiuo.ark+=13960=t09w0tz8w'}	{'Netherlands', 'Wars of Independence, 1567-1625', 'Wars of Independence, 1556-1648', 'Wars of independence, 1567-1625', 'History'}	The heiress of Bruges	1830
Browning Elizabeth Barrett	B352	{3161534, 5008917, 6172982}		{'mdp.39015009374508'}		Aurora Leigh	1861
Neale W Johnson William Johnson	B6207	{8890258}		{'nyp.33433011794728'}		Will watch  from the autobiogr	1835
Sinclair Upton	B7634	{2443520}		{'uc2.ark+=13960=t02z13b24'}		They call me Carpenter	1922
Caunter Hobart	B2006	{8437061}		{'nyp.33433074941653'}		Posthumous records of a London	1836
Bjelke Petersen Marie	B710	{3215359}		{'nyp.33433075766695'}		The immortal flame	1919
Reynolds Frederick	B7033	{5383441, 8617843, 4707334, 5153775}		{'uc1.b3546710'}	{'1764-1841', 'Reynolds, Frederick'}	The life and times of Frederick Reynolds	1827
Patterson J H John Henry	B6803	{6833543}	{'Autobiography'}	{'uc2.ark+=13960=t83j3cg3v'}		The maneaters of Tsavo and oth	1907
Durand Henry Mortimer Sir	B2177	{9045688}		{'njp.32101068177342'}	{'Shah of Iran', 'Nādir Shāh', '1688-1747'}	Nadir Shah	1908
Linton E Lynn Elizabeth Lynn	B4848	{9432643, 4857235}		{'nyp.33433074888979'}	{'English fiction'}	Lizzie Lorton of Greyrigg A no	1866
