author	bookid	bpoids	genres	htrcids	subjects	title	pubdate
Norris Frank	B6156	{6849413}	{'NotBiographical', 'Bibliographies'}	{'uc2.ark+=13960=t52f7mb39'}		Vandover and the brute	1902
Stigand C H	B7643	{3206693}		{'uc2.ark+=13960=t0pr7ns7s'}	{'Tales, Swahili', 'Africa, East', 'Folklore'}	Black tales for white children	1914
Andersen H C Hans Christian	B15	{4973077, 8467653}	{'Juvenile audience'}	{'mdp.39015004314079'}	{'Fairy tales'}	Danish fairy legends and tales	1861
Allen Grant	B87	{8839168}		{'nyp.33433074947684'}		A splendid sin	1899
Schreiner Olive	B7729	{3160660, 9181277}		{'uc2.ark+=13960=t7hq3w36r'}		Dream life and real life	1893
Alexander Mirian	B77	{8897159}		{'nyp.33433074919584'}		Beyond the law	1912
De Morgan William Frend	B2319	{9068552}		{'uc2.ark+=13960=t1ng4pv37'}		An affair of dishonour	1910
Marryat Frederick	B6034	{4414743}		{'nyp.33433075821524'}		The settlers in Canada Written	1844
Benson E F Edward Frederick	B616	{6788384, 3273192, 6801285, 9230238}		{'nyp.33433074926894'}	{'English fiction'}	The luck of the Vails	1901
Broughton Rhoda	B782	{8584153}		{'uc1.32106005407439'}		Red as a rose is she A novel	1870
Stephens John L	B7973	{9263257}		{'mdp.39015012339498'}		Incidents of travel in Greece 	1839
EbnerEschenbach Marie von	B2620	{3142871}		{'uva.x000966281'}		The two countesses	1893
Williams Robert Folkestone	B8732	{4700454}		{'uc1.b4102869'}	{'In literature', 'Shakespeare in fiction, drama, poetry, etc', '1564-1616', 'Shakespeare, William'}	Shakespeare and his friends or The golden age of merry England	1838
Morrison Arthur	B5950	{9020483}		{'coo.31924013647411'}		The green eye of Goona stories	1905
Brock Carey Mrs	B1071	{9462590}		{'uva.x030808579'}		Sunday echoes in weekday hours  a tale illustrative of Scripture characters	1878
Rostand Edmond	B7172	{8378730}		{'umn.31951002024886x'}	{'Cyrano de Bergerac', '1619-1655', 'Drama'}	Cyrano de Bergerac	1898
Street G S George Slythe	B7699	{6771236}		{'uc2.ark+=13960=t5cc0z06v'}		The trials of the Bantocks	1900
Dilnot Frank	B2134	{6888150}		{'mdp.39015059449325'}	{'Journalism'}	The adventures of a newspaper man	1913
Lauder Thomas Dick Sir	B5143	{4441051}		{'mdp.39015005622868', 'mdp.39015005622876', 'mdp.39015005622959'}		Legendary tales of the Highlan	1841
Thanet Octave	B8134	{6836503}		{'nyp.33433076090640', 'uc2.ark+=13960=fk70v8b07w'}		Knitters in the sun	1887
Crowberry Daniel	B1842	{8991356}		{'uiuo.ark+=13960=t3xs61z24', 'uiuo.ark+=13960=t78s52g23', 'uiuo.ark+=13960=t8bg31516'}		North of the Tweed or Lorance Langton his life incidents and adventures in Scotland	1867
Yeats W B William Butler	B9007	{8978327}		{'njp.32101067487569'}	{'Drama'}	Where there is nothing	1903
Carroll Lewis	B2069	{3205344, 3176067}	{'Fantasy fiction', 'Short stories'}	{'mdp.49015002816925'}		Alices adventures under ground	1898
Smith Arthur Cosslett	B7758	{6797658, 6672051, 3168407}		{'uc2.ark+=13960=t9v11x82g'}		The turquoise cup and The desert	1910
Bilse Fritz Oswald	B882	{3178684}		{'uc2.ark+=13960=t2m61m06q'}	{'Herr', 'Germany', 'Military life'}	Life in a garrison town	1904
Hichens Robert Robert Smythe	B3477	{9458291, 6829390}		{'coo.31924013625730'}		The dweller on the threshold	1911
White Percy	B8435	{3184353}		{'coo.31924013237825'}		An averted marriage and other 	1910
Waugh Joseph Laing	B8778	{3199387}		{'uc2.ark+=13960=t3513wp0c'}		Betty Grier	1915
Wylde Katharine	B8590	{6825354, 9040996}		{'nyp.33433074945613'}	{'English fiction'}	Lady Julias emerald	1908
Luther Mark Lee	B4949	{8892488, 6774950}		{'uc2.ark+=13960=t2w37p16q'}		The henchman	1902
Laffan De Courcy Mrs	B4804	{8543808}	{'Dime novels'}	{'nyp.33433074873211'}	{'Foundlings'}	Aunt Hepsys foundling  a novel	1887
Deeping Warwick	B2225	{8925599}		{'nyp.33433074958723'}		Mad Barbara	1908
Fraser Hugh Mrs	B2737	{3264992}		{'nyp.33433074854088'}	{'Social life and customs', '1868-1912'}	The custom of the country tales of new Japan	1899
Beerbohm Max Sir	B856	{6784694}		{'uc2.ark+=13960=t12n5604j'}		The happy hypocrite	1915
Taylor Ann Martin Mrs	B8130	{5156149}		{'nyp.33433076080617'}	{'American fiction'}	Retrospection a tale	1822
Williamson William Henry	B8636	{6849440, 8920990}		{'nyp.33433075772578'}	{'English fiction'}	The princes marriage	1908
QuillerCouch Arthur Thomas Sir	B6849	{3162461}		{'uc2.ark+=13960=t47p96h12'}		The delectable duchy	1893
Murdoch David	B6060	{4452143}		{'nyp.33433076060874'}		The Royalists daughter and the	1861
Black William	B434	{8950977, 3173323, 6493493, 8700999}		{'mdp.39015063748696', 'mdp.39015063748688', 'mdp.39015063748704'}	{'Scottish authors', 'English fiction'}	The strange adventures of a ho	1888
Meredith George	B5939	{6614529, 8789641}		{'mdp.39015066325534'}		One of our co	1909
Kipling Rudyard	B4517	{2459981}		{'mdp.39076006767078', 'uc1.b3325421'}		Debits and credits	1909
Wells David Dwight	B8669	{6768382}		{'nyp.33433076074073'}		Her ladyships elephant	1898
Devereux W A	B2323	{6695244}		{'uc2.ark+=13960=t21c1wx6k'}	{'Raleigh, Walter', 'Great Britain', 'History', '1552?-1618', 'Elizabeth, 1558-1603'}	Sir Walter Ralegh	1909
Merrick Leonard	B5522	{8849153, 3169642}		{'nyp.33433074971403'}	{'English fiction'}	The actormanager	1898
Chambers Robert W Robert William	B1972	{3157365}		{'inu.30000111816496'}		The king in yellow and other h	1933
Burnett Frances Hodgson	B360	{8808160, 8923632, 3153534}		{'mdp.39015013709871'}		The one I knew the best of all a memory of the mind of a child	1893
Reade Charles	B7102	{9436673}		{'uc2.ark+=13960=t6057nm0r'}		Griffith Gaunt or Jealousy	1870
Murray David Christie	B5826	{3154958}		{'uiuo.ark+=13960=t8gf1c96p', 'uiuo.ark+=13960=t0ns19x0t', 'uiuo.ark+=13960=t43r1f081'}		A rising star	1894
Holland Clive	B3704	{6786002}		{'nyp.33433074870209'}		Marcelle of the quarter	1900
Benson E F Edward Frederick	B771	{6783661, 3171990}		{'uc1.$b792395'}		Scarlet and hyssop  a novel	1902
Miller J Joaquin	B6016	{3165502}		{'dul1.ark+=13960=t1wd4jf83'}		The building of the city beaut	1893
Jameson Anna Mrs	B4463	{8769235}		{'uc1.b3546903'}		Visits and sketches at home an	1834
Escott T H S	B2656	{6777583}		{'uc2.ark+=13960=t6sx6503p'}		A trip to Paradoxia and other 	1899
Gleig G R George Robert	B3205	{6136559}		{'uc1.b3322523', 'uiuo.ark+=13960=t83j3v78x', 'uc1.b3322525'}		Allan Breck	1834
Steel Flora Annie Webster	B7680	{6806200, 3160573, 8844031}	{'History'}	{'uc2.ark+=13960=t43r1751d'}	{'Sepoy Rebellion, 1857-1858', '(OCoLC)fst01354766', 'Delhi', '(OCoLC)fst01205766', 'Siege of Delhi (India : 1857)', '1857', 'Siege, 1857', 'India', 'History'}	On the face of the waters	1897
James G P R George Payne Rainsford	B4329	{2854536, 2850698}		{'uc1.b3339478', 'uc1.b3339468', 'uc1.b3339469', 'uc1.b3339463', 'uc1.b3339460', 'uc1.b3339459', 'uc1.b3339471', 'uc1.b3339467', 'uc1.b3339464', 'uc1.b3339472', 'uc1.b3339473', 'uc1.b3339470', 'uc1.b3339476', 'uc1.b3339465', 'uc1.b3339479', 'uc1.b3339462', 'uc1.b3339461', 'uc1.b3339477', 'uc1.b3339475', 'uc1.b3339474', 'uc1.b3339466'}		The works of GPR James esq	1844
AlecTweedie	B177	{3157395}		{'uc2.ark+=13960=t6vx0fv1k'}		Wilton QC or Life in a highland shooting box	1895
Conrad Joseph	B1998	{6797377, 6782627}		{'pst.000019367736'}		Typhoon and other stories	1924
Cram Ralph Adams	B1899	{3179508}		{'njp.32101007065418'}		Black spirits  white  a book o	1895
James Henry	B4234	{8813475}		{'mdp.39015031241055'}		The madonna of the future A bundle of letters The diary of a man of fifty and Eugene Pickering	1883
Mayhew Henry	B6028	{8443638}		{'uc2.ark+=13960=t4qj7963f'}		The magic of kindness or The w	1849
Angus Orme	B72	{8835050, 6794182, 3166527}		{'nyp.33433074870506'}	{'English fiction'}	Love in our village	1902
Beecher Henry Ward Mrs	B729	{8771387}		{'nyp.33433084129067'}	{'Description and travel', 'Village communities', 'History', 'New England', 'Civil War, 1861-1865'}	Norwood or Village life in New England	1867
Braddon M E Mary Elizabeth	B827	{8848160}		{'uc1.b4103136'}		London pride or When the world was younger	1896
Fowler Ellen Thorneycroft	B2769	{8915969, 6818794, 8960524}		{'nyp.33433075728067'}		Her ladyships conscience	1913
Major Michel	B5922	{8197352, 4444004}		{'njp.32101065836601', 'njp.32101065836619', 'njp.32101065836593'}		Henry of Monmouth or The field	1841
Birmingham George A	B596	{9030225, 6689095}		{'nyp.33433074852835'}		The seething pot	1905
Walpole Hugh Sir	B8495	{2437846}		{'mdp.39015018647829'}		The prelude to adventure	1912
Wilson Violet A	B8473	{3217782}		{'inu.32000001703182'}	{'1533-1603', 'Court and courtiers', 'Queen of England', 'Elizabeth'}	Queen Elizabeths maids of honour and ladies of the privy chamber	1922
MDonogh Felix	B5823	{5108176}		{'uiuo.ark+=13960=t4rj4zq55', 'uiuo.ark+=13960=t0ms47n5n', 'uiuo.ark+=13960=t87h23t3j'}	{'823M147H'}	The highlanders	1824
Stockton Frank Richard	B7990	{6778208}		{'uc1.$b799982'}		The associate hermits	1899
Bullen Frank Thomas	B807	{8979540}		{'uc1.b3548135'}		Recollections the reminiscences of the busy life of one who has played the varied parts of sailor author  lecturer	1915
Lloyd Jessie Sale	B5013	{8972786}		{'uiuo.ark+=13960=t5gb2mb52', 'uiuo.ark+=13960=t0ht34v35'}		The Hazelhurst mystery	1877
Grier Sydney C	B3116	{8891488, 3153931, 6806371, 6769814}		{'nyp.33433074859699'}		The prince of the captivity	1902
Wilson Richard	B8938	{3193361}		{'mdp.39015002199639'}		The Russian story book contain	1916
Porter Jane	B6762	{4699714, 8259815}		{'njp.32101064790106'}		Sir Edward Sewards narrative o	1831
Duchess	B2148	{8530668}		{'mdp.39015063938362'}	{'English fiction'}	Molly Bawn	1886
Atherton Gertrude Franklin Horn	B108	{3172289, 6745931}		{'nyp.33433082173729'}		American wives and English husbands A novel	1898
Cheney Harriet Vaughan Foster	B1919	{5208770, 5148563}		{'uc2.ark+=13960=t0pr7p269'}		A peep at the Pilgrims in sixt	1850
Dunning James Edmund	B2204	{3205867}		{'nyp.33433074861869'}		The master builders	1909
Braddon M E Mary Elizabeth	B458	{8917068}		{'nc01.ark+=13960=t5hb0072c'}		Dead love has chains	1907
of Ayrshire Robertson William	B9120	{8880326}		{'nyp.33433081587598'}		The dule tree of Cassillis	1903
Upward Allen	B8342	{3178273}		{'njp.32101062530496'}		One of Gods dilemmas	1896
Tolstoy Leo graf	B8061	{6826906}		{'nyp.33433034488381', 'mdp.49015002161553'}		The death of Ivan Ilyitch and other stories	1899
Clegg Thomas Bailey	B1565	{9040265}		{'nyp.33433074945845'}		The bishops scapegoat	1908
Cooper James Fenimore	B1467	{4964592}		{'njp.32101068596533'}		Lucy Hardinge  a second series of Afloat and ashore	1844
Carey Rosa Nouchette	B1704	{6738315}		{'uc2.ark+=13960=t1cj8d615'}		Doctor Luttrells first patient	1897
White William Allen	B8706	{6831163}	{'Bibliographies'}	{'uc1.b3295323'}	{'Social problems'}	A certain rich man	1909
Hichens Robert Robert Smythe	B3482	{6659974}		{'coo.31924064995479'}		Flames a London phantasy	1899
Chekhov Anton Pavlovich	B1686	{8978427, 6893476, 8968197, 2484879}		{'uc1.b4084533', 'pst.000063771725', 'uc1.b4084530', 'uc1.32106007993006', 'uc1.b4084451'}		The beggar  and other stories	1904
Stockton Frank Richard	B7863	{3213591}	{'Bibliographies', 'ContainsBiogMaterial'}	{'uc2.ark+=13960=t1sf2n136'}		The hundredth man	1886
Gyp	B3042	{3165312}		{'mdp.39015065792957'}	{'Martin, Harriette Anne (Crookesley Patchett)', 'Mrs', 'tr'}	Chiffons marriage	1895
Grattan Thomas Colley	B3078	{8878079}		{'njp.32101069166229', 'uc1.b3322551'}	{'English fiction'}	Highways and byways or Tales of the roadside  picked up in the French provinces	1823
Winter John Strange	B8529	{8967580}		{'mdp.39015063961497'}		A selfmade countess the justication of a husband	1901
Frederic Harold	B2951	{3171826}		{'mdp.39015063551470'}		Mrs Albert Grundy observations	1896
Brown Alice	B569	{6821525, 3174998}		{'nyp.33433074808704'}	{'American fiction'}	Rose MacLeod	1908
Pemberton Max Sir	B6537	{6799012}		{'nyp.33433075766018'}		Beatrice of Venice	1904
Picard LB LouisBenoît	B6434	{8167383}		{'hvd.hwkm9c'}	{'Revolution, 1789-1799', 'History'}	The Gil Blas of the Revolution	1825
Davis Richard Harding	B2350	{8876923, 6826988}		{'uc2.ark+=13960=t5db7w69s'}		Captain Macklin	1902
PentreathDolly	B6648	{3160547}		{'uc2.ark+=13960=t2s46w55j'}	{'Cornwall (England : County)'}	In a Cornish township with old Vogue folk	1893
Scott Walter Sir	B7343	{8565754, 6805270}		{'mdp.39015012932110'}	{'James I, 1603-1625', 'History'}	The fortunes of Nigel With 52 	1832
Deland Margaret	B2417	{8877832, 6816990}		{'uc1.31175014611183'}		Dr Lavendars people	1903
Westbury Hugh	B8859	{6494020}		{'uiuo.ark+=13960=t6n01hh52', 'uiuo.ark+=13960=t9j394f24', 'uiuo.ark+=13960=t9v12dg2b'}		Frederick Hazzleden	1887
Horne R H Richard H	B4143	{8415543}		{'mdp.39015062810984'}		The poor artist or Seven eyesi	1850
Jefferies Richard	B4213	{3225283}		{'mdp.39015004956531'}		The story of my heart	1887
Train Elizabeth Phipps	B8186	{8924593}		{'uc2.ark+=13960=t3707zh4p'}		A queen of hearts	1898
Harte Bret	B3775	{8915440, 6450235}		{'uc1.$b251148', 'uc1.$b251149'}	{'American literature'}	The crusade of the Excelsior	1887
Grant Maria M	B3079	{8976258}		{'njp.32101069166310'}		My hearts in the highlands	1878
Hyde John Dalison	B3699	{3196476}		{'nyp.33433074868971'}		The feet of the years	1910
Maugham W Somerset William Somerset	B5283	{3263753, 3422994}		{'mdp.39015030706421'}		The making of a saint	1898
Jackson Margaret Doyle	B4311	{8974136}		{'nyp.33433076088545'}		When love is king	1905
Collins William Edmund Wood	B1366	{3166299}		{'mdp.39015018428543'}	{'University of Oxford'}	The don and the undergraduate	1899
Rice Cale Young	B6934	{3319029}		{'mdp.39015063963931'}		Youths way	1923
Morris Charles	B5368	{6831283}		{'njp.32101072310624', 'njp.32101072310640'}	{'World history'}	King Arthur	1908
Maurice Frederick Denison	B6020	{5231189}		{'hvd.hn1qjy', 'hvd.hn1qjz'}		Eustace Conway or The brother 	1834
Wassermann Jakob	B8504	{3220084}		{'mdp.39015030046018'}		The triumph of youth	1927
Skram Amalie	B7822	{3164384}		{'uva.x000367723'}		Professor  Hieronimus	1899
Whittier John Greenleaf	B8982	{8907271}		{'mdp.39015033004352'}		The writings of John Greenleaf	1888
Strachey John	B7916	{3222216}		{'uc1.$b105775'}		The frontiers	1952
Trollope Frances Milton	B8076	{4961832, 4443806, 8403111}		{'njp.32101067179364'}		The Laurringtons or Superior p	1844
Barry William Francis	B896	{6771122, 8870126}		{'uc2.ark+=13960=t39020x7n'}		Arden Massiter	1900
Fraser Hugh Mrs	B2740	{3164751}		{'nyp.33433074854146'}	{'English fiction'}	The looms of time	1898
Lytton Rosina Bulwer Lytton Baroness	B4909	{4961162}		{'uc1.b3325477', 'uc1.b3325475', 'uc1.b3325476'}		Memoirs of a Muscovite	1844
Orczy Emmuska Orczy Baroness	B6232	{6850522, 3192541}		{'inu.30000041573456'}		Fire in stubble	1912
Nansen Peter	B6101	{6815756}		{'njp.32101064726662'}		Loves trilogy  Julies diary Marie Gods peace	1906
Henty G A George Alfred	B4157	{3174883}	{'Juvenile audience'}	{'mdp.39015073479365'}		St Bartholomews eve  a tale of	1893
Broughton Rhoda	B1222	{6239872, 3170836, 8840956}		{'uva.x001132252'}		Dear Faustina A novel	1897
Currey Edward Hamilton	B1443	{3298517}		{'njp.32101064788373'}	{'Naval operations', 'World War, 1914-1918'}	News of battle	1917
Compton Herbert	B1551	{6768579}		{'nyp.33433074942776'}	{'English fiction', 'Caroline', 'Queen, consort of George IV, King of Great Britain', '1768-1821'}	The queen can do no wrong being some passages and personal opinions in the early life of Jimmy Rabbit	1903
Wister Owen	B8582	{6787514}		{'nyp.33433074795125'}	{'American fiction'}	The Virginian  a horseman of the plains	1904
Cross Victoria	B1563	{6811698}	{'Novel'}	{'nyp.33433074945001'}	{'English fiction'}	Six chapters of a mans life	1903
Lockhart Caroline	B4870	{6845826}		{'nyp.33433076074966'}		The Lady Doc	1912
Jókai Mór	B4432	{6791075}		{'mdp.39015010438904'}		The slaves of the Padishah  Th	1903
Morehead George	B5520	{6841855}		{'nyp.33433074915962'}	{'b. 1431', 'Villon, François'}	The story of Francois Villon	1902
Mackail J W John William	B5914	{6655318}		{'wu.89095791042'}		Biblia innocentium being the s	1893
Wiggin Kate Douglas Smith	B8525	{6815089, 9024036}		{'mdp.39015063958998'}		Rose o the river	1905
Castle Agnes Sweetman	B1658	{6782973}		{'uc1.$b323549'}		The Bath comedy	1900
Henty G A George Alfred	B4155	{3174288}	{'Juvenile audience'}	{'uc2.ark+=13960=t4mk67377'}		In the heart of the Rockies	1894
Bennett Arnold	B836	{3173216, 6755335, 9077514, 6684491, 6813593, 6800411, 9005564}		{'uc1.b4714675'}		Anna of the Five Towns	1912
Gore Catherine Grace Frances Mrs	B3129	{6115771}		{'nyp.33433074864418'}	{'English fiction'}	The bankers wife or Court and city a novel	1843
Stockton Frank Richard	B7738	{6747682, 8848515, 6775855}		{'uc2.ark+=13960=t8nc5x46f'}		The girl at Cobhurst	1898
Jókai Mór	B4269	{8856329}		{'nyp.33433074389531'}	{'History', '1699-1848'}	The nameless castle  a novel	1898
Ponsonby Emily	B6730	{8998026}		{'uiuo.ark+=13960=t8rb7ns03', 'uiuo.ark+=13960=t3mw31t1z', 'uiuo.ark+=13960=t82j71x1s'}	{'823P775P'}	Pride and irresolution	1850
Zangwill Israel	B9082	{9410645}		{'mdp.39015033791529', 'mdp.39015033791503', 'coo.31924059369532', 'mdp.39015033791511'}		Children of the ghetto	1892
Worthington D	B8765	{3174347}		{'uc2.ark+=13960=t1vd6p911'}	{'Personal narratives, Confederate', 'United States', 'History', 'Civil War, 1861-1865'}	The broken sword	1901
Balzac Honoré de	B758	{3220977}		{'uc1.$b317883'}		Tales from Balzac	1850
Buchan John	B447	{6804206}		{'mdp.39015066052427'}	{'Raleigh, Walter', '1552?-1618'}	Sir Walter Raleigh	1911
Green Anna Katharine	B3356	{6793225, 8847939, 3151430}		{'mdp.39015057639679'}		That affair next door  and Los	1935
Tolstoy Leo graf	B8277	{2436835, 6855221}		{'uc1.b4530237'}		The forged coupon After the da	1910
Bateman May Geraldine Frances	B667	{3171634, 6661742}		{'nyp.33433074937347'}	{'English fiction'}	The altar of life	1901
Howitt Mary Botham	B3571	{6144782}		{'mdp.39015063933637', 'njp.32101068170966', 'mdp.39015063560430'}		Wood Leighton  or A year in the country	1836
Irving Washington	B4184	{8664794, 4969372}	{'Autographs (Provenance)', 'Bookplates (Provenance)', 'Illustrated works'}	{'nyp.33433076087919', 'nyp.33433076087901'}		Tales of a traveller	1824
Poe Edgar Allan	B6571	{4449461}		{'nyp.33433076030794'}		Poems and tales	1849
Ludlow James M James Meeker	B5081	{8885475}		{'uva.x030758867'}		Deborah a tale of the times of	1901
Chapin Charles E	B1380	{8998785}		{'mdp.39015055053436'}	{'Journalism', 'United States'}	Charles Chapins story written in Sing Sing prison	1920
