author	bookid	bpoids	genres	htrcids	subjects	title	pubdate
Marshall Archibald	B5255	{3206753}		{'mdp.39015009006910'}		Anthony Dares progress	1924
Cobb Irvin S Irvin Shrewsbury	B2047	{3201042}		{'nyp.33433043979859'}		The escape of MrTrimm  his pli	1913
Hunt Violet	B3499	{2441074}		{'inu.32000009144066'}		The last ditch	1918
Pickthall Marmaduke William	B6697	{3192077}		{'uc2.ark+=13960=t8hd7r683'}		The house of war	1916
Cabell James Branch	B1687	{6797752, 8903937}		{'uc1.b4099727', 'uc2.ark+=13960=t00z71v73'}		The eagles shadow	1904
Sherlock Charles Reginald	B7934	{9254222}		{'nyp.33433076082407'}		Your Uncle Lew a naturalborn A	1901
Greer J R Mrs	B3173	{9416572}		{'nyp.33433082406228'}	{'Society of Friends'}	Quakerism or The story of my life	1851
DAnnunzio Gabriele	B2346	{6818700}		{'uc2.ark+=13960=t57d2s59b'}	{'Italian fiction'}	The flame of life	1900
Holland J G Josiah Gilbert	B4168	{8650109}		{'uc2.ark+=13960=t79s1m82t'}		Miss Gilberts career	1881
Parker Dorothy	B6821	{2483712}		{'pst.000044897604'}		Laments for the living  collec	1939
Saunders John	B7774	{9426443}		{'uiuo.ark+=13960=t7dr3gh53', 'uiuo.ark+=13960=t0zp4nt0h', 'uiuo.ark+=13960=t58d0jb1c'}		One against the world or Reubens war A novel in three volumes	1865
Harraden Beatrice	B3651	{3188255}		{'nyp.33433074850748'}		The guiding thread	1916
Lawrence George A George Alfred	B5186	{9435559}		{'njp.32101068141025'}		Maurice Dering or The quadrila	1864
Stockton Frank Richard	B7863	{3213591}	{'Bibliographies', 'ContainsBiogMaterial'}	{'uc2.ark+=13960=t1sf2n136'}		The hundredth man	1886
Wilson Richard	B8938	{3193361}		{'mdp.39015002199639'}		The Russian story book contain	1916
Evans Caradoc	B2555	{2439653}		{'mdp.39015059404098'}		My neighbours	1919
Trollope Frances Milton	B8180	{5224218}		{'uc2.ark+=13960=t23b6287s', 'uiuo.ark+=13960=t0ks7bk3v', 'uc2.ark+=13960=t4vh5jm7s'}		The abbess	1833
Smith Eleanor Furneaux Lady	B7570	{3229745}		{'uc1.$b312544'}		Flamenco	1931
Spadoni Adriana	B7617	{2433413}		{'uc1.b3727987'}		The swing of the pendulum	1919
Anley Charlotte	B90	{4968046}		{'nyp.33433074947841'}	{'Todd, John', '1800-1873'}	Miriam or The power of truth A jewish tale	1836
Dickens Charles	B2094	{2848795, 9017639, 8442183}	{'Historical fiction'}	{'hvd.32044090341959'}	{'Gordon Riots, 1780', '18th century', 'Social life and customs', 'History', '19th century'}	Master Humphreys clock	1840
Dunsany Edward John Moreton Drax Plunkett Baron	B2412	{3211394}		{'uc2.ark+=13960=t6h12zc73'}		Tales of war	1918
Pinkham Edwin George	B6583	{6832560}		{'nyp.33433076053168'}		Fates a fiddler	1908
Fowler Ellen Thorneycroft	B2712	{6802077}		{'njp.32101063691123'}		Kate of Kate Hall	1904
Green Anna Katharine	B3270	{3173399}		{'uc2.ark+=13960=t5db7wz3r'}		Initials only	1911
Sheppard Alfred Tresidder	B7473	{3297121, 3213403, 2438951}		{'nyp.33433075747067'}		The quest of Ledgar Dunstan	1917
Gogolʹ Nikolaĭ Vasilʹevich	B3366	{9111672, 8957382}		{'mdp.39015060360388'}		Dead souls  a poem	1852
Harland Henry	B3899	{3172068, 9448317}		{'uc2.ark+=13960=t41r6p77v'}		The royal end	1905
Clarke Ida Clyde Gallagher Mrs	B1500	{3195283}		{'nyp.33433074843115'}		Record no 33	1915
Hook Theodore Edward	B3838	{2846972}		{'uc2.ark+=13960=t00004q77', 'uc2.ark+=13960=t1qf8q81v', 'uc2.ark+=13960=t08w3dq93'}		Births deaths and marriages	1839
QuillerCouch Arthur Thomas Sir	B6859	{6669899, 3178148}		{'uc2.ark+=13960=t9z034848'}		The Westcotes	1901
Chatterton Georgiana Lady	B1617	{9437337}		{'nyp.33433074970686', 'nyp.33433074970660', 'nyp.33433074970678'}	{'English fiction'}	The heiress and her lovers  a novel	1863
Pemberton Max Sir	B6798	{6799012}		{'pst.000005699452'}		Beatrice of Venice  a romance 	1904
Smollett Tobias George	B7959	{3166666, 8899550}		{'pst.000002045375'}		Adventures of Sir Launcelot Gr	1771
Conrad Joseph	B1368	{9399633, 6825980}	{'Bibliographies'}	{'mdp.39015019761116'}		An outcast of the islands	1896
Keats Gwendoline	B4553	{6810489, 3169169, 6795934}		{'nyp.33433074871561'}		The Roman road	1903
Hill George Canning	B3733	{9010022}		{'nyp.33433076064082'}		Cap sheaf a fresh bundle	1853
Ward Mary Augusta	B8556	{2440517}		{'njp.32101064753666'}		Cousin Philip	1919
Smedley Frank E Frank Edward	B7603	{9015620}		{'uc1.b3326049'}		Frank Fairlegh or Scenes from the life of a private pupil	1864
Beck L Adams Lily Adams	B1158	{3217251}		{'uc1.b3710978'}		The empress of hearts n by E B	1928
Alcock Deborah	B176	{6783069}		{'uc2.ark+=13960=t6qz2b21w'}		By far Euphrates	1897
Raymond Walter	B7131	{8920689, 3151356}		{'uc2.ark+=13960=t8hd7qs9s'}		A tangled web	1899
Francis M E	B2853	{6787431}		{'uc2.ark+=13960=t3jw8b51f'}		Pastorals of Dorset	1901
Wedmore Frederick Sir	B8803	{6626099, 3168253}		{'uc2.ark+=13960=t5z60fh7d'}		English episodes	1894
Arami	B213	{6194487}		{'uiuo.ark+=13960=t5db8b07w', 'uiuo.ark+=13960=t6qz2ht7q'}		Cathal More or selflove and se	1852
Lefroy Edward Cracroft	B5079	{3183581}	{'Biography'}	{'mdp.39015059429921'}		Edward Cracroft Lefroy his lif	1891
Clouston J Storer Joseph Storer	B1567	{8898089, 6774366}		{'nyp.33433074946793'}		Adventures of M dHaricot	1902
Besant Walter Sir	B442	{9001762, 6792067}		{'mdp.39015063942547'}		No other way	1901
Berkeley Reginald	B678	{3298308}		{'nyp.33433074939277'}		The oilskin packet  a tale of the southern seas	1918
Barbauld Anna Letitia Mrs	B525	{5157956}	{'Anthologies', 'Juvenile audience'}	{'njp.32101068138005'}	{'Women', 'Moral education', 'Miscellanea', 'Education', 'Juvenile literature'}	A legacy for young ladies  consisting of miscellaneous pieces in prose and verse	1825
Train Elizabeth Phipps	B8325	{4089393}		{'nyp.33433076073117'}		The autobiography of a profess	1895
Kauffman Reginald Wright	B4629	{2435322, 8950818}		{'uc2.ark+=13960=t8x92286j'}		The house of bondage	1910
Swinnerton Frank	B7658	{3199547}		{'uc2.ark+=13960=t27945v1w'}		The chaste wife	1917
KayeSmith Sheila	B4621	{3214646}		{'uc2.ark+=13960=t5s75970g'}		Little England	1918
Mansfield Katherine	B6022	{2446208}		{'mdp.39015004990050'}		The doves nest and other stori	1923
Trollope Frances Milton	B8032	{4995766, 5901447}		{'mdp.39015013102853', 'mdp.39015013102887'}	{'Provenance', 'Graff, James H', 'Bookplate'}	Gertrude or Family pride	1855
Hemingway Richard DOyly	B3883	{9365913}		{'uc2.ark+=13960=t2v40pd1m'}		Three gentlemen from New Caled	1915
Begbie Harold	B1307	{3209610}		{'uc1.$b812567'}		The little that is good  stori	1917
Gsiorowski Wacaw	B3276	{3190243, 6820468, 8899038}		{'uc2.ark+=13960=t6j107r4f'}	{'Napoleon', '1769-1821', 'Emperor of the French'}	Napoleons love story	1905
MacDonald George	B5398	{9449556}		{'nyp.33433074875943', 'nyp.33433074875935', 'nyp.33433074875950'}	{'Scottish authors', 'English fiction'}	David Elginbrod	1863
Seers H Waddingham	B7447	{3199637}		{'nyp.33433011079229'}		Nature stories to tell to children	1918
Sturgis Howard Overing	B7381	{8892329}		{'mdp.39015059418056'}		Belchamber	1905
Merezhkovsky Dmitry Sergeyevich	B6071	{3176101}		{'uc1.b3933825'}		The birth of the gods	1926
Malet Hugh Poyntz	B5420	{8781400}		{'nyp.33433074880646'}		Lost links in the Indian mutin	1867
Strong L A G Leonard Alfred George	B7382	{2448274}		{'mdp.39015059418148'}		Dewer rides	1929
Hodder George	B4129	{5823379}		{'nyp.33433074931498'}		Sketches of life and character	1845
Beck L Adams Lily Adams	B776	{3221260}		{'uc1.$b85454'}	{'1734-1790', 'duchess of', 'Argyll, Elizabeth (Gunning) Campbell'}	The Irish beauties	1931
Frere Mary	B2922	{8663653, 8772463}		{'uc1.b4395430'}		Old Deccan days or Hindoo fair	1889
Riley W	B7081	{3196718}		{'uc2.ark+=13960=t4dn41r5c'}		Windyridge	1913
Crawford F Marion Francis Marion	B1324	{3162003, 8917181}		{'coo.31924021967033'}		Pietro Ghisleri	1893
Maugham W Somerset William Somerset	B5283	{3263753, 3422994}		{'mdp.39015030706421'}		The making of a saint	1898
Thanet Octave	B8135	{6758620}		{'nyp.33433081580858'}		The missionary sheriff being incidents in the life of a plain man who tried to do his duty	1899
Barber Margaret Fairless	B438	{6808135}		{'mdp.39015063914835'}		The grey brethren and other fragments in prose and verse	1901
QuillerCouch Arthur Thomas Sir	B6852	{6837451}		{'uc2.ark+=13960=t6057g755'}		Shakespeares Christmas and other stories	1905
Walpole Hugh Sir	B8878	{2490923, 3223979}		{'uc1.32106011861538'}		Rogue Herries a novel	1941
Meredith George	B5935	{6429931, 8693398}		{'nnc1.0037105329'}		Shaving of Shagpat	1896
Bowdich Sarah	B1257	{4705754}		{'hvd.32044009812777'}		The juvenile album or tales fr	1841
Maugham W Somerset William Somerset	B5235	{9024129, 6798093}		{'loc.ark+=13960=t3hx1xh4s'}		The merrygoround	1904
Thompson Sylvia	B8142	{3219672, 2482109}		{'uc1.$b245245'}		Winter comedy	1931
Hardy Arthur Lemuel	B3634	{8902743}		{'nnc1.0026608510'}		The clutch of circumstance	1909
Meagher Maude	B5588	{3237381}		{'uc1.$b301837'}		White jade	1930
Phelps E Stuart Elizabeth Stuart	B6643	{6724045}		{'uc2.ark+=13960=t14m9380r'}		Beyond the gates	1884
Cobban J Maclaren James Maclaren	B1571	{6774322}		{'nyp.33433074947007'}	{'English fiction'}	The angel of the covenant  memoirs of the early career of the admirable James Graham	1898
Montgomery Florence	B5483	{8661258}		{'nyp.33433074902317'}	{'English fiction'}	Peggy and other tales	1876
Becke Louis	B963	{6806959, 8897933, 3190197}		{'uc2.ark+=13960=t79s1p041'}	{'Australian fiction'}	Tom Gerrard	1904
Le Gallienne Richard	B4942	{8853561}		{'uc2.ark+=13960=t22b8zz7z'}		The romance of Zion chapel	1898
Parker Gilbert Sir	B6655	{3165979, 8877156}		{'uc2.ark+=13960=t3pv6d091'}		The lane that had no turning	1900
Manning Anne	B5841	{9138448}		{'uiuo.ark+=13960=t3320g23c', 'uiuo.ark+=13960=t4cn7n03t'}		Poplar house academy	1859
Mathew Frank James	B5441	{6670848, 6669843, 3268563}		{'nyp.33433074893334'}		One queen triumphant	1900
Fletcher J S Joseph Smith	B2850	{8874720, 3176001}		{'uc2.ark+=13960=t2x34vk3p'}		Lucian the dreamer	1903
Bailey H C Henry Christopher	B605	{3199845}		{'nyp.33433074920772'}		The gamesters	1919
Forbes Esther	B2668	{3231952, 2454430}		{'mdp.39015003675520'}	{'Massachusetts', 'Witchcraft', 'Salem'}	A mirror for witches in which is reflected the life machinations and death of famous Doll Bilby who with a more than feminine perversity preferred a demon to a mortal lover  here is also told how and why a righteous and most awfull judgment befell her destroying both corporeal body and immortal soul	1928
Besant Walter Sir	B747	{3156771}		{'uc1.$b249610'}	{'Science fiction', 'Wealth', 'Moral and ethical aspects', 'Inheritance and succession', 'Scientists'}	Beyond the dreams of avarice	1895
Morris William	B5646	{6759435}		{'uc1.b4102124'}		The water of the Wondrous isle	1896
Horne R H Richard H	B4143	{8415543}		{'mdp.39015062810984'}		The poor artist or Seven eyesi	1850
Mott Lawrence	B5803	{6806495}		{'uc2.ark+=13960=t92808w4j'}		Jules of the great heart	1905
Fairbank Janet Ayer	B2819	{3229894}		{'uc1.$b300210'}		The lions den	1930
Turner John Hastings	B8113	{3216576}		{'nyp.33433075761761'}		Simple souls	1919
Jacobs Joseph	B4404	{6455904, 8787991}		{'mdp.39015010396540'}		English fairy tales being the 	1916
Maxwell W B William Babington	B5280	{9069208, 6799347}		{'mdp.39015030383635'}		The rest cure	1919
Marshall Beatrice	B5912	{8883018}		{'uva.x030736348'}		Old Blackfriars a story of the	1902
Gordon Jan	B3413	{3193601}		{'mdp.39015047685923'}		A Balkan freebooter being the 	1916
Haggard H Rider Henry Rider	B3496	{9378917}		{'inu.32000000663122'}		The holy flower	1915
Parker Gilbert Sir	B6751	{8880677}	{'Canadian fiction'}	{'mdp.39015063945763'}		The right of way  a novel	1901
MDonogh Felix	B5823	{5108176}		{'uiuo.ark+=13960=t4rj4zq55', 'uiuo.ark+=13960=t0ms47n5n', 'uiuo.ark+=13960=t87h23t3j'}	{'823M147H'}	The highlanders	1824
Zangwill Israel	B9092	{6801672, 8877481}		{'mdp.39015030113396'}		The mantle of Elijah  a novel	1900
Thackeray William Makepeace	B8158	{8963303}		{'uc1.b3332120'}		The wolves and the lamb  Lovel the widower Roundabout papers	1863
Scott P E S	B7736	{3198701}		{'uc2.ark+=13960=t8hd7r52r'}		The interior	1916
Oliphant Mrs Margaret	B6283	{6806264}		{'nyp.33433074961834'}		The unjust steward or The ministers debt	1896
Beach Rex	B877	{3222662}		{'uc2.ark+=13960=t2988485k'}		The winds of chance	1918
Riley W William	B7274	{8446980}		{'nyp.33433075730576'}		The way of the winepress	1917
Joyce James	B4272	{2439431}		{'nyp.33433074863766'}		A portrait of the artist as a young man	1916
Locke William John	B4997	{8852032, 6771011}		{'uc2.ark+=13960=t8w953f3k'}		Derelicts	1897
Mottram R H Ralph Hale	B5292	{3320862}		{'mdp.39015039731628'}		Castle island	1931
Haggard H Rider Henry Rider	B3471	{6429844}	{'Bibliographies'}	{'coo.31924013476480'}	{'Africa', 'Hunting guides', 'Treasure troves', 'Missing persons', 'Adventure and adventurers'}	King Solomons mines	1886
Ryerson Florence	B7024	{3217425}		{'uc1.$b312431'}		Seven suspects	1930
Harraden Beatrice	B3473	{8903323, 6841766}		{'coo.31924064976875', 'coo.31924013479658'}		Katharine Frensham a novel	1903
Craik Georgiana M Georgiana Marion	B1325	{8516056}		{'coo.31924064984531'}		Without kith or kin	1872
Joyce James	B4443	{2439431}		{'nyp.33433074863766'}		A portrait of the artist as a 	1916
Thackeray William Makepeace	B8042	{4981582}	{'Autobiography', 'ContainsBiogMaterial', 'Bibliographies'}	{'mdp.39015063760709'}	{'Anne, 1702-1714', '1811-1863', 'Dictionaries, indexes, etc', 'Thackeray, William Makepeace', 'English literature', 'Great Britain', 'History'}	The history of Henry Esmond esq  colonel in the service of Her Majesty Q Anne written by himself	1852
Carey Rosa Nouchette	B1314	{8987338, 6811955}		{'coo.31924013453430', 'coo.31924064966785'}		Herb of grace	1901
Gartland Hannah	B3150	{8891357, 3175242, 3188877}		{'nyp.33433076068968'}		The house of cards	1922
Lincoln Joseph Crosby	B4730	{3214415}		{'mdp.39015023142634'}		Rugged water	1926
Cooke Marjorie Benton	B1732	{3198471}		{'uc2.ark+=13960=t3nv9cn6h'}		The threshold	1918
Duncan Norman	B2186	{3182115}	{'Bibliographies'}	{'nyp.33433022469690'}	{'Sea stories, American'}	The way of the sea	1903
Byrne Donn	B598	{3215411}		{'nyp.33433074862495'}		The foolish matrons	1920
Croker B M Bithia Mary	B1762	{6833434}		{'uc2.ark+=13960=t5q81kv9d'}		Babes in the wood	1916
Atherton Gertrude Franklin Horn	B45	{6800721, 9412306}		{'njp.32101064786278'}		The Californians	1898
Cooper James Fenimore	B1926	{8720962}		{'mdp.39015058488787'}		The borderers  a tale	1829
Maxwell W B William Babington	B5603	{3246824}		{'uc1.$b787157'}		The people of a house	1934
Homer	B3528	{9406189}		{'mdp.39015027627218'}		The Iliad of Homer rendered into English prose for the use of those who cannot read the original	1898
Perrin Alice	B6546	{6778426, 9285285}		{'nyp.33433075766331'}	{'English fiction'}	The waters of destruction	1905
Abbott Jacob	B291	{9108226}		{'njp.32101068162476'}		Wallace  a Franconia story	1850
Carey Rosa Nouchette	B1529	{8852626, 6795524, 6799317, 3163991}		{'nyp.33433074936059'}		Rue with a difference	1900
Kelly Florence Finch	B4532	{6783674, 9417044}		{'njp.32101068971207'}		With hoops of steel	1900
Gunning	B3463	{6191728}		{'uc2.ark+=13960=t5z60dt90', 'uc2.ark+=13960=t2x34pb6x'}		The exile of Erin or The sorro	1835
Frothingham Eugenia Brooks	B2847	{6813132, 3169989}		{'uc2.ark+=13960=t29882s9d'}		The evasion	1906
Barr Robert	B1065	{6760374}		{'uva.x001179982'}		Jennie Baxter journalist	1899
Scollard Clinton	B7881	{6754985}		{'mdp.39015063951043'}		The cloistering of Ursula  bei	1902
M I E	B5733	{4416478}		{'uc2.ark+=13960=t4fn16442'}	{'Eton College'}	The confessions of an Etonian	1846
Maughan Janet	B5856	{9433707}		{'uiuo.ark+=13960=t86h53j3s', 'uiuo.ark+=13960=t7vm4sm4q', 'uiuo.ark+=13960=t8df78w8p'}		The man of mark	1866
Orczy Emmuska Orczy Baroness	B6382	{3212263}		{'nyp.33433075723902'}		His Majestys wellbeloved an ep	1919
Robins Elizabeth	B6917	{2447863}		{'mdp.39015039496289'}		Time is whispering	1923
Le Roy Eugène	B4785	{8857547}		{'njp.32101068973195'}		Jacquou le croquant	1907
Wharton Edith	B8496	{3213686}	{'Short stories'}	{'mdp.39015019960767'}		Xingu and other stories	1916
Molière	B5248	{4851032, 8878619}		{'mdp.39015005306504'}		The dramatic works of Molière rendered into English	1673
Kavanagh Julia	B4528	{4454106, 8644391}		{'njp.32101068971058', 'njp.32101068970662', 'njp.32101068970654'}		Seven years and other tales	1860
Preedy George	B6621	{2441670}		{'uc1.b3144350'}		Tumult in the North	1931
Tirebuck William Edwards	B8117	{8970956, 6801100}		{'nyp.33433075763072'}	{'English fiction'}	Meg of the scarlet foot a novel	1898
Sudermann Hermann	B7412	{2444059}		{'mdp.39015064442604'}		The Indian lily and other stor	1911
Guerrazzi Francesco Domenico	B3375	{9146213}		{'nyp.33433075798854', 'njp.32101060914833'}		Beatrice Cenci A tale of the s	1858
Trueba y Cosío Joaquín Telesforo de	B8300	{5166424, 4699234, 8614048}		{'hvd.32044089251193', 'hvd.32044080209943', 'hvd.32044089251144'}		Gomez Arias or The Moors of th	1828
Alcock Deborah	B173	{8664591}		{'uc2.ark+=13960=t6639nz5k'}	{'Scotland', 'Reformation'}	The dark year of Dundee	1867
Anderson A J Arthur James	B44	{6755117}		{'njp.32101063580144'}	{'1444 or 1445-1510', '1444 or 5-1510', 'Botticelli, Sandro', 'IsBiographical'}	The romance of Sandro Botticelli woven with his paintings	1912
Freeman H W Harold Webber	B2671	{2455012}		{'mdp.39015004156280'}		Down in the valley	1930
Chambers Robert W Robert William	B1482	{3157365}		{'nyp.33433074809355'}		The king in yellow	1902
Kipling Rudyard	B4490	{9517004}		{'mdp.39015005738102'}	{'Provenance', 'Utopias', 'Brooke, Olave'}	A diversity of creatures	1917
Seton Ernest Thompson	B7371	{3168436}	{'Juvenile audience'}	{'mdp.39015039600534'}	{'Animals', 'Folklore', 'Anecdotes', 'Animals, Legends and stories of'}	Wild animals I have known and 200 drawings  zbeing the personal histories of Lobo Silverspot Raggylug Bingo the Springfield fox the Pacing mustang Wully snd Redruff	1898
