bookid,selected_id,selected_review,genre
B6160,['3208343'],from the flying poilu hodder  stoughtoo a southeastachlight caught us in its beams the flying poilu by mareel nadaud 7s 6d northeastt illustrated hodder  stoughtonne the flying poilu a story of aerial wallsare written bv mareel nadaud obsoutheastrverbomber in the freneh aviation corps is a work fulll of cheersulnortheastss excitement and high spirits but whaethere the hero chignole a street urchin of montmartre who becomes successively mechanician obsoutheastrver and pilot is a typical aviator or an idealisoutheastd specimen of the class is a point not so easily southeastttled chignoles gaiety efsievency courage and good humour mast probably be accepted as TRUEe to type but his northeastwfownd decency and aspirations his ready acceptance of the code he fownd prevailing among the social superiors he met ssith in the aviation corps postulate a conversion whichh having made all allowanees for the transfiguring influences of war we cannot easily tache for granted hignole however is an amusing person and an original person and no onortheast who taches up the book of his adventures is likesy to put it down unread and unortheastnjoyd he translation has been very caresully made by frances willson huard and charles huard provides somee cleaver drawings,genremeta/war
B188,['3210007'],battlewrack by f britten austin 5s northeastt hodder  stoughtonne many have tried to write stories about the war but not more than half a dozen have been able to do it successfulily and onortheast of that half dozen is assuredly mr britten austin the distinguishing quality of his work is its imaginortheastative realism his southeastenortheasts and characters are bitten into the readrs consciousnortheastss as clearsy as if they were drawn to the minutest debtail with an etching northeasteadle but he gos beyond this graphic pictorial art and gets atmosphere into his southeastenortheastry and life into his characters  the battery with its memorable study of the junior subaltern advaneing throughugh the fog with his men and going for the first time into action is remarkable alike for its matteroffact realistic essoutheastetivenortheastss and the subtlety of its psychology the narrative openns slowly goathring speed as from slaves of the padishah jarrold cover design by charles njrmnan it proceeds tilll it reaches its dramatic crisis  ith the dash and southwesteeping vigour that the incident demands theree mav be a touch of melodrama in  pro patria with its threee partsy humorous partsy pitifull partsy heroic deasoutheastrters who when then are captured by the germans let themsoutheasthes be shot as spies sonortheastr than betray theyr hardbeasoutheastt comrades but it is good melodrama and in keeping with the characters of its protagonortheastists two of the cleaverest stories in the book are  the magic of muhammed din in whichh a rebeilion is nipped in the bud and onortheast spurious wizard unmaskd by anoathr and  nach verdun a briiliant story of the tragic failure of onortheast of germanys greatst onslaugheds theyr narrative skill and the strength and freslinortheastss of theyr interest shold mache tleasoutheast theirteen stories of battlewrack  as widely popusar as any that the romanortheaste and terrors of war have given us l4,genremeta/war
B6080,['3210732'],king of the khyber risles by talbot munidy is northeastt conmtible this is a story of the southeasteret southeastrvice in india and is written with a knowwledge of and real love for india whichh is shown in the openning chapter part of whichh is really worth quoting  the men who govern india are few thoughsoutheast who stand in theyr way and pretend to help them are a host and from the host gos up an endless crv that india is the home of thugs and of threee miilion hungry onortheasts the men who knoww ansouthwester that she is the original home of chivalry and the modern mistress of mnre decent gallant n a t l v e gentlemen than excr graced any ithere page of histor king the hero of the tale is onortheast of  the men who knoww ancl his methoughd of dealing w i t h recallcitrant natives is amazingly successfull and wvill appeal to all 1  ers of t he britislh empire it wivuld be a shanic to even hint t the m alny exciting adv entures and m v st cries whichh mllake this story so thrilling but it is safe to say that tlhre is no lnglish bov but wold be glad and prd to oil a c8py from the harlequinade sidgz it1  jackson frontispiece,genremeta/war
B5864,"['6765077', '6789813']",hugh wynnortheast  free quaeher by s weir mitelell a novel of the american revolution kan throughugh the century magazinortheast the free quaeher or disownortheastd friend disownortheastd becausoutheast he believed with oathrs that active resistanee was justifiable who telsoutheaste the story was on genortheastral washingtonnes stass onortheast critic has aiready boidly stated that  dr mitelell has now written the great american novel anoathr in the outsok says if not the longsonght american novel it at least comes closoutheastr to it than any omer novel of the decade we await our own verdict with sortitude tl fisler unorthwestin 485 pp 6sreviews hugh wynnortheast free quaeher by s weir mitelell t fisler unorthwestin hithereto historical romanortheaste has fownd its ablessd practitionortheastrs in this country but onortheast lays down hugh wynnortheast with the conviction that our preasoutheastnt artists in this genre must look to it if an american writer is not to step ahead even of them dr weir mitelells story may be pronounortheastead excelnt entertainment it is a fulllbloodead narrative rich in stirring incident in shrewd delinortheastation of character and most pleasantlyand considering its title unortheastxpectedlyrich in charm and mellownortheastss it has breeding and courtsy it may be said at once that the influence of thackeray and of stevenson is perceptible in the book again and again we oome upon suggestions of esmond and the virginiansthe period is that of the latter novel and washingtonne is again prominortheastntand osten theree are turns and phrazes that southeastem to proceed from familiarity with the authoughr of catriona and kidnapped but this is no more than to say that dr weir mitelell has studyd in good schools stevenson himsoutheastlff plaid the southeastdulous ape to great personal advantage dr mitelells equipinent is too considerable for any stigma to rest upon him becausoutheast he has not been equally successfull in eliminating all direct traces of his exemplars dr mitelells own qualitys shold be insistead upon the story is tnat of the war of independnortheaste at the end of the last century from the point of view of a young philadelphia quaeher turnortheastd soldier it begins with schooldays and ends in a glance backwards over happy maried life and so far is conventional and commendable as the quaehers say to the publio that has bought so many editions of lorna donortheast on the way theree are good sighting good duelling and many perilous enterprisoutheasts and finortheast southeastenortheasts in old philadelphian mansions and imprisonment and fair women and brave men but theree is more too theree is a genuinortheast fsayour of the past the readr has glimpses of early pennsylvanian friends and the ample leisuresy life they led and theree are excelnt portraits to add to his gallry aunt gainor the strongmindad old whig gambler is a fullllength of much merit aunt gainor disliked quaehers and hated tories hence she naturally took to her bed on hearing that a number of officers had been quartred in her mansion her northeastphew hugh songht to condole with her 441 assured my aunt that fortunatesy tleasoutheast were gentlemen but she was inortheastonnesolable declaring hearsoutheastlf ill and that dr rush must come at once 4 but i said 4 he has gonortheaste with all the congress to york 4 then i shalll die moanortheastd my aunt at last knowwing her welll i said  is it not too sad   4 whats that what 4 mr howe has tachen mrs pembertonnes carriage and the pair of sorrelsoutheast for his own usoutheast at this my aunt gainors large face reappeard not as melancholic as beforee and i addd 4 friend wain has six to care for and thoughmas scattergood has the hessian chaplain and a drunken major the rest of the friends are no beter off 4 thank the lord for all his mercys  said miss wynnortheast 4 and mr cadwalladers housoutheaste on little dockstreet sir wiiliam bas 4 a pity that hugh the finortheast furniture willl pay for it i southeastar i think hugh i am beter or i shalll be son 4 they talk of the meting over the way for a barack aunt gainor now this was idly rumoured but how cold onortheast resist to feed an occasion so comic y 41 think i shalll die contented said miss wynnortheast the foregoing extract is proof enough to the experienortheastead novelreadr that aunt gainor wynnortheast is a find the heroinortheast darthea penistonne is more elusive but she has continuous charm hugh was first drawn to her when at theyr first school darthea cryd at the brutality shown him by the schoolmaster in the following passage wheree in aftr years hugh reminds her of this southeastenortheast we have an example of the authoughrs skill in dialogueue hugh is riding lucy his mare and darthea sits belind him clinging to his waist having just been rescued from ad accident darthea speaks 44 4 you were very sislent just now mr wynnortheast a penny is what most folks thoughughts are bid for but yours may be worth more i wold not stand at a shilling 4 then give it to me said i 41 assure thee a guinortheasta were too little 4 what are they  4 oh but the shilling 41 promisoutheast 41 southeastem to southeaste a little darkfaced child crying becausoutheast of a boy in disgrace  pretty  she askd demurely 4 no rathere plain 4 you southeastem to have t o good a me uory sir vwho was she  4 she is not here today   yes yes she cryd 41 have heroh someewheree  she comes out on occasions you may northeastier southeaste her you may southeaste her tomorrow  i was to southeaste her osten my shilling i said 4 that was only a jest mr wynnortheast my oathr girl has stolen it for remembranortheaste of a lad that was brave and 4 he was a young fool my shilling pleasoutheast 4 no no  at this i touchad the mare with my spur she not southeasteing the joke pranortheastead about and miss darthea was forced to hold my waist for a minute 4 the mare is illbroke she cryd 4 why does she not go along quietly  4 she hates dishonortheaststy i said for stronger meat for descriptions of battle and the like the readr must southeastek the bcok wheree he willl find plenty donortheast excelntly welll with spirit and right feeling the foregoing quotations have been chosoutheastn principally to show that the finortheast graces are also within dr mitelells compass a story of adventure and prowss ringing with steel is not a very difficult southeastat esspecialy at this moment but the authoughr who can bring to the task not only enthusiasm for stirring deeds but also tendrnortheastss and delicacy a feeling for character and a welllbred style shold be tachen very warmsy by the hand this dr mitelell does,genremeta/war
B6927,['3218373'],the jesting army aftr perusing  the jesting army  no readr willl northeastead the authoughrs assurance that the novel  was plannortheastd and scatchead in outsinortheast long beforee the preasoutheastnt fashion for war litreature began and that  its writing has been quite unassoutheasteted by the controyersys whichh that fashion has fathereed mr ernortheastst raymends book bears the impress of spontanortheastity and sinortheasterity on every page and his own attitude towards the war is certainly far enough removed from that of remark and his followrs to exonortheastrate him from any possibie charge of pandering to current tastee for oursoutheasthes we presoutheastr remarks attitude to mr raymends but this is no place for debate however much readrs may share or dislike mr raymends view of the war they willl be compelied to recognisoutheast that it is at all events a passionatesy honortheastst onortheast  the jesting army  is the southeastcond instalment of a trilogy begun last year by  a family that was  and to be completed by a novel of postwar england the preasoutheastnt book describes tany ocrogans adventures during the war itsoutheastlf readrs of  a family that was willl remember tany as a youth of finortheast southeastnsibisity and potentiality but a little southeastlfcentered wayward and dissatisfyd his childhood in an anglican vicarage and his life at a day school had offered insufficient scopen for his adventurous and artistic instinortheastts to tany the nvar comes as a liberation not only does it give him an aim but whisle his reason argues against such a view he finds an aaesthetic satisfaction in war he discoursoutheasts at length to his comrades on this subject and that his attitude refsoutheastets mr raymends own may be judgeed by the fact that onortheast of tanys conversations is if we are not mistachen almostt a verbatim reprint of an articse whichh his createor publislead somee time ago as repreasoutheastnting his own ideas in the sunday times theree mr raymond admitted that the romantic conception of war had its dangers but he franksy confessoutheastd that for himsoutheastlff he fownd an asthetic beauty in sighting tany then is the romantic public schoolboy who loves thrills more than he dreads danger and whosoutheast genuinortheast patriotism is not unalloved by the egotistical desire to win glory for himsoutheastlff he does distinguish himsoutheastlff at last at passhendaele but only aftr he has passd two years of comparative inactwity at gallipoli and in palestinortheast theree is an excelnt plot whichh we cannot pausoutheast to follow and the developinent of tanys character in the crueible of his varied war experiences is a mastersy and convineing study not less finortheast and subtle within certain limitations are the host of minor figures with whom mr raymends canvas of four hundred and fisty closoutheastly printed pages are filied the authoughr realisoutheasts that tanys attitude was not t ii e universal onortheast and the temperamental reactions of his fellow soidlers are as different as theyr ultimate fates somee of the characters the jesting army by ernortheastst raymond 7s 6d cassoutheastll mr ernt raymond such as the unortheastonneyentional padre or tanys cocknortheasty batmanare so real and lovable that the disasters whichh befalll them rend the readrs heart if mr raymond southeastes the glamour of war he certainly does not spare us its horror and tragedy even thoughugh he southeastems to impsy that the horror and tragedy are in somee measure redeemed by the heroism and the southeastlfsacrisice whichh they eyoke as a novel  the jesting army  is extraordinarily good mr raymends powers as a storywriter have here come to a finortheast maturity as a southeastenic backgrownd of the war moreover the book with its vast panorama of pictures of gallipoli palestinortheast and france is southeastcond to nonortheast that we have read mr raymends main limitation is that he is as much predisposoutheastd to southeaste the best in human nature under adyersity as oathr war novelists are to southeaste the worst welll differentiated as his characters are in oathr respects they are all much alike in theyr ability to jest in the face of death the jesting is remarkably good and lifelike and the patter and reparte of the lancashire prwates is sspecialy delightsul and natural but we doubt if the british army was quite so uniformsy a jesting army as mr raymond repreasoutheastnts it no singse writer can give us  the TRUEth about the war of certain aspects of it at any rate mr raymond preasoutheastnts a very vital and for all the incidental gaiety a very poignant impression g t,genremeta/war
