author	bookid	bpoids	genres	htrcids	subjects	title	is_fic
Christie Agatha	B1618	{2444927}	{'Mystery fiction'}	{'nyp.33433074970710'}	{'Belgians', 'Private investigators', 'England', 'Poirot, Hercule (Fictitious character)'}	The mysterious affair at Stiles  a detective story	
Harte Bret	B3802	{8617030}		{'uc1.32106014537853'}		Gabriel Conroy	
Fletcher J S Joseph Smith	B2757	{3217848}	{'Mystery fiction', 'Detective and mystery stories'}	{'nyp.33433075727010'}		The Chestermarke instinct	
Howe Sonia Elizabeth	B3879	{3209761}		{'uc2.ark+=13960=t2j67j06j'}	{'Description and travel', 'Soviet Union', 'World War, 1914-1918'}	Real Russians	
Reid Christian	B7105	{3188081, 8968015, 6791431}		{'uc2.ark+=13960=t6445jb5g'}		The man of the family	
Haliburton Thomas Chandler	B3728	{8887463, 9419922, 8906778, 4703911}		{'nyp.33433074931563'}	{'Canadian wit and humor'}	The clockmaker or the sayings and doings of Samuel Slick of Slickville	
Camp Wadsworth	B1527	{8935635}		{'nyp.33433074935457'}		The hidden road	
Burnett Frances Hodgson	B1004	{8968211}		{'uc2.ark+=13960=t9z030k35'}		A lady of quality	
Green Julien	B3022	{2484923}		{'mdp.39015030356128'}		The dark journey	
Lee Vernon	B5106	{6857107}		{'uc1.l0090959347'}		Vanitas  polite stories	
Wells H G Herbert George	B8484	{3222333, 2447510}		{'mdp.39015066062178', 'mdp.39015006588621'}		The world of William Clissold  a novel at a new angle	
Mackenzie Compton Sir	B5267	{3212733}		{'mdp.39015014305521'}		The old men of the sea a romance of adventure in the south Pacific	
Haggard H Rider Henry Rider	B3958	{3279933}		{'uc2.ark+=13960=t8x924p77'}		Stella Fregelius	
Hyne C J Cutcliffe	B3849	{3172819}		{'uc2.ark+=13960=t0js9hg50'}		Atoms of empire	
Green Anna Katharine	B3162	{9054509}		{'nyp.33433076089972'}	{'American fiction'}	The house of the whispering pines	
MacLane Mary	B5331	{6794061}		{'mdp.39015066051429'}		The story of Mary MacLane	
James Lionel	B4316	{6798780}		{'nyp.33433082442447'}	{'Russo-Japanese War, 1904-1905'}	The yellow war	
Croker Marianne Nicholson	B1327	{4710425}		{'hvd.32044004468302'}		The adventures of Barney Mahoney	
Macaulay Mrs Fannie Caldwell	B5973	{8958043}		{'njp.32101037987375'}		The house of the misty star a 	
Sheppard Alfred Tresidder	B7473	{3297121, 3213403, 2438951}		{'nyp.33433075747067'}		The quest of Ledgar Dunstan	
London Jack	B4772	{6810552, 9097777, 3278203, 9012838, 3203231}	{'Juvenile audience', 'Bibliographies'}	{'njp.32101067626562', 'wu.89006659528'}	{'Carmalt, Geraldine Woolsey', 'Gold discoveries', 'Animal welfare', 'Pet theft', 'Provenance', 'Yukon', 'American literature', 'Dogs', 'Sled dogs', 'Wolves', 'Feral dogs', 'Klondike River Valley', 'Bookplate'}	The call of the wild	
Freiherr de La MotteFouqué Friedrich Heinrich Karl	B2907	{2857201}		{'njp.32101066909290'}		Thiodolf the Icelander  from t	
Croker B M Bithia Mary	B1762	{6833434}		{'uc2.ark+=13960=t5q81kv9d'}		Babes in the wood	
Meredith George	B6052	{8545720}	{'Bibliographies'}	{'mdp.49015002138114', 'mdp.39015014607702'}		The tragic comedians a study i	
Scott Walter Sir	B7623	{2487718}		{'uc1.b4102467'}		The Waverley pageant the best passages from the novels of Sir Walter Scott selected	
Rook Clarence	B7021	{3164970}		{'uc1.$b269202'}	{'London', 'Gangs', 'Biography', 'England', 'Hoodlums', 'IsBiographical'}	The Hooligan nights	
Child Richard Washburn	B1493	{3175405}		{'nyp.33433074812102'}		The blue wall	
Stockton Frank Richard	B7401	{8864530}		{'mdp.39015063956869'}		The young master of Hyson Hall	
Paulding James Kirke	B6430	{2851516}		{'dul1.ark+=13960=t5p850s0b'}		The merry tales of the three wise men of Gotham	
Cullum Ridgwell	B1750	{6830232, 3161106, 9049542}		{'uc2.ark+=13960=t52f7t83w'}		The watchers of the plains	
Huntington J V Jedediah Vincent	B3743	{8762705}		{'nyp.33433076079361'}		Rosemary or Life and death	
Hope Anthony	B3475	{6685500}		{'coo.31924013480771', 'coo.31924064977006'}		Tales of two people	
Curtis George William	B1677	{8634570}		{'uc1.b3324208'}	{'American fiction'}	Prue and I	
Davis John Francis Sir	B2536	{5077249}		{'uc1.b4110102'}		Chinese novels translated from	
Inchbold A C A Cunnick	B4200	{3199572}		{'wu.89005366653'}		Love and the crescent a tale o	
Frankau Julia	B2743	{9033761, 3170379}		{'nyp.33433074854526'}		The Sphinxs lawyer	
Deland Margaret Wade Campbell	B2460	{8919719}		{'mdp.39015012372374'}		The awakening of Helena Richie	
Praed Campbell Mrs	B6642	{6795969, 6789002, 3184553, 8985511}		{'uc2.ark+=13960=t11n83c80'}		The scourgestick	
Waugh Evelyn	B8467	{3228157}		{'inu.30000003130279'}		Decline and fall	
Birmingham George A	B399	{6847570}		{'mdp.39015035069973'}		The lost tribes	
Hewlett Maurice Henry	B3588	{3195793}		{'mdp.39015063932183'}	{'Discovery and exploration', 'Norse'}	Gudrid the Fair	
Fitzgerald Percy Hetherington	B2887	{9432949}		{'uiuo.ark+=13960=t4xh0000f', 'uiuo.ark+=13960=t3ws92630', 'uiuo.ark+=13960=t9r219w9w'}	{'823F575SE'}	The second Mrs Tillotson	
Hollis Margery	B3811	{8837875}	{'Three deckers'}	{'uc1.b3143049', 'uc1.b3143047', 'uc1.b3143048'}		Up in arms	
Hawker Edward	B3983	{5001681, 9019545}		{'uiuo.ark+=13960=t85h7wt97', 'uiuo.ark+=13960=t9t15cp7v', 'uiuo.ark+=13960=t7mp5dj3p'}		Arthur Montague or An only son at sea	
Rossiter Elizabeth	B7211	{8592004}		{'uc1.b4948989'}		The lemon garden	
Wood Kate	B8837	{9437790}		{'uiuo.ark+=13960=t0dv26t3k', 'uiuo.ark+=13960=t3zs3dq8m', 'uiuo.ark+=13960=t4th95x1k'}	{'823W855S'}	Sir Cyrus of Stonycleft	
Howitt William	B3494	{4417149, 8991757}		{'inu.30000020693762', 'uc1.b3324487'}	{'England', 'Country life'}	The hall and the hamlet or Scenes and characters of country life	
Maitland Ella Fuller	B5707	{6632628}		{'uc2.ark+=13960=t2v40qk2r'}		Pages from the daybook of Bethia Hardacre	
Farjeon B L Benjamin Leopold	B2914	{3162865, 8821822}		{'nyp.33433075761027'}		Samuel Boyd of Catchpole Squar	
Benson Stella	B1058	{3221687}		{'uva.x000055897'}		The poor man	
Castle Agnes Sweetman	B1658	{6782973}		{'uc1.$b323549'}		The Bath comedy	
Harrod Frances ForbesRobertson	B3993	{6770435, 3176448, 6780515, 8862359}		{'uva.x030765473'}		The potentate	
Judson Katharine Berry	B4425	{3217727}		{'uc2.ark+=13960=fk5m902c7t'}		Myths and legends of Californi	
Wilson A N	B8979	{3237437}		{'mdp.39015024897178'}		Daughters of Albion	
Grant James	B3408	{8663398}		{'nyp.33433074866173'}		First love and last love a tal	
Forster E M Edward Morgan	B2917	{2433619}		{'uc1.b3831923'}		The celestial omnibus and othe	
Hichens Robert Robert Smythe	B3482	{6659974}		{'coo.31924064995479'}		Flames a London phantasy	
Hatton Joseph	B4061	{6791613}		{'nyp.33433074857867'}		When rogues fall out  a romanc	
Tinayre Marcelle	B8056	{6763363}	{'Autobiography'}	{'mdp.39015066646293'}		Madeleine at her mirror a woma	
Maxwell W B William Babington	B5204	{8991201}		{'coo.31924064998200', 'coo.31924013651165'}		The ragged messenger	
Richardson Dorothy M Dorothy Miller	B7071	{2439552}		{'uc2.ark+=13960=t38053k96'}		Honeycomb	
Beresford J D John Davys	B332	{3236198}		{'inu.39000002775034'}		The Camberwell miracle	
Smith James	B7438	{9421151}		{'nnc1.1002387450'}		Memoirs letters and comic miscellanies in prose and verse of the late James Smith	
Synge J M John Millington	B7860	{6817439}	{'Drama'}	{'uc1.b4689895'}		The tinkers wedding a comedy i	
Patten William	B6446	{6788536}		{'mdp.39015005601268'}	{'Short stories'}	Great short stories	
Atherton Gertrude Franklin Horn	B34	{3198886}		{'mdp.39015063753738'}		Black oxen	
Barry Alfred Scott	B558	{3210975}		{'nyp.33433074799044'}		The little girl who couldntgetoverit	
Dale Alice M	B2216	{6772445}		{'nyp.33433074951876'}	{'Conversion', 'Atheists'}	Marcus Warwick  atheist	
Mordaunt Elinor	B5571	{3256103}		{'uc1.$b243647'}		Travellers pack	
Barclay Florence L Florence Louisa	B649	{6851259}		{'nyp.33433074932223'}		The wheels of time	
Scott John Reed	B7539	{6828033}		{'nyp.33433076044274'}		The colonel of the Red huzzars	
Crockett S R Samuel Rutherford	B1977	{3256218}		{'njp.32101063606683'}		The lilac sunbonnet  a love st	
Hurst Edward Harry	B3744	{9052989}		{'nyp.33433076079718'}		Mystery Island	
Lagerlöf Selma	B4719	{6756032, 8978625, 6810707, 3171046}	{'Bibliographies'}	{'mdp.39015005188720', 'mdp.39015005190114'}		Gösta Berlings saga	
Powys John Cowper	B6618	{2486360}		{'uc1.32106002008461'}		A Glastonbury romance	
Yeats W B William Butler	B9007	{8978327}		{'njp.32101067487569'}	{'Drama'}	Where there is nothing	
Pickthall Marmaduke William	B6792	{3192077}		{'uc2.ark+=13960=t6rx95n7z', 'nyp.33433075754675'}		The house of Islâm	
Kipling Rudyard	B4679	{3262315}		{'uva.x001640982'}		Soldiers three	
Thornbury Walter	B8137	{9426569}		{'nyp.33433084128663'}		Tales for the marines	
Holme Constance	B3516	{3190451}		{'mdp.39015012979574'}		Crump folk going home	
Overton Gwendolen	B6350	{3282776}		{'uc2.ark+=13960=t8w951b0z'}		Captains of the world	
Williamson C N Charles Norris	B8638	{6743866}		{'nyp.33433075772693'}		The Princess Virginia	
Ridge W Pett William Pett	B7010	{9300334, 6815134}		{'nyp.33433081588182'}		Name of Garland	
Barr Amelia Edith Huddleston	B559	{6830646}		{'nyp.33433074800305'}		A reconstructed marriage	
Freeman Lewis R Lewis Ransome	B2803	{3223207}		{'nyp.33433081825121'}		Down the Yellowstone	
Lever Charles James	B4903	{8861178}		{'uc1.b3324545'}		Gerald Fitzgerald the chevalier  a novel	
Butts Mary	B816	{2483933}		{'uc1.b3810863'}		Death of Felicity Taverner	
Robinson F W Frederick William	B7282	{9432582}		{'nyp.33433061815555'}		Prison characters drawn from l	
Manning Anne	B5980	{4994546, 9159042}		{'nyp.33433074899000'}		The colloquies of Edward Osbor	
Burgess Thornton W Thornton Waldo	B1119	{6747740, 3180749}		{'mdp.39015034642069'}		The adventures of Prickly Pork	
KayeSmith Sheila	B4510	{3218782}		{'mdp.39015059405665'}		Susan Spray	
Macnaughtan S Sarah	B5521	{9055521, 3179699, 6834883}		{'nyp.33433074917083'}		Three Miss Graemes	
Maitland Ella Fuller	B5979	{6632628}		{'uc2.ark+=13960=t2v40qk2r'}		Pages from the daybook of Beth	
Defoe Daniel	B2430	{4361789}		{'mdp.39015078556431'}		The little Robinson Crusoe	
Locke William John	B4756	{8945994}		{'mdp.39015063938933'}		Simon the jester	
Boccaccio Giovanni	B1121	{8849659, 6767308}		{'uva.x000598231'}		Tales from Boccaccio done into	
Bindloss Harold	B1213	{8893360}		{'nyp.33433074939582'}		The lure of the North	
Boyle Constance Antonina	B628	{3312370}		{'nyp.33433074929583'}		What became of Mr Desmond	
Disraeli Isaac	B2500	{4441356}	{'ContainsBiogMaterial'}	{'uva.x001189997'}		Curiosities of literature  fir	
Webbe Cornelius	B8588	{8653008, 5814113, 4698132, 4612008}		{'nyp.33433074928296'}		Glances at life in city and suburb  2nd series	
Bell Lillian Lida	B587	{3170115}		{'nyp.33433074835764'}		The love affairs of an old maid	
Oxenham John	B6296	{3182638}		{'nyp.33433075744783'}		Queen of the guarded mounts	
Converse Florence	B1506	{6847650}		{'nyp.33433074846597'}		The children of light	
Mottram R H Ralph Hale	B5574	{2453066}		{'uc1.$b244112'}		The boroughmonger	
Wyllarde Dolf	B8646	{6767396}		{'nyp.33433075872733'}		Youth will be served	
Beck Edward	B1253	{8997521, 5166457}		{'uc1.$b271263'}		A packet of seeds saved by an 	
Stowell Bellanne	B7943	{9454605}		{'mdp.39015063959301'}		Manxland a tale With an introd	
Dole Nathan Haskell	B2141	{3170658}		{'mdp.39015063512290'}		Omar the tentmaker a romance of old Persia by Nathan Haskell Dole illustrated by Frank T Merrill	
Chester George Randolph	B1491	{9507254}		{'nyp.33433074810734'}		Cordelia Blossom	
Locke William John	B4736	{2442054}		{'mdp.39015048889342'}		The shorn lamb	
Duncan Norman	B2186	{3182115}	{'Bibliographies'}	{'nyp.33433022469690'}	{'Sea stories, American'}	The way of the sea	
Luther Mark Lee	B4861	{3164657}		{'nyp.33433076024540'}		The favor of princes	
Redding Cyrus	B7270	{8773503}		{'njp.32101065704353', 'njp.32101065704346', 'njp.32101065704262'}		Keeping up appearances a novel	
Wise H A Henry Augustus	B8981	{2877796, 8645390}		{'nyp.33433008158994'}		Captain Brand of the Centipede	
Grand Sarah	B2962	{6693035}		{'coo.31924013619998'}		Emotional moments	
Royalist	B7163	{8665047}		{'uiuo.ark+=13960=t9280v59k', 'uiuo.ark+=13960=t61553q20', 'uiuo.ark+=13960=t45q5ff94', 'uiuo.ark+=13960=t9p27d82b'}		The loyalists daughter	
Meredith George	B5242	{8774297, 3211357, 8943685}	{'Bibliographies'}	{'wu.89000630681', 'mdp.39015066325542', 'uc1.b3328915', 'wu.89000630780', 'mdp.39015002327651', 'mdp.39076006605567', 'mdp.39015066325682', 'wu.89000630624', 'uc1.b3328922', 'uc1.b3328931', 'mdp.39015004114396', 'mdp.39015066324818', 'wu.89000630764', 'uc1.b3328925', 'uc1.b3328917', 'mdp.39015066325112', 'mdp.39015066324834', 'mdp.39015066324974', 'uc1.b3328930', 'uc1.b3328928', 'uc1.b3328916', 'mdp.39015066325690', 'wu.89000630723', 'uc1.b3328919', 'wu.89000630673', 'uc1.b3328934', 'wu.89000630756', 'mdp.39015066324826', 'mdp.39015066325120', 'wu.89000630665', 'wu.89000630442', 'nyp.33433067296149', 'uc1.b3328932', 'uc1.b3328933', 'uc1.b3328923', 'mdp.39015066325393', 'uc1.b3328920', 'mdp.39015009039309', 'wu.89000630806', 'mdp.39015013507721', 'wu.89000630640', 'mdp.39076006605476', 'wu.89000630699', 'wu.89000630731', 'mdp.39015066324966', 'wu.89000630707', 'wu.89000630632', 'wu.89000630657', 'uc1.b3328921', 'uc1.b3328927', 'wu.89000630749', 'mdp.39015066324800', 'mdp.39076006605443', 'nyp.33433067296099', 'mdp.39076006605559', 'uc1.b3328926', 'mdp.39015065432828', 'wu.89000630798', 'uc1.b3328924', 'mdp.39015012972082', 'uc1.b3328918', 'mdp.39015066324842', 'mdp.39015027577835', 'wu.89000630483', 'mdp.39076006605500', 'mdp.39015066324958', 'wu.89000630616', 'wu.89000630327', 'mdp.39076006605526', 'mdp.39015066325104', 'uc1.b3328929', 'mdp.39076006605427', 'mdp.39015066325385', 'nyp.33433067296172', 'nyp.33433067296107', 'wu.89000630467', 'wu.89000630772'}	{'English literature'}	The works of George Meredith	
Tabor Eliza	B8232	{8536388}		{'uiuo.ark+=13960=t9h42cg59', 'uiuo.ark+=13960=t4bp0qm52', 'uiuo.ark+=13960=t1wd4h96x'}		The last of her line	
Francis M E	B2872	{9018182}		{'uc2.ark+=13960=t7mp4xk2g'}		Lychgate Hall	
Scotus Johannes	B7803	{4362067}		{'uc1.b3324272', 'uiuo.ark+=13960=t54f2dt68'}		The weird of the Wentworths a 	
Yates Edmund Hodgson	B9004	{9433186}		{'njp.32101065605733'}		Kissing the rod A novel	
Lyall Edna	B4880	{8848252, 6770724}		{'uc1.$b112594'}		Wayfaring men	
OFlaherty Liam	B6249	{3225649}		{'mdp.39015048710043'}		Skerrett	
Irving Washington	B4184	{8664794, 4969372}	{'Autographs (Provenance)', 'Bookplates (Provenance)', 'Illustrated works'}	{'nyp.33433076087919', 'nyp.33433076087901'}		Tales of a traveller	
Van Vorst John Mrs	B8373	{6801422}		{'nyp.33433076050701'}		Bagsbys daughter	
Packard Frank Lucius	B6632	{8975566}		{'uc1.b4689293'}		The miracle man	
Lever Charles James	B5150	{6244321}		{'njp.32101068141751'}		Maurice Tiernay  the soldier o	
Beerbohm Max Sir	B1105	{6784694}		{'uc1.b3796838'}		The happy hypocrite a fairy ta	
Fisher Dorothy Canfield	B2815	{3186283}		{'uc1.$b244183'}		Raw material	
MacDonald Alexander	B6047	{9429916}		{'nyp.33433074875984'}		The white trail A story of the	
Webster Henry Kitchell	B8656	{6798001, 6815190}		{'nyp.33433076058530'}		The banker and the bear	
Diver Maud	B2125	{2446588}		{'mdp.39015039646750'}		Siege perilous and other stories	
Grant James	B3445	{8676479}		{'coo.31924013459437'}		The secret dispatch a novel	
Gide André	B3418	{2441860}		{'mdp.39015005782803'}		The school for wives Robert Ge	
Wister Owen	B8582	{6787514}		{'nyp.33433074795125'}	{'American fiction'}	The Virginian  a horseman of the plains	
Owen Octavius Freire	B6356	{6252549, 8446711}		{'uiuo.ark+=13960=t9s18jz2x', 'uiuo.ark+=13960=t12n5qb1s', 'uiuo.ark+=13960=t3611mk46'}		Raised to the peerage	
Marchmont Arthur W Arthur Williams	B5462	{6786920, 8842128}		{'nyp.33433074895685'}		The greatest gift	
Maugham W Somerset William Somerset	B5440	{3167145, 6820618, 8925428}		{'nyp.33433074893086'}		The explorer	
Synge J M John Millington	B7626	{6817439}	{'Drama'}	{'uc1.b4689895'}	{'1907'}	The tinkers wedding a comedy in two acts	
Anley Charlotte	B216	{5081635}		{'hvd.32044089606933', 'hvd.32044086796158'}		Influence a moral tale for you	
Combermere	B1821	{9450034}		{'uiuo.ark+=13960=t7vm4wc4t', 'uiuo.ark+=13960=t18k7z08h', 'uiuo.ark+=13960=t11n8qr10'}		Shattered idols	
Caine Hall Sir	B2019	{3162358}		{'mdp.39015063513488'}		The Manxman a novel	
Beck L Adams Lily Adams	B775	{3245806}		{'uc1.$b85452'}		The gallants following according to their wont the ladies	
Francillon R E	B2883	{3173488}		{'uiuo.ark+=13960=t4nk3qw9g', 'uiuo.ark+=13960=t25b0gp1k', 'uiuo.ark+=13960=t01z4k948'}		Jack Doyles daughter	
Shelley Mary Wollstonecraft	B7806	{5809210}	{'Novel'}	{'uiuo.ark+=13960=t6c25j15x', 'uiuo.ark+=13960=t8x92v101'}	{'Twenty-first century', 'End of the world', 'Plague'}	The last man	
MacNamara Brinsley	B5709	{2455725}		{'uc2.ark+=13960=t2x34nz6k'}	{'Irish fiction'}	The valley of the squinting wi	
Heuser Kurt	B3786	{2485314}		{'uc1.$b313754'}		The inner journey	
Thurston E Temple Ernest Temple	B8244	{8891009, 3177501}		{'wu.89000839936'}		The city of beautiful nonsense	
Braddon M E Mary Elizabeth	B1045	{4383185}		{'uiuo.ark+=13960=t4cn7np5r', 'uiuo.ark+=13960=t7rn3q28p', 'uiuo.ark+=13960=t96690h86'}		Deadsea fruit	
Johnston Mary	B4358	{3275461}		{'uc2.ark+=13960=t3st7f68m'}	{'United States', 'History', 'Civil War, 1861-1865'}	Cease firing	
Nathan Robert	B6088	{3249483}		{'mdp.39015028773961'}		The woodcutters house	
Von Arnim Elizabeth	B8353	{9286178, 6839811}		{'wu.89006603195', 'mdp.39015035824971'}		The Princess Priscillas fortni	
Henty G A George Alfred	B4155	{3174288}	{'Juvenile audience'}	{'uc2.ark+=13960=t4mk67377'}		In the heart of the Rockies	
Norris W E William Edward	B6115	{9421447}		{'nyp.33433074954573'}		Natures comedian	
Ewers John Keith	B2635	{3213686}		{'uc1.$b242583'}		Harvest and other stories	
Colton Arthur Willis	B1771	{6821496}		{'uc2.ark+=13960=t6g15vm6b'}		The belted seas	
Raymond Walter	B7131	{8920689, 3151356}		{'uc2.ark+=13960=t8hd7qs9s'}		A tangled web	
Gingold Hlne	B3185	{8816345}		{'uc1.$b248388'}		Seven stories	
Stern G B Gladys Bronwyn	B7562	{2454237, 2487133, 3228958}		{'uc1.$b244960'}		Petruchio	
Craik Georgiana M Georgiana Marion	B1629	{9448432}	{'Juvenile audience'}	{'nyp.33433082531470'}		Playroom stories or How to mak	
Kúnos Ignácz	B4651	{3182215}		{'nyp.33433068198104'}		Turkish fairy tales and folk t	
Stockton Frank Richard	B7597	{6765763, 3172884, 6176461}		{'uc1.b3325127'}		A storytellers pack	
Crawford F Marion Francis Marion	B1701	{8840521, 3162770, 6803337}		{'uc2.ark+=13960=t13n20q16'}		A rose of yesterday	
Lawrence D H David Herbert	B5059	{2490712}		{'mdp.39015000631930'}		The woman who rode away	
Manning Anne	B5370	{9035697}		{'njp.32101073308494'}	{'1608-1674', 'd. 1652', '-1652', 'Milton, John', 'Milton, Mary Powell'}	The maiden and married life of Mary Powell  afterwards Mistress Milton	
Morris William	B5648	{4074923, 3154595, 6785995}		{'uc1.b4102369'}		The Sundering Flood	
FraserTytler M E	B2890	{8591381}		{'uiuo.ark+=13960=t8mc9kq64', 'uiuo.ark+=13960=t71v65n7w'}		Grisel Romney	
Twain Mark	B8318	{8967624}		{'uva.x030552428', 'coo.31924021964063'}		The man that corrupted Hadleyb	
Capes Bernard Edward Joseph	B1521	{6779419}	{'Short stories'}	{'nyp.33433074935127'}	{'Fantasy fiction, English'}	At a winters fire	
MCarthy Daniel	B5374	{8965023}		{'nnc1.1002325179', 'nnc1.1002325128'}		The siege of Florence an historical romance	
Grimshaw Beatrice	B3118	{3191132}		{'nyp.33433074859780'}		Guinea gold	
Jerrold Douglas William	B4252	{8605113}		{'uc2.ark+=13960=t6xw4f935', 'nyp.33433067294581', 'nyp.33433067294599', 'nyp.33433067294607', 'mdp.39015066186910'}		The works of Douglas Jerrold	
Jesse F Tennyson Fryniwyd Tennyson	B4209	{3224186}		{'inu.39000002601198'}		The Solange stories	
Merrel Concordia	B5523	{3210321}		{'nyp.33433074971411'}		Julia takes her chance	
Fogazzaro Antonio	B2673	{6710470, 8898214}		{'mdp.39015008459128'}		The woman Malombra	
Parker Dorothy	B6461	{2483712}		{'mdp.39015048550019'}		Laments for the living	
Firdawsī	B2664	{9091124}		{'inu.39000004449364'}		A Persian hero  stories from the Shah Nameh	
Barker	B934	{6817053}		{'uc2.ark+=13960=t5m90h655'}	{'KwaZulu-Natal (South Africa)', 'Rodrigues (Mauritius)', 'Mauritius', 'New Zealand', 'Colonies', 'Trinidad', 'Australia', 'Social life and customs', 'Great Britain'}	Colonial memories	
pseud Grand Sarah	B9134	{8818706}		{'njp.32101066459999', 'njp.32101066459981'}		The heavenly twins	
Allen Grant	B150	{8853288, 3169282, 6780372}		{'uc2.ark+=13960=t27943c28'}		The incidental bishop	
Wright Mabel Osgood	B8920	{6827450}		{'njp.32101067487288'}		Princess Flower Hat  a comedy 	
Wood Ellen	B8847	{8727041}	{'Bibliographies'}	{'uiuo.ark+=13960=t6ww82d2p', 'uiuo.ark+=13960=t23b6qf7w', 'uiuo.ark+=13960=t7mp5q48f'}		East Lynne	
Packard Frank L Frank Lucius	B6829	{8975566}		{'uc2.ark+=13960=t46q1v08k'}		The miracle man	
Lowry H D	B4969	{6762145}		{'uc2.ark+=13960=t5s758x3g'}	{'England', 'Country life'}	The happy exile	
Crane Thomas Frederick	B1348	{6714520}	{'Bibliographies'}	{'inu.39000005949453'}	{'Fairy tales', 'Legends', 'Italy'}	Italian popular tales	
Stevenson Burton Egbert	B7913	{8911618}		{'nyp.33433076022346'}		The Marathon mystery  a story 	
Cobban J Maclaren James Maclaren	B1724	{6805789}		{'uc2.ark+=13960=t2s46jv8t'}		A soldier and a gentleman	
Hobbes John Oliver	B3857	{8956515, 3171566}		{'uc2.ark+=13960=t14m98026'}		The school for saints	
Davis Richard Harding	B2350	{8876923, 6826988}		{'uc2.ark+=13960=t5db7w69s'}		Captain Macklin	
Holme Constance	B3780	{2454721, 2497006}		{'uc1.$b300898'}		Hewhocame	
Chambers Robert W Robert William	B1457	{3198855}		{'njp.32101068165537'}		Ailsa Paige  a novel	
Castle Agnes	B1950	{8854972, 3421287}		{'uc2.ark+=13960=t4bp01948'}		The pride of Jennico	
Bray Anna Eliza Mrs	B1162	{4692036}		{'njp.32101067629939', 'njp.32101067629947'}		De Foix or Sketches of the man	
Spadoni Adriana	B7617	{2433413}		{'uc1.b3727987'}		The swing of the pendulum	
Hume Fergus	B4080	{8957429}		{'nyp.33433074861927'}		The harlequin opal a romance	
Leys John Kirkwood	B4850	{8993063}		{'nyp.33433074900964'}		The black terror a romance of Russia	
Hume Fergus	B3683	{9006588, 3188231}		{'nyp.33433074861919'}		Lady Jim of Curzen street a novel	
Crosland T W H Thomas William Hodgson	B1414	{6795719}		{'mdp.39015064808614'}	{'Women', 'Femininity'}	Lovely woman	
Dunning James Edmund	B2204	{3205867}		{'nyp.33433074861869'}		The master builders	
Kenyon C Fred Charles Frederick	B4684	{9459819}		{'nyp.33433074876578'}		The poisoner	
