author	bookid	bpoids	genres	htrcids	subjects	title	is_fic	pubdate
Trollope Anthony	B8166	{8495640, 8669861}	{'Bibliographies'}	{'uc1.b4102140'}	{'Barchester (England : Imaginary place)', 'Trollope, Anthony', 'Barsetshire (England : Imaginary place)', 'England', '19th century', '1815-1882', 'Clergy', 'Social life and customs'}	The last chronicle of Barset		1874
Johnson Clifton	B4323	{8956271}		{'uc1.$b750916'}	{'Social life and customs', 'Description and travel', 'England', 'Country life'}	Among English hedgerows		1899
Trollope Anthony	B8140	{4363494}	{'NotBiographical'}	{'pst.000012922703'}	{'Social life and customs', '19th century'}	Rachel Ray		1862
Leacock Stephen	B4715	{6859072}		{'mdp.39015000638018'}	{'Social life and customs', 'City and town life', 'Canada'}	Sunshine sketches of a little 		1912
Wells H G Herbert George	B8734	{3235476}		{'uc1.b5023357'}	{'Utopias', 'Social problems', 'Sociology'}	What are we to do with our lives		1931
Jarves James Jackson	B4240	{8625325}		{'mdp.39015047750396'}	{'Social life and customs'}	Kiana a tradition of Hawaii		1857
Petrovitch Woislav M	B6449	{8961549}		{'mdp.39015008931498'}	{'Social life and customs', 'Yugoslavia', 'Legends', 'Folklore', 'Serbia'}	Hero tales and legends of the Serbians		1915
Hawthorne Nathaniel	B3984	{2902638}	{'Bibliographies'}	{'uva.x000091305'}	{'Social life and customs', 'Historical fiction, American'}	Twicetold tales		1837
Mansfield Katherine	B5673	{6867395, 3187567}		{'uc2.ark+=13960=t0wp9wh4k'}	{'Social life and customs', 'Murry, John Middleton', '1889-1957'}	In a German pension		1911
Webster Wentworth	B8690	{6671522}		{'uc1.$b49961'}	{'Basques', 'France', 'Pays Basque (France)', 'Basque language', 'Tales', 'Pays Basque', 'Legends', 'Social life and customs', 'Folklore'}	Basque legends		1877
Tollemache Beatrix Lucia Catherine Egerton	B8038	{9351725}		{'mdp.39015058341382'}	{'Peasants', 'Social life and customs', 'Soviet Union'}	Russian sketches chiefly of peasant life		1913
Tayler Charles Benjamin	B8052	{6139658, 4712414}		{'mdp.39015065564208', 'mdp.39015065564604', 'mdp.39015065564216', 'mdp.39015065564265'}	{'Working class', 'Social conditions', 'Great Britain'}	Social evils and their remedy		1835
Swettenham Frank Athelstane Sir	B7585	{6637042}		{'uc1.$b83375'}	{'Social life and customs', 'Malay Peninsula', 'Malays (Asian people)'}	Malay sketches		1895
Dickens Charles	B2381	{9438853, 4990166}	{'Legal stories', 'Bildungsromans', 'Domestic fiction', 'Bibliographies', 'ContainsBiogMaterial', 'Didactic fiction'}	{'uiuo.ark+=13960=t19k51v83', 'uiuo.ark+=13960=t9t15qw1s', 'uiuo.ark+=13960=t3tt5bm1x', 'uiuo.ark+=13960=t2c830k3q'}	{'Social problems', 'London (England)', 'Dickens, Charles', 'Young women', '1812-1870', 'Guardian and ward', 'Inheritance and succession', 'Illegitimate children'}	Bleak house		1852
Wharton Edith	B8764	{3184233, 6748866, 2446036, 2439391}	{'Bibliographies'}	{'uc2.ark+=13960=t1sf2mx9b'}	{'Married people', 'Social life and customs', 'Rural poor', 'New England', 'Farm life'}	Ethan Frome		1911
Fox John	B2775	{9424844}		{'nyp.33433075741227'}	{'Authors, American', 'Social life and customs', 'Kentucky', 'Mountain life'}	Christmas eve on Lonesome		1904
Eliot George	B2611	{2463920, 8778938}	{'NotBiographical', 'Bibliographies', 'Novel'}	{'uiuo.ark+=13960=t8hd8j356', 'uiuo.ark+=13960=t1fj3570z', 'uiuo.ark+=13960=t50g4c509', 'uiuo.ark+=13960=t0ks7cx66'}	{'Social life and customs', '19th century'}	Middlemarch a study of provincial life		1871
Fraser Hugh Mrs	B2674	{8949326}	{'Biography', 'Autobiography', 'History'}	{'mdp.39015010807835', 'mdp.39015010807827'}	"{'-1922', 'Description and travel', 'Fraser, Hugh', 'Biography', 'Mrs', ""Diplomats' spouses"", 'Social life and customs', 'History'}"	A diplomatists wife in many lands		1910
Topham Anne	B8204	{6855533, 2434615}		{'uc2.ark+=13960=t6ww7b84s'}	{'Social life and customs', 'Germany'}	Daphne in the Fatherland		1913
Fraser Hugh Mrs	B2737	{3264992}		{'nyp.33433074854088'}	{'Social life and customs', '1868-1912'}	The custom of the country tales of new Japan		1899
Morrison Arthur	B5653	{8831810, 6655091, 3180846}	{'Bibliographies'}	{'uc1.b4105458'}	{'Slums', 'London', 'England', '19th century', 'Boys', 'Social life and customs'}	A child of the Jago		1896
Collins Wilkie	B1466	{8469993}	{'Romantic suspense novels', 'Mystery and detective fiction', 'Bibliographies', 'Great Britain'}	{'uiuo.ark+=13960=t0zp4bq6b', 'njp.32101068581576', 'uiuo.ark+=13960=t5bc48x1g'}	{'Country homes', 'Psychiatric hospital patients', 'Art teachers', 'Nobility', '19th century', '823C69W1860', 'Deception', 'English fiction', 'Social life and customs', 'Inheritance and succession'}	The woman in white		1860
Dickens Charles	B2103	{5214688, 6120577, 4696359, 6108776, 8928862, 2441898, 8601515, 8608717, 5810062, 6183951, 5844400, 8606037, 8733365, 5809980, 5814078, 6144191}	{'Dictionary', 'Bibliographies', 'ContainsBiogMaterial', 'Indexes'}	{'uc2.ark+=13960=t5j962x5v', 'mdp.39015005324606', 'uva.x030570270'}	{'Societies and clubs', 'Facsimiles', 'Dickens, Charles', 'England', '19th century', '1812-1870', 'English fiction', 'Social life and customs', 'Men', 'Manuscripts'}	The posthumous papers of The Pickwick Club		1837
Maharani of Cooch Behar Sunity Devee	B5247	{3206650}	{'Autobiography'}	{'mdp.39015005121184'}	{'Social life and customs'}	The autobiography of an Indian princess		1921
Butler Samuel	B808	{8892761, 6796313, 8957194, 6810283, 3179671}	{'Autobiographical fiction', 'Domestic fiction'}	{'uc1.b3579144'}	{'Social life and customs', '19th century'}	The way of all flesh		1902
Graham Stephen	B3274	{2441038, 3175093, 6845750}		{'uc2.ark+=13960=t6f18vr21'}	{'Social life and customs', 'Description and travel', 'Soviet Union', 'Jerusalem'}	A tramps sketches		1912
Lincoln Joseph Crosby	B4750	{6841933}		{'mdp.39015063923927'}	{'Social life and customs', 'Cape Cod (Mass.)', 'Brewster (Mass.)'}	Our village		1909
Brontë Anne	B630	{4618505, 4991985, 4337431}	{'Bibliographies', 'ContainsBiogMaterial', 'Domestic fiction'}	{'nyp.33433074930037', 'uc2.ark+=13960=t24b2zg71'}	{'Married women', 'England', '19th century', 'Social life and customs', 'Alcoholics', 'English fiction', 'Landlord and tenant', 'Alcoholism'}	The tenant of Wildfell Hall		1848
Doyle Arthur Conan Sir	B2284	{6781457}		{'uc1.32106001934915'}	{'War stories, English', 'Social life and customs', 'Sports stories, English', '19th century'}	The green flag and other stories of war and sport		1900
Macleod Fiona	B5780	{3169788, 6799254}		{'uc2.ark+=13960=t73t9mx97'}	{'Social life and customs', 'Mythology, Celtic', 'Scotland'}	The washer of the ford and other legendary moralities		1896
Chesnutt Charles W Charles Waddell	B1424	{8902136}		{'nc01.ark+=13960=t50g4wj3w'}	{'North Carolina', 'Economic conditions', 'Race relations', 'Veterans', 'United States', 'Racism', 'Southern States', 'City and town life', 'Civil War, 1861-1865', 'Failure (Psychology)', 'Rich people', 'African Americans', 'Social conditions', 'History'}	The colonels dream		1905
Trollope Anthony	B8139	{8517588, 8693422}	{'Political fiction', 'Bibliographies'}	{'pst.000000090193'}	{'Trollope, Anthony', '19th century', '1815-1882', 'Politics and government', 'Palliser, Plantagenet (Fictitious character)', 'Social life and customs'}	The Eustace diamonds		1876
Dickens Charles	B2108	{8526331}	{'Bibliographies', 'Bildungsromane'}	{'uc1.32106011757181', 'mdp.39015014667003'}	{'Revenge', 'Orphans', 'Social conditions', 'Young men', 'Revolution, 1789-1799', 'Man-woman relationships', '19th century', 'England', 'Ex-convicts', 'Social life and customs', 'Benefactors', 'History'}	Great expectations		1850
Taliaferro Hardin E	B8144	{8640116}		{'uc1.$b281967'}	"{'Social life and customs', 'Surry County (N.C.)', ""Fisher's River, N.C""}"	Fishers River North Carolina scenes and characters		1859
Roby John	B7085	{8304846}		{'uc2.ark+=13960=t4mk6jn2q'}	{'Lancashire', 'England', 'English literature', 'Legends', 'Social life and customs', 'Folklore'}	Traditions of Lancashire		1829
Watanna Onoto Mrs	B8506	{8897995}		{'mdp.39015030198629'}	{'Social life and customs', '1868-1912'}	A Japanese nightingale		1901
Scott Walter Sir	B7456	{4697979}		{'nyp.33433075742951', 'nyp.33433075742944'}	{'Social life and customs', 'Scotland'}	Chronicles of the Canongate		1827
Dunsany Edward John Moreton Drax Plunkett Baron	B2344	{6737955}		{'uc2.ark+=13960=t52f7kh34'}	{'Fantasy fiction, English', 'Manners and customs', 'Irish authors'}	A dreamers tales		1910
Conrad Joseph	B1802	{3169957}		{'uc2.ark+=13960=t8sb49j1g'}	{'Dutch', 'Indonesia', 'Social life and customs'}	Almayers folly		1895
Eliot George	B2597	{8592699, 6672445}	{'NotBiographical', 'Bibliographies', 'Novel', 'Autobiography', 'Jewish fiction', 'Didactic fiction'}	{'uc1.b4105109', 'uc1.b4105110'}	{'Jews', '1819-1880', 'England', '19th century', 'Marriage', 'Upper class', 'English literature', 'Social life and customs', 'Zionists', 'Eliot, George'}	Daniel Deronda		1876
Black William	B792	{8802249}		{'uc1.b3321705'}	{'Nature', 'Social life and customs', 'Country life'}	Briseis		1896
Antin Mary	B19	{8848414}	{'Autobiography'}	{'mdp.39015008221700'}	{'Russians', 'Boston', '1881-1949', 'Massachusetts', 'IsBiographical', 'Russia', 'Social life and customs', 'Antin, Mary'}	The promised land		1912
Barker	B934	{6817053}		{'uc2.ark+=13960=t5m90h655'}	{'KwaZulu-Natal (South Africa)', 'Rodrigues (Mauritius)', 'Mauritius', 'New Zealand', 'Colonies', 'Trinidad', 'Australia', 'Social life and customs', 'Great Britain'}	Colonial memories		1904
Dickens Charles	B2097	{3203888}	{'Autobiographical fiction', 'Bildungsromane', 'ContainsBiogMaterial'}	{'njp.32101058459064', 'inu.32000002986299'}	{'Orphans', 'London', 'Young men', 'Dickens, Charles', 'England', 'Boys', 'Child labor', '19th century', '1812-1870', 'Stepfathers', 'Social life and customs'}	David Copperfield		1855
Moore Frank Frankfort	B5798	{3199786}		{'uc2.ark+=13960=t8kd1t47w'}	{'Social life and customs', 'Great Britain'}	The lighter side of English life		1913
Martineau Harriet	B5453	{4965218, 8427455}		{'nyp.33433074895297'}	{'Social life and customs', 'Norway'}	Feats on the Fiord  a tale		1841
Livermore Elizabeth D	B4865	{9110234}		{'nyp.33433076074552', 'nyp.33433076074545'}	{'Social life and customs', 'Racially mixed people', 'Virgin Islands of the United States', 'Denmark', 'Women, Black'}	Zoë or The quadroons triumph  a tale for the times		1855
Garland Hamlin	B3212	{6760722, 6785886}		{'uc1.b3561877'}	{'Western stories', '(OCoLC)fst01243255', 'Love stories, American', 'Manners and customs', '(OCoLC)fst01002993', '(OCoLC)fst01174081', '(OCoLC)fst01007815', 'Social life and customs'}	Wayside courtships		1897
Baronne d Oberkirch Henriette Louise von Waldner	B533	{9006631, 4993606, 9452735}		{'njp.32101073593145'}	{'Social life and customs', 'History', 'Louis XVI, 1774-1793'}	Memoirs of the Baroness dOberkirch countess de Montbrison		1803
Haliburton Thomas Chandler	B3612	{9410634, 8447083}		{'njp.32101067633691'}	{'Social life and customs'}	The old judge or Life in a colony		1849
Ognev N Nikolaĭ	B6247	{3217195}		{'mdp.39015036041658', 'uc1.$b323143'}	{'Social life and customs', 'Communism', 'Soviet Union'}	The diary of a communist schoo		1928
Gale James Scarth	B3296	{6803324, 3174558}		{'uc2.ark+=13960=t95719x5v'}	{'Social life and customs', 'Korea'}	Korean sketches		1898
Begbie Harold	B774	{3209610}		{'uc1.$b812567'}	{'1801-1885', 'Shaftesbury, Anthony Ashley Cooper', 'Earl of', '20th century', 'Social conditions'}	The little that is good  stories of London and glimpses of English civilization		1917
Tressell Robert	B8165	{8950035, 6851211}		{'uc1.b4089322'}	{'Capitalism', 'Socialists', 'Social conflict', 'Working class', 'Labor movement', 'Working class families', 'Social classes'}	The ragged trousered philanthr		1911
Smith Frank Berkeley	B7322	{3172438}		{'loc.ark+=13960=t5z61cm8s'}	{'Social life and customs', 'London (England)'}	In London town		1906
Munro Neil	B5357	{8917238, 6856063}	{'Novel'}	{'njp.32101065845842'}	{'20th century', 'Social life and customs', 'Americans', 'Scotland'}	The daft days		1923
Miln Louise Jordan Mrs	B5352	{3164893}		{'njp.32101064994773'}	{'Social life and customs', 'Description and travel', 'Orient'}	When we were strolling players in the East		1894
Hains T Jenkins Thornton Jenkins	B3748	{8903336}	{'Sea stories'}	{'nyp.33433076083678'}	{'Sailors', 'Social classes', 'Man-woman relationships', 'Conduct of life'}	The voyage of the Arrow  to the China Seas  its adventures and perils including its capture by Sea Vultures from the Countess of Warwick as set down by William Gore Chief Mate		1906
Scott Walter Sir	B7457	{8622774}	{'Bibliographies'}	{'nyp.33433075743058', 'nyp.33433075743074', 'nyp.33433075743066'}	{'Social life and customs'}	Guy Mannering or The astrologe		1815
Waugh Evelyn	B8699	{3241940}		{'uc1.32106018261005'}	{'Nineteen twenties', 'Social life and customs', 'Treasure hunt (Game)', '20th century'}	Vile bodies		1930
White William Allen	B8706	{6831163}	{'Bibliographies'}	{'uc1.b3295323'}	{'Social problems'}	A certain rich man		1909
Mitra Siddha Mohana	B5755	{6705392}		{'uc2.ark+=13960=t5cc14c3s'}	{'Social life and customs', 'India'}	Hindupore		1909
Shanks Edward	B7303	{3212884, 2451430}		{'dul1.ark+=13960=t5db8qq9t'}	{'Social life and customs', 'Time travel', 'Great Britain'}	The people of the ruins		1920
Lagerlöf Selma	B4943	{6677432, 3163989, 8878974, 6786520}		{'uc2.ark+=13960=t25b09s9q'}	{'Bröchner, Jessie', 'Social life and customs', 'tr'}	From a Swedish homestead		1901
bart Douglas George Brisbane Sir	B9095	{3165801}		{'inu.30000108972989'}	{'Social life and customs', 'Tales', 'Fairy tales', 'Scotland', 'Folklore'}	Scottish fairy and folk tales		1901
Marks Jeannette Augustus	B5546	{6839738}		{'uc2.ark+=13960=t2r49h97k', 'nyp.33433076051493'}	{'Social life and customs'}	Through Welsh doorways		1909
Hardy Thomas	B3513	{8534275}	{'Bibliographies', 'ContainsBiogMaterial'}	{'mdp.39015008981394'}	{'People with visual disabilities', 'Mate selection', 'Heathlands', 'Married people', 'Mothers and sons', '19th century', 'Adultery', 'Social life and customs'}	The return of the native		1895
Cervantes Saavedra Miguel de	B1326	{6795168}	{'Romances', 'Picaresque literature', 'Bibliographies', 'Adventure stories'}	{'coo.31924111705111', 'uc1.l0084018282'}	{'Social life and customs', 'Knights and knighthood', 'Spain', '16th century'}	Don Quixote		1616
Little Archibald	B4966	{8953497}		{'uc2.ark+=13960=t5p84jq34'}	{'Social life and customs', 'China'}	My diary in a Chinese farm		1894
Fuller Hiram	B2792	{9146600}		{'nyp.33433076090434'}	{'Social life and customs', 'Description and travel'}	Belle Brittan on a tour  at Newport and here and there		1858
Williamson C N Charles Norris	B8632	{6844988}	{'Love stories'}	{'nyp.33433075768568'}	{'United States', 'Man-woman relationships', '19th century', 'Young women', 'Social life and customs', 'British'}	Lady Betty across the water		1906
Washburn Claude Carlos	B8704	{3168392}		{'uc1.b3251391'}	{'Social life and customs', 'Description and travel'}	Pages from the book of Paris		1910
Gogolʹ Nikolaĭ Vasilʹevich	B2988	{9111672, 8957382}	{'Bibliographies'}	{'mdp.39015004104850', 'uiuo.ark+=13960=t9s187053', 'mdp.39015004119569', 'uc1.b4010822', 'mdp.39015002257536'}	{'Social life and customs', '1533-1917'}	Dead souls		1852
Cooke John Esten	B1453	{8716788}		{'njp.32101066457936'}	{'Social life and customs', 'Manners and customs', 'Martinsburg', '(OCoLC)fst01224867', '(OCoLC)fst01007815'}	Leather stocking and silk or Hunter John Myers and his times		1854
Hardy Thomas	B3822	{8802696, 3158617, 6724074}	{'Bibliographies'}	{'uc1.b3578724', 'uc1.b3578725', 'uc1.b3578726'}	{'Poor families', 'Children of the rich', 'Triangles (Interpersonal relations)', 'Man-woman relationships', 'Women household employees', '19th century', 'Children of clergy', 'English literature', 'Social life and customs', 'Women murderers'}	Tess of the DUrbervilles a pure woman faithfully presented		1892
Zola Émile	B9075	{6830513}		{'uc1.b4658445', 'uc2.ark+=13960=t4fn13891'}	{'Zola, Émile', 'Social life and customs', '1840-1902', 'Translations into English'}	The honour of the army and other stories		1901
Escott T H S	B2603	{6777583}		{'uc2.ark+=13960=t6sx6503p'}	{'Social life and customs', 'Great Britain', '19th century'}	A trip to Paradoxia and other humours of the hour		1899
Barlow Jane	B656	{3168355, 8888679}		{'nyp.33433074936331'}	{'In literature', 'fiction', 'Social life and customs', 'Irish literature', 'Authors, Irish'}	The founding of fortunes		1902
Craigie William A William Alexander Sir	B1391	{6648773}	{'Bibliographies'}	{'mdp.39015062219939'}	{'Scandinavia', 'Social life and customs', 'Folklore'}	Scandinavian folklore illustrations of the traditional beliefs of the northern peoples		1896
Armstrong Martin	B205	{8871832}		{'wu.89087902060'}	{'Manners and customs'}	The puppet show		1923
Haigh Richmond	B3916	{3211254}		{'uc2.ark+=13960=t5bc3vd2w'}	{'Social life and customs', 'Ethiopia', 'Folklore'}	An Ethiopian saga		1919
SackvilleWest V Victoria	B7329	{3195843}	{'Love stories'}	{'mdp.39015002753138'}	{'Social life and customs', '20th century'}	The heir a love story		1922
Tarkington Booth	B8054	{8881849, 3272458}	{'Great Britain', 'Proofs (Printing)'}	{'mdp.39015065779426'}	{'Bath (England)', '1879-1931', 'England', '18th century', 'Lindsay, Vachel', 'Personal copy', 'Social life and customs', 'Gambling', 'Library'}	Monsieur Beaucaire		1900
Cable George Washington	B1693	{3266111}		{'uc2.ark+=13960=fk2w37kx1m', 'uc2.ark+=13960=t6sx65984'}	{'Vendetta', 'Culture conflict', '1775-1865', 'Creoles', 'Southern States', 'Social life and customs'}	The Grandissimes		1880
Wells H G Herbert George	B8870	{2442175}	{'Novel'}	{'wu.89002181352'}	{'Fiction in English, 1900-1945 - Texts', 'Discontent', 'Social life and customs', 'Life change events', '19th century'}	The history of Mr Polly		1909
jr Fox John	B9110	{6824095}		{'nyp.33433081819181'}	{'Social life and customs'}	Bluegrass and rhododendron outdoors in old Kentucky		1901
Harvey William	B3637	{6838817}		{'nnc1.cr60059940'}	{'Social life and customs', 'National characteristics, Scottish', 'Scottish wit and humor'}	Scottish life and character in anecdote and story		1899
Jewett Sarah Orne	B4210	{6789202, 8948068}	{'Bibliographies'}	{'loc.ark+=13960=t2j681c0r'}	{'Summer resorts', 'Women', 'Women authors', 'Maine', 'Seaside resorts', 'Authorship', '19th century', 'Country life', 'Social life and customs'}	The country of the pointed firs		1896
Maclaren Ian	B5527	{3158625}	"{""Publishers' cloth bindings (Binding)"", 'New York', 'New York (State)'}"	{'nyp.33433075747463'}	{'Social life and customs'}	The days of auld lang syne		1896
Chambers Robert W Robert William	B1435	{6774482, 6808980}		{'njp.32101063605479'}	{'Manners and customs'}	The haunts of men		1898
Rolfe Frederick	B7101	{3170700, 6806150}	{'Bibliographies'}	{'uc2.ark+=13960=t6057jc5s'}	{'Manners and customs'}	In his own image		1901
Trollope Anthony	B8066	{5010746, 8444373, 8629910}	{'Bibliographies'}	{'njp.32101013826951', 'njp.32101017731553'}	{'Barchester (England : Imaginary place)', 'Trollope, Anthony', 'Barsetshire (England : Imaginary place)', 'England', '19th century', '1815-1882', 'Clergy', 'Social life and customs'}	Barchester towers		1859
Dickens Charles	B2250	{4372131, 9428028, 8485575}	{'Bibliographies', 'Satire', 'ContainsBiogMaterial', 'Love stories'}	{'uiug.30112049064725', 'nyp.33433075769178', 'uiuo.ark+=13960=t0jt0c18w', 'uiuo.ark+=13960=t8hd8j45n', 'nyp.33433074969258', 'uiuo.ark+=13960=t6nz8vw9c', 'uc1.b4102860'}	{'London (England)', 'Poor families', 'Dickens, Charles', '1812-1870', 'Deception', 'English fiction', 'Inheritance and succession', 'Social classes'}	Our mutual friend		1864
Forster E M Edward Morgan	B2672	{9071402}	{'Edwardian novels', 'Historical fiction'}	{'mdp.39015005111680', 'pst.000029721290'}	{'Social conflict', '20th century', 'Man-woman relationships', 'England', 'Sisters', 'Social life and customs', 'Inheritance and succession'}	Howards End		1911
Browning H Ellen	B406	{9400236}		{'mdp.39015059200470'}	{'Social life and customs', 'Description and travel'}	A girls wanderings in Hungary		1896
Gissing George	B3336	{8867538, 3177310, 6780551}		{'uva.x000239878'}	{'Social life and customs', '19th century'}	The crown of life		1899
Wharton Edith	B8697	{3186960, 9286594, 6809123}	{'Bibliographies'}	{'uc1.32106002154331'}	{'Social life and customs', 'New York', 'Single women', 'New York (State)'}	The house of mirth		1905
London Jack	B4923	{6810552, 3278203, 9012838}		{'uc2.ark+=13960=fk01z41s21'}	{'Adventure stories, American', 'Social life and customs', 'Yukon', 'Gold discoveries', 'Klondike River Valley (Yukon)'}	The son of the wolf		1900
Aytoun William Edmondstoune	B153	{4356707}		{'uc2.ark+=13960=t5n877988', 'uc2.ark+=13960=t3125zp8x'}	{'Social life and customs', 'Scotland', 'Criminals', 'Jews', '19th century'}	Norman Sinclair		1861
Trollope Anthony	B8169	{8519142}		{'uc1.b4104233'}	{'19th century', 'Australia', 'Social life and customs', 'Frontier and pioneer life', 'History', 'British'}	Harry Heathcote of Gangoil A tale of Australian bush life		1874
Dickens Charles	B2124	{3295184, 3206547, 3189524, 4444870, 3202927}	{'Ghost stories', 'Bibliographies'}	{'uc2.ark+=13960=t7zk57x7j', 'mdp.39015091651375', 'mdp.39015035841835'}	{'Misers', 'Scrooge, Ebenezer (Fictitious character)', '19th century', 'Juvenile fiction', 'Christmas stories', 'Social life and customs', 'Christmas stories, English'}	A Christmas carol		1870
Crockett S R Samuel Rutherford	B1807	{3181207}		{'uc2.ark+=13960=t91837316'}	{'Social life and customs', 'Description and travel', 'Spain'}	The adventurer in Spain		1903
OConnor T P Mrs	B6235	{2436803}		{'loc.ark+=13960=t43r1513r'}	{'Social life and customs', 'Southern States'}	My beloved South		1913
Dickens Charles	B2221	{4444870}	{'Ghost stories', 'Juvenile audience', 'Christmas stories'}	{'nyp.33433074954482'}	{'London (England)', 'Poor families', 'Misers', 'Ghost stories', 'Scrooge, Ebenezer (Fictitious character)', '19th century', 'Juvenile fiction', 'Sick children', 'Christmas stories', 'Social life and customs'}	A Christmas carol in prose The chimes The cricket on the hearth		1846
Trollope Anthony	B8030	{8497293, 9437462}		{'mdp.39015005889996'}	{'Christianity', 'Czech Republic', 'Relations', 'Interfaith marriage', '19th century', 'Judaism', 'Social life and customs', 'Prague', 'History'}	Nina Balatka the story of a maiden of Prague		1867
Bulgarin Faddeĭ	B534	{4693973}		{'njp.32101075686376', 'nyp.33433073357042'}	{'Social life and customs'}	Ivan Vejeeghen or Life in Russ		1831
Hodgetts Edith M S	B3500	{8776630, 6760511}		{'inu.39000005757880'}	{'Russia', 'Social life and customs', 'Tales', 'Legends', 'Folklore'}	Tales and legends from the land of the tzar a collection of Russian stories tr from the original Russian		1890
Crane Stephen	B1468	{6797377, 6782627}		{'njp.32101068597242'}	{'Social life and customs', '19th century'}	The open boat and other storie		1898
Wharton Edith	B8673	{6665128, 6789073, 6824858, 8960352, 3192520}	{'Bibliographies', 'Satire', 'Domestic fiction'}	{'nyp.33433076079122'}	{'Americans', 'Divorced women', 'France', 'Upper class', 'Social life and customs', 'New York', 'Remarried people', 'New York (State)'}	The custom of the country		1913
Gordon Jan	B3280	{3193601}		{'uc2.ark+=13960=t6xw4dv6c'}	{'Social life and customs', 'Balkan Peninsula', 'Outlaws'}	A Balkan freebooter		1916
Johnston Harry Hamilton Sir	B4235	{6752459}		{'mdp.39015035397515'}	{'Social life and customs'}	The history of a slave		1889
Hawthorne Nathaniel	B3630	{4969594}	{'Bibliographies'}	{'njp.32101068599248', 'uc2.ark+=13960=t93776r0m', 'njp.32101068599230'}	{'Social life and customs', '19th century'}	Mosses from an old manse		1857
Makino Yoshio	B5238	{2441743}		{'loc.ark+=13960=t6qz33j81'}	{'Social life and customs', 'Japan'}	When I was a child		1912
Thackeray William Makepeace	B8219	{9012145}	{'Bibliographies', 'Satire'}	{'ucm.5324200923', 'ucm.5324200950'}	{'Women', 'Waterloo, Battle of, Waterloo, Belgium, 1815', 'Married women', 'England', '19th century', 'Europe', 'Female friendship', 'Social life and customs', 'Social classes', 'British'}	Vanity Fair  a novel without a		1848
Herrick Robert	B3996	{6798166, 9028236, 8981238}		{'wu.89073539553'}	{'Social problems'}	The common lot		1904
Hardy Thomas	B3600	{6713689, 8584519}	{'Pastoral fiction', 'Bibliographies', 'Love stories'}	{'uiuo.ark+=13960=t73v08j17', 'uc1.32106006332305', 'uiuo.ark+=13960=t44q8kt63', 'mdp.39076005003285'}	{'X823H22F', 'Pastoral fiction', 'Women farmers', 'Triangles (Interpersonal relations)', 'England', '19th century', 'Love stories', 'Social life and customs'}	Far from the madding crowd		1874
Wilson Francesca M	B8871	{2432177}		{'wu.89085124782'}	{'Social life and customs'}	Portraits and sketches of Serbia		1920
Banim John	B652	{8618437, 5118007}	{'Bibliographies'}	{'nyp.33433074932389', 'uc2.ark+=13960=t8sb40478', 'uc1.b3322285'}	{'Ireland', 'Social life and customs', 'British', 'History', '19th century'}	The AngloIrish of the nineteenth century		1828
Gaskell Elizabeth Cleghorn	B2967	{4373322}	{'Novel', 'Bibliographies', 'Bildungsromane', 'Domestic fiction', 'Love stories'}	{'dul1.ark+=13960=t5r792w66', 'dul1.ark+=13960=t6d22nv15', 'pst.000028738046'}	{'Women', 'Binder', 'Fiction in English, 1837-1900 Texts', 'England', 'Young women', 'Bayntun', 'Social life and customs', 'Fathers and daughters', 'Social conditions', 'Children of physicians', 'Stepfamilies'}	Wives and daughters		1865
Trollope Anthony	B8156	{9429962, 4364890}	{'Bibliographies'}	{'uc1.32106005430803'}	{'Trollope, Anthony', 'Barsetshire (England : Imaginary place)', 'England', '19th century', '1815-1882', 'Clergy', 'Social life and customs'}	The small house at Allington		1865
