author	bookid	bpoids	genres	htrcids	subjects	title	is_fic
Broughton Rhoda	B1222	{6239872, 3170836, 8840956}		{'uva.x001132252'}		Dear Faustina A novel	
Clegg Thomas Bailey	B1564	{3167838}		{'nyp.33433074945837'}	{'English fiction'}	The love child	
Hofland Barbara Mrs	B3616	{5164448}	{'Juvenile audience'}	{'njp.32101067645927'}		Integrity  tale	
Blake Cecilia	B702	{9434167}		{'nyp.33433074940663'}	{'English fiction'}	Cecile Raye an autobiography	
Stepney Catherine Pollock Manners Lady	B7433	{8690512}		{'njp.32101064791096', 'njp.32101064791104', 'njp.32101064791088'}		The new road to ruin  a novel	
Broughton Rhoda	B798	{8665017}		{'uc1.b3321961', 'uc1.b3321960'}	{'1840-1920', 'English fiction', 'Broughton, Rhoda'}	Cometh up as a flower  an autobiography	
Morgan Sydney Lady	B5383	{8620936, 4999546}		{'nyp.33433067388078', 'nyp.33433067388086'}	{'Women', 'History'}	Woman and her master A history of the female sex from the earliest period	
Becke Louis	B824	{6776945, 8850892}		{'uc1.b4102891'}	{'Bounty (Ship)'}	The mutineer a romance of Pitcairn Island	
Hyde Stacey W	B3526	{3198859}		{'mdp.39015024864137'}	{'Working class', 'Great Britain'}	Shopmates	
Queen of Great Britain Victoria	B6865	{6721267, 8736364}	{'ContainsBiogMaterial'}	{'uva.x000425323'}		More leaves from the journal o	
Ward James	B8608	{9019986}		{'nyp.33433075763965'}	{'February Revolution, 1848', 'History'}	Adolphe Renouard or peasant life and political clubs in France	
Robinson Emma	B7039	{4980864}		{'uc1.b4104307'}	{'Civil War, 1642-1649', 'History'}	Whitehall or The days of Charles the first  an historical romance	
Judson Katharine Berry	B4426	{3217727}	{'Folklore'}	{'wu.89060395670'}		Myths and legends of the great	
Rowley Hon Hugh	B6918	{2717305}		{'mdp.39015045693614'}	{'Women', 'Marriage'}	Gamosagammon or Hints on Hymen For the use of parties about to connubialize	
Ouida	B6412	{3170530}		{'mdp.39015047764405'}		The Massarenesa novel	
Judson Katharine Berry	B4427	{3217727}		{'uc2.ark+=13960=fk22b8vh0p'}		Myths and legends of the Missi	
Lancaster G B	B4811	{3186548}		{'nyp.33433074875406'}	{'English fiction'}	A spur to smite	
Doyle Arthur Conan Sir	B2091	{2433542}	{'Fantastic fiction'}	{'coo.31924051019580'}	{'Prehistoric peoples', 'Discovery and exploration', 'Dinosaurs', 'Challenger, Professor (Fictitious character)', 'South America'}	The lost world	
McCarthy Justin H  Justin Huntly	B5805	{8934110}		{'uc2.ark+=13960=t95719g13'}	{'In literature', 'Dante Alighieri', '1265-1321'}	The god of love	
Potter Beatrix	B6506	{3280777}	{'Juvenile audience'}	{'nyp.33433000855258'}	"{'Juvenile fiction', ""Children's stories, English"", 'Swine'}"	The tale of Pigling Bland	
Skene Felicia	B7304	{4858218, 4373155}		{'dul1.ark+=13960=t5x64812v'}	{'Oxford (England)', 'American fiction', 'Prisons', 'England', 'Provenance', 'Prostitutes', 'Benson, C. S'}	Hidden depths	
Warden Florence	B8787	{3177856, 9431278}		{'uc2.ark+=13960=t49p2xq98'}	{'English fiction'}	The dazzling Miss Davison	
Crellin H N Horatio Nelson	B1587	{3164134}		{'nyp.33433074949607'}	{'English fiction'}	Romances of the old seraglio	
Brontë Charlotte	B1206	{4991985, 4618505, 4337431}	{'Biography'}	{'wu.89001262906', 'wu.89001262898'}		The tenant of Wildfell hall by	
Oppenheim E Phillips Edward Phillips	B6258	{9007080}	{'NotBiographical'}	{'mdp.39015063947256', 'uva.x030581248'}	{'English fiction'}	The traitors	
Benham Charles	B541	{3163505, 6763540}		{'nnc1.1002312050'}		The fourth Napoleon a romance	
Alcott Louisa May	B39	{8533177}	{'Juvenile audience'}	{'nc01.ark+=13960=t9f48p84h'}	{'Juvenile fiction', 'Circus performers', 'Families', 'Dogs'}	Under the lilacs	
Maurice Frederick Denison	B5216	{5231189}		{'hvd.hn1qjy', 'hvd.hn1qjz'}		Eustace Conway or The brother and sister  a novel	
Williams Robert Folkestone	B8732	{4700454}		{'uc1.b4102869'}	{'In literature', 'Shakespeare in fiction, drama, poetry, etc', '1564-1616', 'Shakespeare, William'}	Shakespeare and his friends or The golden age of merry England	
Roe A S Azel Stevens	B6957	{4987209, 8631841}		{'njp.32101065710228'}	{'American fiction'}	The star and the cloud or A daughters love	
Burgess Thornton W Thornton Waldo	B1112	{6747740, 3180749}	{'Juvenile audience'}	{'nyp.33433064202785'}		The adventures of Grandfather 	
Churchill Winston Sir	B1494	{9052523, 6819670}		{'nyp.33433074812219', 'uc2.ark+=13960=t6xw49546'}	{'American fiction'}	Mr Crewes career	
Jacobs W W William Wymark	B4359	{8962248}		{'uc2.ark+=13960=t3tt4hn0k'}	{'Short stories'}	Night watches	
Williams Ben Ames	B8681	{3220066}		{'uc1.$b105981'}	{'War of 1812', 'History'}	Thread of scarlet	
Hood Stuart	B4102	{8666945}		{'mdp.39015016948328'}		The brutal heart  a novel	
Knight Thomas	B4578	{6100267}		{'nyp.33433081599056'}	{'History, Military', '19th century'}	The British Battalion at Oporto with adventures anecdotes and exploits in Holland at Waterloo and in the expedition to Portugal	
Aguilar Grace	B85	{5286760, 4977069}		{'nyp.33433074945951', 'nyp.33433074945969'}	{'1274-1329', 'King of Scots', 'Robert', 'History'}	The days of Bruce  a story from Scottish history	
Francis M E	B2915	{8887808}		{'uva.x030751449'}		Christian Thal a novel	
James Henry	B4312	{9411584, 6767609}	{'Bookplates (Provenance)', 'NN-BGC', 'Presentation inscriptions (Provenance)', 'Ink stamps (Provenance)'}	{'nyp.33433081852646'}		The awkward age	
Blackford Martha Mrs	B468	{5076712}		{'njp.32101063578221'}	{'Scottish authors', 'English fiction'}	Arthur Monteith a moral tale founded on a historical fact and calculated to improve the minds of young people Being a continuation of the Scottish orphans To which is added The young West Indian	
Harrison Mary St Leger Kingsley	B3672	{4085531, 6801327}		{'nyp.33433074857982'}	{'English fiction'}	The history of Sir Richard Calmady  a romance	
McLaughlin Marie L	B5379	{3242814}		{'nyp.33433022847994'}	{'Mdewakanton Indians', 'Dakota Indians', 'Legends'}	Myths and legends of the Sioux	
Yeats W B William Butler	B9062	{6813986}		{'njp.32101067487585'}		Stories of Red Hanrahan  The s	
Barr Robert	B445	{8867882, 6811036, 3175893}		{'mdp.39015065298146'}	{'Description and travel'}	The unchanging East	
Lawson Henry	B4801	{6816140}		{'nyp.33433074873054'}	{'English fiction'}	Joe Wilson and his mates	
Ward Mary Augusta	B8767	{6836603}		{'uc2.ark+=13960=t1zc80754'}	{'English fiction'}	The case of Richard Meynell	
MacGill Patrick	B5231	{2435699, 9112390}	{'Historical fiction'}	{'inu.39000000391446', 'nyp.33433074875596'}	{'Boardinghouses', 'Glasgow', 'Women immigrants', 'Scotland', 'Prostitutes', 'Irish', 'Poor women'}	The ratpit	
Johnston Mary	B4250	{8925364}		{'mdp.39015063920121'}	{'Constitutional period, 1789-1809', 'History'}	Lewis Rand	
Hume Fergus	B4080	{8957429}		{'nyp.33433074861927'}		The harlequin opal a romance	
Bryce Catherine T Catherine Turner	B551	{3181452}		{'nyp.33433069241671'}	{'Readers'}	Robert Louis Stevenson reader	
Brady Cyrus Townsend	B554	{3219463}		{'nyp.33433074797899'}	{'b. 1887', 'Brady, Cyrus Townsend'}	Web of steel	
Gould Frederick James	B3433	{6838455}		{'wu.89097490858'}		Stories for moral instruction 	
Wilson Richard	B8481	{3193361}		{'mdp.39015002199639'}	{'Mythology, Slavic', 'Juvenile literature'}	The Russian story book containing tales from the songcycles of Kiev and Novgorod and other early sources	
Cunningham Allan	B1461	{9149739}		{'njp.32101068166592', 'njp.32101068166618'}	{'English fiction'}	Lord Roldan a romance	
James Henry	B4355	{8876793, 6792195}	"{'Autographs (Provenance)', 'Bookplates (Provenance)', ""Publishers' cloth bindings (Binding)"", 'Novel', 'England'}"	{'uc2.ark+=13960=t3319sx79'}	{'Married people', 'Man-woman relationships', 'English fiction', 'United States', 'England'}	The sacred fount	
Zangwill Louis	B9071	{8890410, 6803844, 6803663}		{'nyp.33433075861207'}	{'English fiction'}	Ones womenkind  a novel	
Haggard H Rider Henry Rider	B3471	{6429844}	{'Bibliographies'}	{'coo.31924013476480'}	{'Africa', 'Hunting guides', 'Treasure troves', 'Missing persons', 'Adventure and adventurers'}	King Solomons mines	
Scott Walter Sir	B7874	{5017772}	{'Bibliographies'}	{'nyp.33433075744494'}		Woodstock or The cavalier  A t	
Henty G A George Alfred	B4155	{3174288}	{'Juvenile audience'}	{'uc2.ark+=13960=t4mk67377'}		In the heart of the Rockies	
Mackenzie Donald A Donald Alexander	B5251	{3204548}		{'mdp.39015007010823'}	{'Scotland', 'Legends', 'Folklore'}	Wonder tales from Scottish myth  legend	
Lytton Edward Bulwer Lytton Baron	B4928	{5143483, 5837148}	{'Bibliographies'}	{'uc2.ark+=13960=t07w6gd3t'}		The pilgrims of the Rhine	
Roscoe Thomas	B6939	{5175032}		{'mdp.39015066645402'}	{'Italian fiction', 'Translations into English'}	Tales of humour gallantry  romance selected and translated from the Italian	
Hughes William	B3624	{4975855}		{'njp.32101068171188', 'njp.32101068171196', 'njp.32101068171204'}		The three students of Grays inn a novel	
Belloc Hilaire	B378	{3230017}		{'mdp.39015030735503'}	{'20th century'}	But softwe are observed	
Jolly Emily	B4276	{9158761, 8714795}		{'uiuo.ark+=13960=t0ht34m31', 'uiuo.ark+=13960=t71v6158f', 'nyp.33433074865274'}	{'English fiction', 'Fiction, English'}	Bond and free	
Edgar John G John George	B2567	{9430831}		{'njp.32101068177532'}	{'English fiction'}	Runnymede and Lincoln Fair A story of the Great Charter	
Doudney Sarah	B2375	{9179728}		{'uiuo.ark+=13960=t0jt01623', 'uiuo.ark+=13960=t7rn3hn1f'}		A romance of Lincolns Inn	
Vowell Richard Longeville	B8374	{8684523}		{'nyp.33433081691606'}	{'Description and travel', 'Wars of Independence, 1806-1830', 'History'}	Campaigns and cruises in Venezuela and Ned Grenada and in the Pacific ocean from 18171830 with the narrative of a march from the river Orinoco to San Buenaventura on the coast of Chocò and sketches of the west coast of South America from the gulf of California to the archipelago of Chilöe Also Tales of Venezuela illustrative of revolutionary men manners and incidents	
James G P R George Payne Rainsford	B4205	{4963727}		{'hvd.32044086829090'}	{'Stuart, Arabella', '1575-1615', 'American fiction', 'Lady'}	Arabella Stuart  a romance from English history	
Hickins Michael	B4103	{8999401, 8437741}	{'Short stories'}	{'mdp.39015061017847'}		The actual adventures of Micha	
Bremer Fredrika	B716	{8972730, 8427227, 8473431}	{'ContainsBiogMaterial'}	{'nyp.33433075822365'}		The presidents daughters  A narrative of a governess	
Harrison Burton Mrs	B3940	{3169689}		{'uc2.ark+=13960=t7mp4w713'}	{'Short stories, American'}	Short stories	
Madame de Witt Henriette Elizabeth	B5367	{8664530}	{'Juvenile audience'}	{'njp.32101068975562'}		A French country family	
Wilson Harry Leon	B8661	{3208292}		{'nyp.33433076063050'}	{'Cowboys'}	Ma Pettengill	
Le Fanu Joseph Sheridan	B5085	{9426864, 4855285}		{'nyp.33433074877907'}		Guy Deverell  a novel	
Parker Eric	B6513	{6797692, 3179564, 6778493, 8881591}		{'nyp.33433075748891'}	{'English fiction'}	The sinner and the problem	
Mitchell S Weir Silas Weir	B5809	{8876216}		{'uc2.ark+=13960=t9j38m53f', 'uva.x004529539'}	{'Social problems'}	The autobiography of a quack	
Sidgwick Frank	B7431	{6802964, 8927253}		{'njp.32101064632415'}	{'English fiction'}	Love and battles	
Fowler Ellen Thorneycroft	B2767	{9223056, 6797079}		{'nyp.33433075728026'}	{'English fiction'}	Concerning Isabel Carnaby	
Ford Paul Leicester	B2840	{3265884, 8845613}	{'Bibliographies'}	{'uc2.ark+=13960=t0bv7b085'}		The honorable Peter Stirling and what people thought of him	
Harte Bret	B3804	{3265551}		{'uc1.b3123747'}	{'Western stories', 'American fiction'}	Tales of trail and town	
Saunders John	B7773	{9472002, 4362189}		{'uiuo.ark+=13960=t8bg39q1p', 'uiuo.ark+=13960=t0tq6j72g'}	{'823SA8M'}	Martin Pole	
Von Arnim Elizabeth	B8380	{3169992}	{'Juvenile audience', 'Juvenile literature'}	{'uc1.31822038204905'}		The April babys book of tunes  with the story of how they came to be written	
Caine Hall Sir	B1941	{6724682}		{'mdp.39015063913662', 'mdp.39015063913647'}		The deemster  a romance	
Carey Rosa Nouchette	B1473	{8667647}		{'nyp.33433034410054'}	{'English fiction'}	Nellies memories a domestic story	
DAnnunzio Gabriele	B2428	{6818700}		{'mdp.39015053517044'}		The flame of life  a novel	
Robinson Emma	B7151	{4961880, 5835003}		{'uiuo.ark+=13960=t2b85x75t', 'uiuo.ark+=13960=t17m0xn5j', 'uiuo.ark+=13960=t2z32g92m'}	{'Restoration, 1660-1688', 'Charles II, 1660-1685', 'History', 'Great Britain'}	Whitefriars or The days of Charles the Second	
Orton Helen Fuller	B6261	{3197402}	{'Juvenile audience'}	{'mdp.39076002155484'}	{'Horses', 'Juvenile fiction', 'Farm life', 'Dogs'}	Prince and Rover of Cloverfield farm	
Cox George W George William	B1812	{2696129, 8520482, 8689924, 2469660}		{'uc2.ark+=13960=t9g450j6z'}	{'Heldensage', 'Germanic peoples', 'Germany', 'Legends', 'Folklore'}	Tales of the Teutonic lands	
Lawrence D H David Herbert	B4957	{8942801, 2436302, 6831927}	{'Bibliographies', 'ContainsBiogMaterial'}	{'uc2.ark+=13960=t4hm5k49t'}		The white peacock	
Gore Catherine Grace Frances Mrs	B3014	{5011213, 8634279}		{'mdp.39015009219950', 'mdp.39015009219802'}	{'823G66TW'}	The two aristocracies  a novel	
Gwynne Talbot	B3122	{5863122, 9042307}		{'nyp.33433074862560'}	{'English fiction'}	The school for fathers An old English story	
Alexander Mrs	B61	{9452037}		{'nyp.33433034410880'}	{'English fiction'}	Look before you leap a novel	
Gissing George	B3103	{3257589}	{'Bibliographies'}	{'nyp.33433074856315', 'nyp.33433074856307', 'nyp.33433074856299'}	{'Queen of Great Britain', 'Jubilee, 1897', '1819-1901', 'Victoria'}	In the year of jubilee	
Wells H G Herbert George	B8520	{2450304, 8938992, 3205203}	{'NotBiographical'}	{'mdp.39015054040400'}		The new Machiavelli	
Hawthorne Nathaniel	B3660	{6252765, 8640526}		{'nyp.33433074853031'}		Transformation  or The romance of Monte Beni	
Wyss Johann David	B8928	{6829032}	"{'Juvenile audience', ""Publishers' advertisements"", 'NotBiographical', 'Novel', 'Imaginary voyages', 'Juvenile literature', 'Presentation inscriptions (Provenance)'}"	{'mdp.39015078574335', 'mdp.39015078574327'}		The Swiss family Robinson or A	
Sturgis Howard Overing	B7612	{3145608}		{'uc1.b3550807'}	{'Biography', 'Women comedians', 'Correspondence, reminiscences, etc', 'Crofts, Sibyl'}	All that was possible being the record of a summer in the life of Mrs Sibyl Crofts comedian	
Masefield John	B5341	{2452060}		{'miua.0633020.0001.001'}		The midnight folk a novel	
Wharton Edith	B8764	{3184233, 6748866, 2446036, 2439391}	{'Bibliographies'}	{'uc2.ark+=13960=t1sf2mx9b'}	{'Married people', 'Social life and customs', 'Rural poor', 'New England', 'Farm life'}	Ethan Frome	
Conner Rearden	B1661	{3233517}		{'uc1.$b56405'}	{'1920-', 'History'}	Shake hands with the devil	
Alcott Louisa May	B152	{8535256}	{'Erotic stories', 'Psychological fiction'}	{'uc2.ark+=13960=t2t43jd3r'}	{'Control (Psychology)', 'Man-woman relationships', 'Manipulative behavior'}	A modern Mephistopheles	
Brownell Elizabeth B	B726	{3190790}		{'nyp.33433082498191'}	{'Children in art', 'Children in literature'}	Dream children	
Petrovitch Woislav M	B6449	{8961549}		{'mdp.39015008931498'}	{'Social life and customs', 'Yugoslavia', 'Legends', 'Folklore', 'Serbia'}	Hero tales and legends of the Serbians	
Herrick Robert	B3996	{6798166, 9028236, 8981238}		{'wu.89073539553'}	{'Social problems'}	The common lot	
James Lionel	B4316	{6798780}		{'nyp.33433082442447'}	{'Russo-Japanese War, 1904-1905'}	The yellow war	
Marryat Frederick	B5426	{8422590}		{'nyp.33433074881032'}	{'English fiction'}	Valerie an autobiography	
Crockett S R Samuel Rutherford	B1772	{3256218}	{'Novel'}	{'uc2.ark+=13960=t6g15zs5b'}		The lilac sunbonnet	
George Baskerville Baskerville Rosetta Gage Harvey Mrs	B3024	{3222383}		{'mdp.39015031992624'}	{'Uganda', 'Folklore'}	The king of the snakes and other folklore stories from Uganda	
Hodson James Lansdale	B3779	{2484868}		{'uc1.$b300889'}	{'World War, 1914-1918'}	Grey dawnred night	
Eastman Charles Alexander	B2547	{6809928}		{'mdp.39015008812920'}	{'Dakota Indians', 'Legends'}	Red hunters and the animal peo	
Antin Mary	B19	{8848414}	{'Autobiography'}	{'mdp.39015008221700'}	{'Russians', 'Boston', '1881-1949', 'Massachusetts', 'IsBiographical', 'Russia', 'Social life and customs', 'Antin, Mary'}	The promised land	
Lyttelton Edith Sophy Balfour	B4812	{3172492, 8842167}		{'nyp.33433074875414'}	{'English fiction'}	The touch of sorrow a study	
Murray Charles Augustus Sir	B5510	{8377151}		{'nyp.33433074911037', 'nyp.33433074911045', 'nyp.33433074911029'}	{'English fiction', 'Indians of North America', 'Northwest, Pacific', 'Nebraska', 'Kansas'}	The prairiebird	
Pinsent Ellen Frances Parker	B6548	{6780701}		{'nyp.33433075766380'}	{'English fiction'}	Job Hildred artist and carpent	
Edmond Amanda M Corey	B2649	{6146378, 4448540, 4700727}	{'Juvenile audience'}	{'njp.32101063603946'}		Forget me not a gift for Sabba	
Browne Belmore	B1155	{3315379, 3197735}	{'Juvenile audience'}	{'nyp.33433074815162'}		The quest of the Golden Valley	
Jesse F Tennyson Fryniwyd Tennyson	B4209	{3224186}		{'inu.39000002601198'}		The Solange stories	
Johnston Mary	B4358	{3275461}		{'uc2.ark+=13960=t3st7f68m'}	{'United States', 'History', 'Civil War, 1861-1865'}	Cease firing	
Thompson Leigh	B8247	{3211634}		{'wu.89006523229'}	{'Rebellion, 1914-1915', 'History'}	The lion and the adder  a story of the South African rebellion	
MarshCaldwell Anne	B5417	{5870939, 8619876}		{'nyp.33433074880521', 'nyp.33433074880539'}	{'823M355HE'}	The heiress of Haughton  or The mothers secret	
Smythies Gordon Mrs	B7769	{4972256}		{'uiuo.ark+=13960=t87h27b6c', 'uiuo.ark+=13960=t0ht38h97', 'uiuo.ark+=13960=t23b6pk6s'}	{'823SM9B'}	The breach of promise	
Gore Catherine Grace Frances Mrs	B3206	{4414818}		{'uc1.b3322533', 'uc1.b3322535', 'uc1.b3322534'}		Peers and parvenus  a novel	
Thackeray William Makepeace	B8159	{6250503, 8622119}		{'uc1.b3445494'}	{'Dictionaries, indexes, etc', 'Thackeray, William Makepeace', '1811-1863'}	The Newcomes memoirs of a most respectable family	
Synge J M John Millington	B7450	{6711828}		{'nyp.33433067297477'}	{'Travel', 'Description and travel', '(John Millington)', 'Aran Islands (Ireland)', '1871-1909', 'Ireland', 'Synge, J. M', 'IsBiographical', 'Aran Islands'}	The Aran Islands	
Wilhelm Richard	B8811	{3212129}		{'uc2.ark+=13960=t79s1p389'}	{'China', 'Legends', 'Fairy tales'}	The Chinese fairy book	
Fitchett W H William Henry	B2760	{8910747}		{'nyp.33433075727135'}	{'Revolution, 1789-1799', 'Napoleon', 'History', '1769-1821', 'Emperor of the French'}	A pawn in the game	
Dickens Charles	B2221	{4444870}	{'Ghost stories', 'Juvenile audience', 'Christmas stories'}	{'nyp.33433074954482'}	{'London (England)', 'Poor families', 'Misers', 'Ghost stories', 'Scrooge, Ebenezer (Fictitious character)', '19th century', 'Juvenile fiction', 'Sick children', 'Christmas stories', 'Social life and customs'}	A Christmas carol in prose The chimes The cricket on the hearth	
Grinnell George Bird	B3421	{8800346}		{'inu.30000055882736'}		Pawnee hero stories and folkta	
Senior Dorothy	B7332	{3183206}		{'mdp.39015004153261'}	{'1214?-1294', 'Thomas of Reading', 'Bacon, Roger', 'George a Green'}	Some old English worthies	
Garland Hamlin	B3166	{8957810}		{'nyp.33433081919981'}	{'(OCoLC)fst00921052', 'Farm life', 'Iowa', 'Prairies', '(OCoLC)fst01205835', '(OCoLC)fst00935370', 'Frontier and pioneer life', 'Social conditions'}	Boy life on the prairie	
Manning Anne	B5854	{9427420}		{'uiuo.ark+=13960=t7br99p7w', 'uiuo.ark+=13960=t9t15j031'}	{'823M316ME'}	Meadowleigh a tale of English country life	
Connor Ralph	B1362	{6779420, 8891965, 6747103}	"{""Publishers' cloth bindings (Binding)"", 'Illinois', 'Chicago'}"	{'mdp.39015012342070'}		The man from Glengarry  a tale of the Ottawa	
Black William	B792	{8802249}		{'uc1.b3321705'}	{'Nature', 'Social life and customs', 'Country life'}	Briseis	
Holmes Oliver Wendell	B3831	{4362019, 8780227}	{'ContainsBiogMaterial'}	{'uc1.b4103181'}		The guardian angel	
Ford Ford Madox	B2831	{3175021, 9049838, 6823150}		{'uc1.b3346918'}	{'Queen, consort of Henry VIII, King of England', '-1542', 'Catharine Howard'}	The fifth queen crowned  a rom	
Author of No appeal	B193	{8791035}		{'uiuo.ark+=13960=t0ht30x6v', 'uiuo.ark+=13960=t89g61j5w', 'uiuo.ark+=13960=t2m61wd3z'}	{'823G3112'}	Gerald Hastings of Barton	
Craik Dinah Maria Mulock Mrs	B1456	{2743286}	{'Juvenile audience'}	{'njp.32101067709913'}	{'Fairies', 'Juvenile literature'}	The adventures of a brownie as told to my child	
Zschokke Heinrich	B9069	{4974267}		{'nyp.33433075735591'}	{'German fiction'}	Tales from the German of Heinrich Zschokke	
Warren Robert Penn	B8696	{3209712}	{'Political fiction', 'Allegories'}	{'uc1.32106002152723'}	{'Politicians'}	All the kings men	
Banim John	B1169	{5124430, 8920550}	{'War stories', 'Historical fiction'}	{'wu.89087923983', 'wu.89087924015'}		The croppy A tale	
Mott Frederick B Frederick Blount	B5543	{8906377, 6833201}		{'nyp.33433076045578'}	{'1800-1859', 'Brown, John'}	Before the crisis	
Cobban J Maclaren James Maclaren	B1571	{6774322}		{'nyp.33433074947007'}	{'English fiction'}	The angel of the covenant  memoirs of the early career of the admirable James Graham	
Ainsworth William Harrison	B74	{6100869}		{'nyp.33433074919345'}	{'1706-1739', 'Turpin, Richard'}	Rookwood  a romance	
Moore George	B5981	{8961362, 6796996, 6830469}		{'uc2.ark+=13960=t3xs5xp4w'}		Sister Teresa a novel	
Lewis Sinclair	B4713	{2490309}		{'mdp.39015000636095'}	{'Women socialists', 'Feminists', 'United States', 'Women social workers'}	Ann Vickers	
Sherwood Mary Martha 17751851 Mrs	B7313	{5219176, 5138217, 5227661, 5149656, 5216921, 5222879}	{'Juvenile audience'}	{'inu.30000007063377'}	{'Catholic Church', 'Controversial literature', 'Apologetic works', 'Protestantism', 'Juvenile literature'}	Victoria	
Gunter Archibald Clavering	B3155	{8804055}		{'nyp.33433076088214'}		Baron Montez of Panama and Paris a novel	
Ainsworth William Harrison	B174	{5180548, 4412415}		{'uc2.ark+=13960=t6g16058h'}	{'Queen, consort of Henry VIII, King of England', 'Anne Boleyn', '1507-1536', 'Tudors, 1485-1603', 'Great Britain', 'History'}	Windsor castle	
Courtney W L William Leonard	B1338	{3198112, 6822667}		{'inu.30000010414443'}		The soul of a suffragette and other stories	
Iota	B4181	{3161237}	{'Dime novels'}	{'nyp.33433074938634'}		Children of circumstance  a no	
StenbokFermor Aleksandr Vasīlʹevīch Graf	B7556	{3248463}		{'uc1.$b240292'}	{'Coal miners', 'Germany', 'Ruhr Valley'}	My experiences as a miner	
Collins Charles Allston	B1413	{9444434}		{'mdp.39015063868767'}	{'Description and travel'}	A cruise upon wheels the chronicle of some autumn wanderings among the deserted postroads of France	
Abbott Jacob	B286	{9108226}	{'Juvenile audience'}	{'njp.32101068162302'}		Beechnut a Franconia story	
Scott Walter Sir	B7462	{8214440, 5379912}		{'nyp.33433075744270'}	{'Third, 1189-1192', 'Crusades'}	Tales of the crusaders	
Palgrave Francis Turner	B6628	{8510037}	{'Juvenile audience'}	{'uc1.b4104032'}		The five days entertainments at Wentworth Grange	
Hall S C Mrs	B3687	{6191148, 5225751}		{'nyp.33433074862743'}	{'Women', 'Irish fiction'}	Tales of womans trials	
Ralston William Ralston Shedden	B7109	{8707258}		{'uc2.ark+=13960=t6h12xp29', 'wu.89016623191'}	{'Folklore', 'Soviet Union', 'Ghosts'}	Russian folktales	
Andersen H C Hans Christian	B208	{8716369}	{'Juvenile audience'}	{'nyp.33433082526082'}		Wonderful stories for children	
Perlesvaus	B6502	{8847354}		{'njp.32101072889726'}	{'Romances', 'Grail', 'Arthurian romances', 'Edition Perceval', 'Legends'}	The high history of the Holy Graal	
Crockett S R Samuel Rutherford	B1959	{8987574, 6799846}		{'mdp.39015063547346'}		The silver skull a romance	
Gaskell Elizabeth Cleghorn	B3112	{4455582}	{'NotBiographical'}	{'nyp.33433074857503'}		Right at last and other tales	
Bennett Arnold	B390	{6811339, 8917325, 3186503}		{'mdp.39015031224101'}		Sacred  profane love a novel in three episodes	
Clifford Hugh Charles Sir	B1613	{9251404, 6798406}		{'nyp.33433074966668'}		A free lance of today  a novel	
Lincoln Joseph Crosby	B4750	{6841933}		{'mdp.39015063923927'}	{'Social life and customs', 'Cape Cod (Mass.)', 'Brewster (Mass.)'}	Our village	
Jackson Gabrielle E Gabrielle Emilie	B4220	{3175776}		{'mdp.39015008897079'}	{'Girls'}	Mother and daughter	
Mathew Frank James	B5430	{8851353, 3180363, 6760780}		{'nyp.33433074892526'}	{'English fiction'}	A child in the temple a novel	
Strowska Suzanne	B7372	{3230818}		{'mdp.39015039686574'}	{'Poland', 'Tales'}	Ten Polish folk tales	
Crockett S R Samuel Rutherford	B1594	{3434210, 6797195, 6770383}		{'nyp.33433074949904'}	{'Covenanters', '17th century', 'History'}	The standard bearer	
Parker Gilbert Sir	B6751	{8880677}	{'Canadian fiction'}	{'mdp.39015063945763'}		The right of way  a novel	
Russell William Clark	B7246	{3423912, 3169117}		{'mdp.39015063953957'}		The romance of a transport	
King Edward	B4664	{9381285}		{'uc1.b4380115'}		Joseph Zalmonah a novel	
Bourne George	B550	{6118478}		{'nyp.33433068297393'}	{'Canada', 'Convents'}	Lorette The history of Louise daughter of a Canadian nun exhibiting the interior of female convents	
Montagu Violette M	B5236	{6847150}		{'loc.ark+=13960=t4rj54j5c'}	{'Mme', 'Friends and associates', 'Court and courtiers', 'Biography', 'France', '1789-1815', 'Napoleon', '1769-1821', 'Nobility', '1752-1822', '(Jeanne-Louise-Henriette)', 'Campan', 'Louis XVI, 1774-1793', 'IsBiographical', 'History', 'Emperor of the French'}	The celebrated Madame Campan	
Bell Catherine D Catherine Douglas	B620	{8605074}		{'nyp.33433074927330'}	{'Scottish authors', 'English fiction'}	Hope Campbell or Know thyself	
Hope Anthony	B3620	{3174213}		{'njp.32101068169638'}	{'Fiction (English)', 'English fiction'}	The Dolly dialogues	
Lubbock John Sir	B4740	{6437827}		{'mdp.39015059390024'}	{'Pleasure', 'Conduct of life'}	The pleasures of life	
L E L Letitia Elizabeth Landon	B4744	{4699724, 8886566}		{'mdp.39015063558020', 'mdp.39015063558038'}	{'823L236E'}	Ethel Churchill or The two brides	
